,text,chars,words,tokens
0,"Dear Hiring Manager,

I am writing to express my interest in the Data Scientist position currently available at your company. As a highly motivated and enthusiastic individual, I am eager to bring my skills and passion for data science and artificial intelligence to your team.

Throughout my academic and professional career, I have gained valuable experience in machine learning, data analysis, and data visualization. I am confident that these skills will enable me to contribute to the success of your organization. Furthermore, I have a voracious appetite for learning, and I am eager to expand my knowledge in the field of data science.

Beyond my professional interests, I am passionate about sports and have a keen interest in how data science can be leveraged to improve athletic performance. This passion has fueled my dedication to developing my analytical skills and has given me a unique perspective on how data can be applied to solve real-world problems.

I believe that I possess the combination of technical expertise and passion for the field that would make me an ideal candidate for the Data Scientist position at your company. Thank you for your consideration, and I look forward to the opportunity to discuss my qualifications further in an interview.

Sincerely,
[Your Name]",1297,209,234
1,"Dear [Hiring Manager],

I am writing to apply for the position of Data Scientist at [Company]. As a recent graduate in Computer Science, I am highly motivated to pursue a career in the field of Data Science. With a passion for both Artificial Intelligence and sports analytics, I am confident that my skills and interests align well with the goals of your growing organization.

Throughout my academic career, I have gained valuable experience in data analysis, database management, and machine learning. I have also worked on several projects involving neural networks and natural language processing. These experiences have equipped me with the technical and analytical skills necessary to succeed in the field of data science.

Beyond my technical abilities, I am a highly motivated and enthusiastic problem solver. I am eager to learn from experienced professionals in the field and to contribute my own unique perspective and creativity to the team. My passion for both AI and sports has led me to explore opportunities for merging these two fields in creative and valuable ways.

If given the opportunity, I am confident that I can make a meaningful contribution to the team at [Company] and help drive the organization's success in the data-driven world. Thank you for considering my application. I look forward to the possibility of discussing my qualifications further.

Sincerely,

[Your Name]",1403,223,254
2,"Dear Hiring Manager,

I am extremely excited to apply for the Data Scientist position at your company. I have always been passionate about using data to drive impactful decisions, and I am eager to bring my skills and experience to your team.

As a data scientist, I am confident in my ability to design and implement effective data models, analyze complex data sets, and communicate insights to diverse stakeholders. I have experience collaborating with cross-functional teams to develop and implement strategies that drive business growth and operational efficiency.

What sets me apart is my deep interest in artificial intelligence and my lifelong passion for sports. As someone who enjoys both fields, I believe I could bring a unique perspective to your team's work. I am always eager to learn and stay up to date on the latest trends and technologies in data science, and I am confident that I would thrive in your fast-paced, dynamic environment.

Thank you for considering my application. I am looking forward to the opportunity to speak with you further about my qualifications and how I can contribute to your team's success.

Best regards,

[Your name]",1164,190,214
3,"Dear [Hiring Manager],

I am writing to express my interest in the Data Science position at [Company]. With a solid background in data analysis and a passion for AI, I am enthusiastic about the possibility of joining your team.

I have completed my studies in data science, and I have had the opportunity to apply my knowledge and skills to real-world problems through internships and projects. These experiences have allowed me to develop a comprehensive understanding of data modeling, visualization, analysis, and reporting. I am particularly excited about the potential of AI in this field and how it can be used to improve decision-making processes and drive business growth.

Aside from my professional interests, sports are one of my passions. I believe that the combination of sports and data analytics can yield incredible insights and drive progress. I am thrilled that [Company] is actively involved in this space, and I would be honored to contribute my knowledge and expertise to the team.

As a motivated individual who is eager to learn and grow, I believe that I can make a significant contribution to your organization. I am confident that my technical skills, personality, and enthusiasm would be a good fit for your team.

Thank you for your consideration, and I am looking forward to discussing how I can contribute to your organization.

Sincerely,

[Your Name]",1382,225,260
4,"Dear Hiring Manager,

I am excited to apply for the Data Scientist position at your company. As someone who is highly motivated and eager to learn, I believe that I would make a valuable addition to your team.

I am passionate about the field of data science and have pursued various projects in the past that have allowed me to develop a strong foundation of skills and knowledge. In particular, I have a keen interest in artificial intelligence, as I believe that it has the potential to revolutionize the way that we approach many different applications.

One of my other passions is sports. I enjoy analyzing data related to various athletic activities, and I have even worked on projects related to the application of machine learning and predictive analytics in the sports industry. These experiences have allowed me to develop a unique perspective on the intersection between data science and sports, which I believe would be beneficial to your company.

I am confident that my skills, combined with my passion for data science, would make me an asset to your team. If given the opportunity, I would work tirelessly to help your company achieve its goals and take on new challenges.

Thank you for considering my application. I look forward to hearing back from you soon.

Sincerely,
[Your Name]",1302,219,244
5,"Dear Hiring Manager,

I am writing to express my strong interest in the Data Science position available at your company. As an individual who is highly motivated and eager to learn, I am confident that I possess the skills and experience necessary to excel in this role.

Data Science has always been an area of great passion for me, and Artificial Intelligence is a field that fascinates me immensely. I am constantly exploring new topics in data science to expand my knowledge, and I am excited to have the opportunity to work with some of the brightest minds in the field.

In addition to my technical skills, I am a dedicated and driven individual with a passion for sports. I believe that my love for sports has taught me important life skills such as teamwork, discipline and persistence which I believe are essential for success in any industry, and I am excited to bring these skills to the job.

I am confident that my technical skills, passion for AI and sports, team-oriented mindset, and eagerness to learn would make me a great addition to your team. Thank you for considering my application. I look forward to the opportunity to discuss my qualifications and enthusiasm for this position further.

Sincerely,
[Your Name]",1234,211,238
6,"Dear Hiring Manager,

I am excited to apply for the Data Scientist position at your company. Your reputation for innovation and your commitment to excellence in everything you do is truly inspiring, and I am eager to join your team.

As a highly motivated individual, I have always been passionate about data science and the endless possibilities it presents. With my strong academic background in mathematics and my experience working with data sets for various projects, I have developed a deep understanding of statistical modeling, data mining, and machine learning.

AI has always fascinated me because of the limitless potential it presents for transforming industries and improving quality of life. I am eager to leverage my skills in data science to contribute to your cutting-edge projects related to this field. I believe I can make a positive impact in your team through my willingness to learn, strong collaboration skills and ability to think creatively when facing complex problems.

Beyond my interest in data science, sports have always been a passion of mine. I am currently competing in triathlons, and I believe that my competitive spirit, teamwork skills, and ability to perform well under pressure in athletics can be transferred into my work in data science.

I am thrilled to have the opportunity to apply for this position at such an amazing company, and I thank you for taking the time to consider my application. I am excited to discuss how my skills and my passion for AI can make a valuable contribution to your team's success.

Thank you for your time and consideration.

Sincerely,

[Your Name]",1624,266,299
7,"Dear Hiring Manager,

I am writing to express my strong interest in the Data Scientist position at your company. As a recent graduate in Statistics with a minor in Computer Science, I am excited about the opportunity to apply my skills and knowledge in a dynamic and challenging environment.

One of my areas of interest includes AI, which I believe has vast potential to drive major advancements across many industries. With a combination of analytical insight and coding abilities, I am confident I can contribute to the development and implementation of innovative solutions.

Additionally, I am passionate about sports and can see great potential for the intersection of data science with sports analytics. Understanding how to extract insights from large data sets can be game-changing for taking strategic decisions for teams, coaches, and broadcasters.

I am a self-starter, detail-oriented, and eager to learn new things. My academic and professional experiences have equipped me with strong problem-solving and critical thinking skills, as well as excellent communication and collaboration abilities.

I believe that my background and interests align with your company's mission and vision, and I am thrilled at the possibility of being part of such a dynamic and innovative team. I look forward to the opportunity to discuss further how I can add value to your organization.

Thank you for considering my application.

Sincerely,

[Your name]",1452,225,257
8,"Dear [Hiring Manager],

I was thrilled to come across the opportunity to apply for the Data Scientist position at [Company Name]. As a highly motivated and analytical individual, I am confident that my skills and experience make me a perfect candidate for this role.

My passion for AI and data science has been fostered through my educational background, consisting of a degree in Mathematics and a Masters degree in Data Analytics. Coupled with my previous experience in data analysis, I have developed a strong foundation in statistical analysis, machine learning, and data visualization. I am extremely eager to apply these skills in a professional environment, and to continue learning and growing within the field.

Additionally, I am an avid sports enthusiast, and I believe this passion for sports has helped me develop an understanding of how analytics can be used to inform and improve performance. I am eager to combine my knowledge of data science with my love of sports to deliver meaningful insights and help drive decision making.

I am excited by the opportunity to join the innovative team at [Company Name] and believe that my skills and motivation would make a valuable contribution to your data science team. Thank you for considering my application. I look forward to the opportunity to further discuss my qualifications and demonstrate why I would be an exceptional addition to your organization.

Sincerely,
[Your Name]",1442,232,262
9,"Dear Hiring Manager,

I am writing to express my strong interest in the Data Science position at your esteemed organization. As a highly-motivated individual with a deep passion for AI and a love for sports, I am confident that my skill set and experience make me a strong candidate for the position.

Throughout my academic career, I have excelled in data analysis and artificial intelligence coursework, demonstrating a strong understanding of various programming languages such as Python, R, and SQL. Additionally, through various internships and research opportunities, I have amassed practical experience in data analysis and machine learning, allowing me to effectively analyze data, develop models, and provide meaningful insights.

Furthermore, my love for sports has led me to be involved in several data-driven sports analytics projects which have given me the ability to analyze and forecast sport performance, and attain success in competitive environments. This industry-awareness combined with my technical skills enables me to identify issues and build solutions to optimize productivity with viable technology.

As a self-starter, I possess a strong work ethic and am eager to take on challenges that come with any new job. I am a quick learner and possess great communication skills, which allows me to work efficiently with colleagues and clients alike.

I would welcome the opportunity to discuss my candidacy with you further, and I am confident that I can make valuable contributions to your team. Thank you for considering my application.

Sincerely,
[Your name]",1584,243,283
10,"Dear Hiring Manager,

I am writing to express my interest in the Data Scientist position at your esteemed organization. With a passion for AI and a love of sports, I am certain that my skills and experience perfectly align with the job description you have posted.

I am a highly motivated individual with a strong passion for learning. Throughout my professional career, I have consistently sought to challenge myself and grow within a dynamic and innovative environment. By engaging with cutting-edge technology in the field of data science, I have developed an absolute fascination for utilizing data to drive outcomes and decision-making. As a result, I believe that I would be an ideal candidate for the role of Data Scientist at your organization.

Apart from my professional expertise, I am also passionate about sports. I believe that my interest in athletics has honed my ability to work well under pressure, stay focused on objectives, and strive for excellence. I am excited about the possibility of merging my passion for sports with my data science expertise, and to bring a valuable perspective to your organization.

In closing, I am eager to contribute my skill set and expertise to the team at your organization. I am confident that my ability to learn quickly, coupled with my experience at the crossroads of data science and sports, make me a strong candidate for the role of Data Scientist. Thank you for taking the time to consider my application.

Sincerely,

[Your name]",1493,247,279
11,"Dear Hiring Manager,

I am excited to apply for the Data Scientist position at your esteemed organization. It is with great interest that I submit my application, as I have a passion for data analysis and strive to make a positive impact on the world through innovative, data-driven decision-making.

As a data enthusiast, I am fascinated by how data mining and machine learning techniques can be utilized to improve business processes and bring about meaningful change. My experience with statistical analysis, artificial intelligence and data visualization tools, coupled with my strong analytical skills, make me a strong candidate for this role.

What differentiates me from other applicants is my passion for sports. My particular interest in basketball motivates me to work hard to gain insights into the statistical trends of the game. I have experience using data-driven insights to optimize player performance as well as analyze team performance.

I am eager to work in a team of experts and contribute my knowledge and skills to the company. I am also enthusiastic about learning new techniques, technologies and best practices from my colleagues. I am confident that my background and experience aligns perfectly with what you are looking for in a Data Scientist.

Thank you for your time and consideration. I am excited to hear back from you.

Sincerely,

[Your Name]",1379,220,250
12,"Dear Hiring Manager,

I am writing to express my deep interest in the Data Science position currently available at your esteemed organization. As a driven and determined individual with a passion for AI and sports, I bring a unique set of skills and abilities that I believe make me an ideal candidate for this role.

As a recent graduate with a degree in Data Science, I am eager to embark on my professional journey and develop my skills in a dynamic and challenging environment. I have always been fascinated by the potential of data to drive innovation and change, and I believe that your company's forward-thinking philosophy and commitment to excellence would be the perfect platform for me to fulfill my career aspirations.

In addition to my academic qualifications, I have also pursued a number of personal interests and hobbies that have shaped my professional outlook. As an avid sports fan, I have long been interested in the intersection of data and sports analytics, and have undertaken extensive research into various prediction models and algorithmic approaches. I believe that this experience has given me a unique perspective on the practical applications of Data Science, and I am excited to explore these further in a professional setting.

I am also an enthusiastic and quick learner, and have a proven ability to collaborate effectively with others. I am confident that I would flourish in a team environment and would relish the opportunity to contribute to your company's data-driven culture.

Thank you for considering my application. I am excited about the potential of joining your team and would love the opportunity to discuss my qualifications further.

Sincerely,

[Your Name]",1707,276,306
13,"Dear Hiring Manager,

I am thrilled to submit my application for the Data Science position at your esteemed organization. With a strong passion and background in AI and sports, I am confident that I can contribute to your team in a meaningful way.

As a motivated individual, I am always eager to learn and expand my horizons. I believe that a career in data science will allow me to do just that, and I am excited about the opportunity to grow within your organization. With a degree in computer science and experience in data analysis with Python, I am well-equipped to contribute and add value to your team.

In addition, I am particularly drawn to the intersection of AI and sports. The ever-increasing role technology plays in sports analytics fascinates me, and I am eager to delve deeper into this field. I am confident that my passion for both AI and sports will enable me to hit the ground running and excel in this position.

Thank you for considering my application. I welcome the opportunity to discuss my qualifications further and learn more about the Data Science position at your organization.

Sincerely,
[Your Name]",1133,194,221
14,"Dear Hiring Manager,

I am writing to express my keen interest in the Data Science job listing that was recently posted online. From reviewing the job requirements and qualifications, I feel confident that I possess the necessary skills, experience, and educational background that would make me an ideal candidate for this position.

I have a strong passion for data science, particularly in the fields of Artificial Intelligence and Machine Learning. I am eager to apply my theoretical knowledge and practical experience to help your organization achieve its strategic objectives. Additionally, I have a proven track record of developing and implementing effective data-driven solutions in a variety of industries.

One of my key strengths is my willingness to learn and adapt to new situations. I believe that a growth mindset is essential for success in the ever-evolving field of data science. I am also highly motivated to work towards continuous improvement, both personally and professionally.

On a personal note, sports are one of my major interests. I believe that my passion for sports has given me a unique perspective on the value of data and analytics in performance analysis and decision-making. I believe that this perspective, along with my technical skills and strong work ethic, will be an asset to your organization.

Thank you for considering my application. I look forward to the opportunity to contribute to your team and to learn from your organization's established leaders in data science.

Sincerely,

[Your Name]",1541,242,274
15,"Dear Hiring Manager,

I am thrilled to apply for the Data Science position at [Company Name]. With my solid academic background and experience in the field, combined with a fervent passion for AI and a love for sports, I am confident that I have the skills, motivation, and knowledge to excel in this role and make a positive impact on your team.

I earned a Bachelor's Degree in Mathematics with a focus on Data Science from [University Name], where I gained comprehensive knowledge in big data, statistical modeling, and algorithm design. As a data analyst for a top marketing firm, I honed my data visualization and communication skills, presented complex findings to diverse audiences, and delivered key insights for business growth. During my tenure, I led a project that improved customer engagement by 30% through targeted marketing campaigns, which led to my nomination for the ""Employee of the Year"" award.

At the same time, my passion for AI and sports has inspired me to explore applications in data science such as creating predictive models, analyzing game statistics, and developing fitness tracking applications. I have participated in projects with a team of AI researchers that were focused on making individualized training programs based on athletes' biometric data.

I am eager to join your team at [Company Name] and bring these skills, experiences, and passions to contribute to your projects and goals. I promise to bring a dedicated, positive spirit, a strong work ethic, and a willingness to learn, adapt and collaborate with others.

Thank you for considering my application. I look forward to the opportunity to speak with you in more detail about my qualifications for this role.

Sincerely,

[Your Name]",1733,280,331
16,"Dear Hiring Manager,

I am writing to express my interest in the Data Science position at your company. With a strong educational background in data analysis and a passion for the field, I am confident that I am a suitable candidate for the role.

Throughout my academic and professional career, I have gained extensive experience in data manipulation, cleaning, analysis, and visualization. I have also been trained in machine learning and predictive analytics. As a result, I am confident in my ability to apply these skills to provide insightful solutions to complex problems.

As a keen follower of the latest trends in Artificial Intelligence and Machine Learning, I am constantly exploring new ways to improve my theoretical and practical knowledge of these areas. I am excited about the opportunity to contribute to your team and learn alongside esteemed professionals in the industry.

In addition to my passion for data science, sports are my other major passion. Being a team player and having a competitive perspective come naturally to me, and these qualities lend themselves well to the fast-paced nature of data science.

As a highly motivated and committed individual, I strive to deliver results that exceed expectations. I am confident that I would be a valuable asset to your team and look forward to discussing my qualifications with you in further detail.

Thank you for considering my application.

Sincerely,
[Your name]",1442,231,259
