,text,chars,words,tokens
17,"Dear Hiring Manager,

I am excited to apply for the Data Science role at your company. As someone who is highly motivated and eager to learn, I believe I would be a strong asset to your team. I am passionate about data science, and I am particularly interested in exploring the intersection between artificial intelligence and sports.

As a data scientist, I have experience conducting statistical analyses, building predictive models, and cleaning and transforming data to identify relevant trends and insights. I have worked with a range of tools and programming languages including Python, R, SQL, and Tableau to provide actionable recommendations to stakeholders.

What sets me apart from other candidates is my unique background in sports. I have always had a love for sports, and I believe that my understanding of the intricacies of various sports from a player's perspective will enable me to identify key metrics that are relevant to a team's success. I am excited about the prospect of applying my data science skills to the world of sports and helping teams gain a competitive edge.

As a data scientist, I understand the importance of collaboration and communication. I enjoy working with teams of other data scientists and stakeholders to fully understand the problem at hand and work towards a successful solution. My passion for learning and exploring new ideas, combined with my strong analytical skills, make me an excellent candidate for this role.

Thank you for considering my application. I would be thrilled to contribute my skills and sports knowledge to your team.

Sincerely,
[Your name]",1612,260,294
18,"Dear Hiring Manager,

I am writing to express my interest in the Data Science position that your company has posted. As a highly motivated individual with a passion for AI and an eagerness to learn, I am confident that I would be a great fit for your team.

With a degree in Computer Science and experience in both academia and industry settings, I feel that I have the skills and knowledge necessary to excel in the Data Science field. In particular, I have a strong background in statistical analysis and machine learning, as well as experience working with large datasets.

What really sets me apart, however, is my passion for AI and sports. I have always been fascinated by the ways in which technology can help us better understand and improve upon our favorite athletic pursuits. Whether it's analyzing player performance, predicting game outcomes, or developing new training techniques, I believe that there is enormous potential for data science to revolutionize the sports industry.

If given the opportunity, I know that I could bring this enthusiasm and expertise to your company. I am a hardworking and adaptable team player with excellent communication skills, and I thrive in fast-paced environments where I can apply my creativity and problem-solving abilities.

Thank you for considering my application. I look forward to the opportunity to discuss my qualifications in further detail.

Sincerely,

[Your Name]",1427,230,263
19,"Dear [Hiring Manager],

I am writing to apply for the Data Science position that is currently open at [Company Name]. As a motivated and enthusiastic individual, I believe that I have the skills and experience necessary to excel in this role, and I am eager to contribute to your team.

Throughout my academic and professional experiences, I have developed a passion for data science, particularly in the field of artificial intelligence. I am fascinated by the ways in which data can be used to generate valuable insights and drive the decision-making process. In addition to my love for data science, I am also a dedicated sports enthusiast. I believe that my analytical skills can be put to great use in this industry, and I am excited about the prospect of working with sports data.

In terms of my qualifications, I recently completed a degree in mathematics and computer science, where I gained valuable experience working with statistical analysis, machine learning algorithms, and data visualization. Furthermore, I have worked on various data science projects for a range of organizations, including a sports data analysis project for a local soccer club.

As a detail-oriented and results-driven individual, I am confident that I would be an ideal candidate for the Data Science position at [Company Name]. I would be thrilled for the opportunity to work with your team, to contribute to your efforts, and to continue learning and growing in this exciting field.

Thank you for considering my application. I would welcome the opportunity to further discuss my qualifications in person.

Sincerely,
[Your Name]",1619,261,300
20,"Dear Hiring Manager,

I am writing to express my strong interest in the Data Scientist position available at your company. As an enthusiastic and dedicated data science professional, I am confident that I can make a significant contribution to your team.

I am passionate about the field of data science and have always been fascinated by the opportunities that artificial intelligence provides to improve the way we analyze and understand complex data sets. During my studies, I developed a deep understanding of programming languages such as Python and R, as well as the latest tools and technologies used in data science.

Beyond just academic qualifications, I have also developed an outstanding interest in sports. This has made me realize the vast potential that sports data analytics presents. With my passion and expertise in data science and sports, I am confident that I can help the team make better and informed strategic decisions that will ultimately drive success.

Having researched your company and its commitment to innovation and excellence, I believe that your team is the perfect place for me to continue developing my skills and contributing to meaningful projects. I am a fast learner, highly motivated, and work well under pressure, which makes me an excellent candidate for the Data Scientist position.

Thank you for considering my application. I look forward to hearing from you soon and having an opportunity to meet and discuss how I can contribute to your organization.

Sincerely,

[Your Name]",1524,244,269
21,"Dear Hiring Manager,

I am writing to express my interest in the Data Science position at your esteemed organization. As someone who has a deep passion for AI and the ability to make informed decisions through data, I am excited at the prospect of bringing my skills and knowledge to your team.

I am a motivated self-starter who is always eager to learn and grow in order to create value for the organization. Throughout my academic and professional journey, I have honed my analytical and problem-solving skills and have gained proficiency in statistical data analysis, machine learning, programming languages including Python, SQL, R, and data visualization tools like Tableau and Power BI. I am also well-versed in Big Data technologies like Hadoop, Spark, and Hive.

Data Science is not just a profession for me but also a passion. I have long been fascinated by how data can help us make informed decisions in various domains, be it business, healthcare, natural language processing, or any other field. It is this enthusiasm which enables me to constantly stay a step ahead of my peers and push the boundaries of what is possible.

Apart from work, sports have always been a major part of my life. I have been an active participant in various sporting activities, as well as a student of sports analytics. I believe that exploring the relationship between data and sports can uncover valuable insights that can help players, teams, and organizations make strategic decisions.

I am confident that my skills, experience, and enthusiasm to learn will make me an asset to your team. I would be grateful for the opportunity to discuss my candidacy further and demonstrate my skills in Data Science. Thank you for considering my application.

Sincerely,

[Your Name]",1768,292,338
22,"Dear Hiring Manager,

I am writing to express my deep interest in the Data Science role currently advertised within your organization. As an aspiring data scientist, I am eager to contribute my skills and experience to this exciting field.

Throughout my academic journey, I have gained in-depth knowledge and understanding of data science methodologies, including machine learning, data visualization, and statistics. I am confident that I possess the technical expertise and analytical skills necessary to excel in this role and add value to your organization.

Beyond my academic credentials, I have a strong passion for AI and its potential to drive innovation and transformation across industries. Furthermore, I am an avid sports enthusiast, which drives my interest in the application of data science techniques to sports analytics. I believe that my multifaceted background and personal interests add a unique perspective to the role of a data scientist.

With my proven track record of success, determination, and eagerness to learn, I am confident that I would make a valuable addition to your team. I look forward to contributing my specialized skills and experience to your organization while fostering professional growth and development.

Thank you very much for considering my application. I look forward to hearing from you soon.

Sincerely,
[Your Name]",1369,210,241
23,"Dear Hiring Manager,

With great enthusiasm, I am writing in response to the Data Scientist position currently available at your company. As an eager and motivated individual, I believe that my passion for artificial intelligence and sports could make a valuable contribution to your team.

I have recently completed my degree in Mathematics and Statistics with a focus on data science, and I am excited about the possibility of applying my knowledge and skills to real-world problems. I have extensive experience in data analysis and machine learning, and I believe that my proficiency in Python, R programming, and SQL will prove to be a valuable asset to your company.

Beyond my technical skills, I am passionate about the world of artificial intelligence and have invested countless hours in learning about the latest advancements in this field. I am always eager to learn more and explore new ways to use AI to solve complex problems. Additionally, my passion for sports has taught me the importance of teamwork, discipline, and perseverance, all of which I believe are critical qualities to succeed in any professional environment.

As a highly motivated and driven individual with a passion for data science, I believe I would be a great asset to your team. I would love the opportunity to contribute my skills to your organization and learn from some of the best in the field.

Thank you for taking the time to consider my application. I look forward to the opportunity to further discuss my qualifications with you.

Sincerely,
[Your Name]",1549,255,284
24,"Dear Hiring Manager,

I am excited to apply for the Data Science position at your company. As a motivated and passionate individual, I am confident that my skills, experience, and love for AI will make me an asset to your team.

My academic background in computer science and mathematics has given me a strong foundation in developing quantitative models, analyzing large data sets, and applying advanced statistical and machine learning algorithms. In my previous roles, I have successfully leveraged these skills to solve complex business problems, providing actionable insights through innovative data visualization and storytelling techniques.

I am constantly eager to learn new technologies and methods in this field, and I believe that your company's commitment to innovation and growth aligns with my own values. I am particularly drawn to the intersection of AI and sports, which is a passion of mine. I am confident that my background in both areas will allow me to make valuable contributions to your organization.

Thank you for considering my application. I am looking forward to the opportunity to discuss my skills and qualifications further in an interview.

Sincerely,
[Your Name]",1197,187,213
25,"Dear Hiring Manager,

I am excited to apply for the Data Scientist position at your esteemed organization. As a highly motivated individual, I am eager to learn and bring my skills and expertise to tackle complex data science problems.

With a degree in Computer Science and three years of experience in data analysis and predictive modeling, I have developed a strong foundation in data science techniques and methodologies. I have also gained experience in building and implementing algorithms related to AI and machine learning.

I am particularly drawn to your company's focus on leveraging AI for innovative products, as it aligns with my passion for AI and its potential to revolutionize modern technology. Additionally, sports have always been a significant part of my life, and I am confident that I can contribute to your organization's sports-related projects.

I possess excellent problem-solving skills and the ability to make informed decisions based on data analytics. I am confident that my technical expertise, coupled with my passion for learning, will help me contribute to your team's success. 

Thank you for considering my application. I look forward to the opportunity to meet with you and discuss how I can help your organization achieve its goals.

Sincerely,
[Your Name]",1295,204,234
26,"Dear Hiring Manager,

I am writing to express my strong interest in the Data Scientist position currently available in your company. As a highly motivated and dedicated individual, I am passionate about the field of Data Science and eager to learn more about it.

Throughout my education and professional experience, I have had the opportunity to develop my skills in programming, statistical analysis, and machine learning. I am well-versed in various programming languages such as Python, R, and SQL, and have gained hands-on experience with various data analysis and visualization tools.

What drives me towards Data Science is its potential to make a significant positive impact on society. I am particularly interested in AI and its applications across multiple industries, and would love to contribute my skills towards building more intelligent systems that can lead to better outcomes.

Aside from work, sports are my passion. I enjoy both taking part in them and following them closely. This has taught me not only about the value of teamwork but also about the importance of data analysis in sports performance.

I believe that my passion for data science, my experience in the field, and my strong work ethic make me a great fit for this role. I am excited about the opportunity to join your team and contribute my skills towards achieving the company's goals.

Thank you for considering my application. I look forward to hearing back from you soon.

Sincerely,

[Your Name]",1485,241,274
27,"Dear Hiring Manager,

As a highly motivated and passionate individual, I am excited to apply for the Data Science position at your esteemed organization. The field of AI has always been an area of interest for me, and I am drawn to the way data can be used to make a positive impact in various industries.

I have completed my degree in Computer Science with a focus on Data Science, and through my academic projects, I have had the opportunity to develop my skills in data analysis, visualization and predictive modeling. I am confident that I can bring these skills and my eagerness to learn to your organization to drive impactful outcomes.

Aside from data analysis, I am passionate about sports and believe that integrating data-driven insights can create significant improvements in player performance and team dynamics. As such, I prioritize a proactive approach to problem-solving and enjoy working collaboratively to achieve complex objectives.

I am excited to learn more about your organization and its goals, and I am confident that my skills, passion and drive align with your requirements for the Data Science position. Thank you for considering my application. I look forward to the opportunity to discuss my qualifications further.

Sincerely,

[Your Name]",1272,205,232
28,"Dear Hiring Manager,

I am excited to apply for the Data Science position at (company name). With a strong passion for AI and a background in sports, I am eager to contribute my skills and knowledge to your team.

As a highly motivated individual, I am constantly seeking to learn and expand my skillset. My academic background in Data Science, combined with my experience in working with diverse data sets, has equipped me with a sound foundation for the position. I am confident that I can apply my technical skills to deliver actionable insights and impactful results.

My love for sports has also been a driving force in my academic and professional pursuits. As a sports enthusiast, I can bring a unique perspective to your team and help identify valuable insights for your organization. I believe that sports are not only a form of entertainment but also an opportunity to leverage data to improve player and team performance.

I am drawn to (company name) and its commitment to innovation and excellence. The opportunity to work with a diverse and dynamic team is highly appealing, and I am confident that I can contribute to the (company name) culture.

Thank you for considering my application. I look forward to the opportunity to interview for the Data Science position and become a valued member of your team.

Sincerely,

[Your Name]",1346,227,256
29,"Dear Hiring Manager,

I am writing to express my interest in the Data Scientist position currently available at your company. As an experienced data scientist with a passion for AI and a love for sports, I believe that I have the skills, experience and mindset needed to bring value to your organization.

As a previous data scientist, I have developed skills and expertise in data analysis, machine learning, statistical inference and programming. I have a solid understanding of the latest techniques and tools commonly used in the industry such as Tensorflow, PyTorch, and Keras. I am particularly excited about the areas of natural language processing (NLP) and deep learning because of their growing impact on the world. I strive to stay up-to-date on the new innovations in these areas and apply them to my work.

I am very motivated and eager to learn about the potential of AI in the sports industry. Sports have always been my passion for as long as I can remember. By utilizing my skills as a data scientist and my passion for sports, I believe I can add incredible value to this position.

Throughout my career, I have developed excellent communication skills, the ability to collaborate with other teams, and strong analytical skills. These skills have allowed me to deliver high-quality results on time and on budget.

I believe that working with your organization will be an excellent opportunity to leverage my experience and enthusiasm to help bring your data science initiatives to fruition. Thank you for considering my application. I look forward to the opportunity to meet with you and learn more about this position.

Best regards,

[Your Name]",1665,275,314
30,"Dear Hiring Manager,

I am excited to submit my application for the Data Scientist position at your company. As a highly motivated and enthusiastic data professional with a strong passion for AI and sports, I am confident that my skills, experience, and passion make me an excellent candidate for the role.

My experience in the data science field, combined with my love for technology and innovation, has driven me to push myself to go above and beyond to produce successful outcomes, providing valuable insights and recommendations to previous clients. As an AI enthusiast, I am thrilled by the groundbreaking possibilities of deploying these technologies into the field of sports.

I am well-versed in statistical analysis techniques, software development, machine learning, and data analytics. I am confident that my engineering background and data science expertise would be an asset to your team. My ability to use the programming languages such as Python, R, and tools including TensorFlow, PyTorch, and Keras, as well as SQL, Excel, and Tableau, would enable me to efficiently tailor my analyses to achieve optimal results for the company.

I am excited to learn and grow in a dynamic team environment focused on providing innovative solutions for your clients. My passion and energy for learning, combined with my technical capabilities, would make me a valuable asset to your organization.

Thank you for considering my candidacy for this role. I look forward to discussing my qualifications further with you.

Sincerely, 

[Your Name]",1545,243,286
31,"Dear Hiring Manager,

I am writing to express my interest in the Data Scientist position at [Company]. As a highly motivated and enthusiastic individual, I am eager to apply my technical skills and experience to contribute to the success of your company.

From a young age, I’ve been fascinated by the power of data and its many applications. I'm driven by the potential of Artificial Intelligence and the constantly-evolving capabilities that it brings to the table. I am a quick learner and committed to staying up to date with the latest technologies and best practices in data science. 

In addition to my passion for data science, I also bring a unique perspective to the field. Sports have always been a passion of mine, and I’ve found that they can be a powerful lens through which to view the world of data. I have a great appreciation for the analytical insights that can be gleaned from studying athlete performance and behavior, and I’m excited to apply this knowledge in a professional context.

As a data scientist, I recognize the importance of strong communication, problem-solving, and project management skills. I have experience in collaborative team environments and excel in providing clear, concise analysis to a range of stakeholders.

Thank you for considering my application. I look forward to discussing my qualifications further in an interview.

Sincerely,

[Your Name]",1396,226,262
32,"Dear Hiring Manager,

I am excited to submit my application for the Data Science position at [Company Name]. As a highly motivated individual, I am eager to utilize my skills and knowledge to contribute to the success of your team.

With a passion for AI and a background in data analysis, I have developed a strong foundation in statistical modeling and programming skills. My experience in data visualization and machine learning techniques has allowed me to draw insights and make meaningful recommendations based on complex data sets. Furthermore, I have an acute ability to analyze large data sets to identify trends and opportunities while maintaining a focus on data accuracy and validity throughout the process.

Although my background is strong in AI and data analysis, I am eager to apply my skills and expand my knowledge in this field. I have always been a quick learner and I believe that my passion for data science, as well as my natural curiosity and dedication, will be invaluable assets to [Company Name].

Aside from my work in data science, I am an avid sports fan and enjoy playing basketball and following the NBA in my free time. I am always exploring new techniques and keeping up-to-date with the latest trends in data science and following the latest innovations in technology.

I am excited about the opportunity to contribute to the success of your team and hope that my enthusiasm and passion for data science will make a positive impression. Thank you for considering my application.

Best regards,
[Your Name]",1540,257,283
33,"Dear [Hiring Manager],

I am excited to apply for the Data Science position at [Company Name]. With a passion for AI and a genuine interest in the future of sports, I am confident in my ability to contribute to the team’s success.

As someone who is highly motivated and loves to learn, I feel that this position is the perfect fit for me. My curiosity and eagerness to explore and discover through data analysis, modeling and programming is matched only by my enthusiasm for learning new things. I am committed to continuous self-improvement and am always searching for new ways to innovate and stay ahead of the curve.

I have recently completed my Bachelor’s degree in Computer Science and have taken several courses in Data Science including machine learning, data analytics, and AI. During my studies, I have developed strong analytical reasoning and software development skills, both of which I believe will be useful to your team’s efforts.

In addition to my academic studies, sports have also been a passion of mine from a young age. I have participated in several amateur leagues and have followed professional sports closely. With a strong understanding of the statistical analysis of player performance, I feel that I could contribute to your team’s efforts in this area.

I am excited about the prospect of joining [Company Name] and contributing my skills to help drive the success of the team. Thank you for your time and consideration. I look forward to the opportunity to discuss further how I can make a valuable contribution.

Sincerely,

[Your Name]",1569,261,301
