,text,chars,words,tokens
34,"Dear Hiring Manager,

I am excited to submit my application for the position of Data Scientist, as advertised on your website. With a strong background in data analysis and machine learning algorithms, I am confident that I have the skills and passion to add value to your team.

As a dedicated and committed individual, I approach every task with enthusiasm and a willingness to learn. I have always had a passion for the field of Data Science and I am constantly updating my skills and knowledge in this rapidly evolving industry. I have a deep appreciation for Artificial Intelligence and its potential to improve the world we live in, and I am eager to apply my expertise to real-world challenges.

In my previous roles, I have gained hands-on experience in data analysis, statistical modeling, and programming. I am skilled in using Python, R and SQL for data manipulation and analysis. I have also worked with popular machine learning libraries such as scikit-learn, TensorFlow, and Keras to build predictive models and algorithms.

In addition to my academic and professional qualifications, I am an avid sports enthusiast. I believe that sports have the ability to bring people together and inspire collaboration and teamwork, which are all essential qualities in the field of Data Science.

I am confident that my skills, experience, and passion make me the ideal candidate for this position. I am excited at the opportunity to work with a team of like-minded individuals who share my commitment to using Data Science to make a positive impact. 

Thank you for considering my application. I look forward to the opportunity to discuss my qualifications further.

Sincerely,

[Your Name]",1694,276,317
35,"Dear Hiring Manager,

I am excited to submit my application for the Data Scientist role at your esteemed organization. With a sincere passion for data science and a strong desire to constantly learn and grow, I am confident that I would be an excellent addition to your team.

My interest in AI began from an early age, and I have spent countless hours studying the latest advancements in the field. As someone who is naturally curious and loves to dig deeper into complex problems, I know that data science is the perfect career path for me.

While my academic background has laid a strong foundation for my technical skills, I am eager to apply these skills to real-world challenges. I am confident that the innovative and cutting-edge work done by your company would provide the perfect opportunity for me to utilize and build upon my skills.

In addition to my enthusiasm for data science and AI, I am also a passionate sports enthusiast. Whether it be watching a game or analyzing player statistics, sports have always been a way for me to understand the power of data and its potential to inform decisions. I believe that this passion and interest in the subject would allow me to bring a unique perspective to my work as a data scientist.

Thank you for considering my application. I would be honored to have the opportunity to further discuss my qualifications and how they align with your organization's needs.

Sincerely, 
[Your Name]",1444,248,274
36,"Dear Hiring Manager,

I am excited to submit my application for the Data Science position with your company. With a strong passion for data, AI and a growing interest in the comprehensive sports industry, I am confident that I possess the skills and expertise required for the role.

As someone who constantly strives to develop new skills and acquire knowledge on modern technologies, I have exceptional technical ability that includes proficiency in programming languages such as Python and R. I also possess outstanding analytical skills, which allow me to easily identify patterns and trends in large data sets.

While pursuing my degree in Data Science, I took several courses in machine learning, data visualization, statistical inference, and predictive analysis that have equipped me with practical and theoretical knowledge. As a result, I believe that I can effectively design and develop innovative solutions that impact your organization’s for AI and massive digital systems applications.

Aside from my data-related expertise, I am an enthusiastic and self-motivated individual, always eager to explore new opportunities and learn new technologies that challenge and sharpen my skills. My humble and easy-going persona is an asset to a company that harnesses a dynamic team culture, as I can quickly adapt, work seamlessly with everyone and bring in fresh perspectives that enhance your data projects and business solutions.

I am excited about the possibility of joining your team and working with the talented individuals behind your reputable organization. Thank you for considering my application. I look forward to the opportunity to discuss how I could contribute to your organization and succeed together.

Sincerely,

[Your Name]",1750,267,303
37,"Dear Hiring Manager,

I am writing to express my interest in the Data Scientist position at your company. As an aspiring Data Scientist, I am strongly motivated to learn and to contribute to the ever-evolving field of data science. I am confident that I have the skills and experience that your company is seeking in a Data Scientist.

Throughout my academic and professional journey, I have been drawn towards the intersection of data science and artificial intelligence in sports. As a sports enthusiast, I have been following advancements in this field and I am passionate about applying data science to sports analytics. I have had the opportunity to work on various projects that utilize machine learning algorithms to develop predictive models in sport analytics. Additionally, my coursework has equipped me with technical skills in data processing, statistical modeling, and data visualization. I am excited to apply these skills to complex data sets and real-world problems in your company.

Moreover, I value the importance of strong communication skills in data science careers. I am highly collaborative, and I enjoy working with other professionals from different backgrounds to achieve a common goal. I am confident that I can contribute to the dynamic team culture of your company.

Thank you for considering my application. I look forward to the opportunity to showcase my skills and passion for data science in person. Please do not hesitate to contact me if you require any further information.

Sincerely,

[Your name]",1536,244,274
38,"Dear Hiring Manager,

I am writing to express my sincere interest in the Data Scientist position at your esteemed organization. With a strong background in data analysis and a passion for artificial intelligence, I am confident that I would be a valuable asset to your team.

I am an ambitious and motivated individual with a hunger for learning. I am constantly seeking new challenges and opportunities to develop my skills. I have a Bachelor's degree in Mathematics and a Master's degree in Data Science, and have since gained extensive experience in data analysis through internships and work experience.

My passion for AI drives me to constantly seek ways to streamline and automate processes. I am always eager to learn new techniques, and I am confident that my skills in machine learning algorithms, statistical modeling, and data visualization make me a strong candidate for this role.

Furthermore, I am also passionate about sports and believe that my knowledge in this area can also be an asset to your organization. I am a team player, and I believe that my ability to work with others and think outside the box will help me contribute to the success of your team.

Thank you for considering my application. I look forward to the opportunity to discuss my qualifications further with you.

Sincerely,

[Your Name]",1326,220,246
39,"Dear Hiring Manager,

I am writing to express my strong interest in the Data Scientist position currently available within your company. As someone who is highly motivated and eager to learn, I believe that my skills and passion for AI and love for sports make me a strong candidate for this role.

Throughout my academic and professional career, I have sought to develop my data science expertise through coursework, independent projects, and internships. This has allowed me to gain experience in a wide range of techniques, including data cleansing and pre-processing, statistical analysis, predictive modeling, and machine learning. I have also cultivated strong communication and teamwork skills, both through group work and through presenting my research findings and project results to diverse audiences.

Of particular interest to me is the application of data science to the sports industry. I firmly believe that the use of data analytics can help identify trends and patterns that can lead to better decision-making, both on and off the field. Whether analyzing team performance, optimizing ticket pricing, or predicting injury risks, there are countless possibilities for leveraging data to drive success.

I am also excited about the opportunity to work for a company that values innovation and embraces new technologies. As someone who is always eager to learn and grow, I believe that I would thrive in an environment that encourages creativity and experimentation.

Thank you for considering my application. I am confident that my skills, enthusiasm, and love for both AI and sports would make me a valuable asset to your team. I look forward to the opportunity to speak more about my qualifications and experience.

Sincerely,

[Your Name]",1756,275,312
40,"Dear Hiring Manager,

I am extremely excited to apply for the Data Scientist position at your esteemed organization. As a seasoned data science professional, I am confident that I possess the requisite skills and experience that would make me an outstanding asset to your team.

Having worked in the data science field for several years, I have gained a deep expertise in analyzing complex data sets, utilizing the latest technologies to extract insights, and developing cutting-edge machine learning algorithms. My practical experience in handling large amounts of data combined with my proficiency in programming languages such as Python and R make me an ideal fit for this role.

I am also very passionate about Artificial Intelligence, and have consistently strived to stay up-to-date with the latest technological advancements in the field. In addition, I have a strong interest in sports, which I believe, combined with my skills and experience, would enable me to create data-driven solutions that help optimize sports team performance.

What sets me apart from other candidates is my unwavering determination to learn new skills and continuously improve. I am a fast learner and have the ability to adapt to new situations quickly. Moreover, I possess excellent communication and problem-solving skills, which are essential in navigating complex data science projects.

I am confident that my experience, passion, and enthusiasm would make me a great fit for this role. I would be honored to be considered for this position and am excited about the opportunity to discuss my qualifications with you further.

Thank you for taking the time to review my application. I look forward to the opportunity to meet with you soon.

Sincerely,

[Your Name]",1754,277,316
41,"Dear [Hiring Manager],

I am excited to submit my application for the Data Science position at [Company Name]. As an aspiring data scientist, I am motivated by the opportunity to work with a team at the forefront of AI technology, and I am confident that my skills and experience align perfectly with the innovative work being done at your company.

I have always had a strong passion for data science and AI, and have continued to build my knowledge and skills in this field. With a Bachelor's degree in Computer Science and a Master's degree in Data Science, I am well-equipped to handle complex data sets and models. Additionally, my experience in using machine learning algorithms to drive insights and decision-making, and my knowledge of programming languages such as Python and R will enable me to hit the ground running in this role.

Beyond my professional achievements, sports have been a passion of mine for as long as I can remember. My love for sports has also fed into my interest in data science, as I have enjoyed analyzing and modeling sports data in my spare time. I believe that my curiosity and passion for both sports and data science make me a unique fit for this position at your company.

I am eager to learn and contribute my skills to your exciting projects. Thank you for taking the time to consider my application, and I look forward to hearing from you soon.

Sincerely,
[Your Name]",1411,246,277
42,"Dear Hiring Manager,

I am excited to apply for the Data Science role at [Company Name]. As a driven and enthusiastic individual with a passion for AI and sports, I am confident that my skills and experience will make me a valuable addition to your team.

Throughout my academic and professional career, I have honed my skills in statistics, data visualization, and machine learning. I am familiar with programming languages such as Python and R, and have experience working with various data analysis tools. Additionally, I possess excellent analytical and problem-solving skills, and have a keen eye for detail.

Beyond my technical skills, I am a quick learner who is eager to take on new challenges. I am also a team player who enjoys collaborating with others and contributing to a positive work environment. With my passion for AI and sports, I am especially excited to work for a company that incorporates cutting-edge technology to enhance the world of athletics.

I am confident that my expertise and enthusiasm will enable me to make meaningful contributions to your team. Thank you for considering my application. I look forward to the opportunity to discuss my qualifications further.

Sincerely,

[Your Name]",1221,198,227
43,"Dear Hiring Manager,

I am very excited to express my interest in the open Data Science position at your company. As someone who has always been enthusiastic about exploring the intricacies of data, I consider myself a strong candidate for this role.

Throughout my academic and professional career, I have gained extensive knowledge and experience in Data Science, specifically in AI modeling and programming. Being a quick learner, I am open and eager to learn more and apply that knowledge to create solutions that will help your organization elevate their data science initiatives.

I am especially passionate about the intersection of AI in sports, and I am confident that I can bring a wealth of knowledge and expertise to your team in this area. My analytical abilities, coupled with my love for sports, assist me in identifying and implementing innovative approaches to data science research within the sports industry.

I am confident that my skill set, combined with my strong work ethics, makes me an exceptional fit for the role. I am excited about the opportunity to work with a team of professionals who share a similar passion as mine, where I can learn from them and grow in my career.

Thank you for your consideration. I am looking forward to the opportunity to further discuss my qualifications and enthusiasm for the Data Science position in a formal interview.

Sincere regards,

[Your Name]",1412,233,260
44,"Dear Hiring Manager,

I am writing to express my strong interest in the Data Scientist position at [company name]. As a professional with a passion for data science and extensive experience in the field, I am confident in my ability to contribute to your team while continuing to learn and grow.

My enthusiasm for Data Science stems from my fascination with artificial intelligence and data-driven decision making. Over the years, I have developed a strong foundation in this field, from data collection and analysis to machine learning, data visualization, and optimization techniques.

My work has also given me the opportunity to develop exceptional analytical, and critical thinking skills. Additionally, my expertise in programming languages like Python and R has enabled me to manipulate and study large data sets effectively. Also, my experience in working with relational database systems like SQL, and NoSQL databases gives me hands-on experience handling complex data structures.

Aside from my technical skills, I am a quick learner with excellent communication and interpersonal skills. Also, I am passionate, and sports are my favorite pastime. I believe this characteristic will allow me to be an excellent team player in any project I work on.

I am enthusiastic about the opportunity to join the talented team at [company name] and contribute to its mission. Thank you for considering my application. I look forward to the opportunity to discuss my qualifications further in an interview.

Sincerely,

[Your Name]",1530,238,275
45,"Dear Hiring Manager,

I am excited to apply for the Data Science position at your company. With my passion for AI and experience in data analytics, I am confident that I can make a valuable contribution to your team.

As a data enthusiast, I am always eager to learn and stay on top of the latest trends and techniques in the field. I am constantly seeking out new challenges and opportunities to expand my skill set. That's why, when I discovered your company's innovative approach to data, I knew I had to be a part of it.

In addition to my technical prowess, I bring a strong work ethic and passion for sports to the table. I believe that my enthusiasm for sports is a key factor in my success as a data scientist, as it has honed my ability to analyze large datasets and identify patterns and trends.

I am confident that my skills, experience and passion make me an ideal candidate for this position. I would welcome the opportunity to meet with you to discuss how I can contribute to your team.

Thank you for considering my application.

Sincerely,

[Your Name]",1069,193,218
46,"Dear Hiring Manager,

I am writing to express my interest in the Data Science position at your esteemed organization. As a highly motivated and passionate individual, I believe I possess the necessary skills and qualifications to excel in this role.

My background consists of a strong foundation in mathematics, statistics and programming languages like Python, R and SQL. Additionally, I have expertise in data analysis, machine learning and big data technologies like Hadoop and Spark. I'm excited about the possibilities of using AI and machine learning to help make informed decisions and drive business outcomes.

Beyond my technical skills, I possess a strong work ethic, analytical acumen and a passion for problem-solving. I am confident that my skills and enthusiasm will enable me to contribute positively to your team, and help drive innovation and growth for the company.

Outside of work, sports are my passion. I have always been an avid follower of various sports games, and I enjoy analyzing the data behind the game to gain insights that can be used to improve performance. This interest and experience in sports further highlights my analytical mindset and ability to apply data-driven insights to real-world scenarios.

Thank you for considering my application. I am highly motivated, eager to learn and excited at the prospect of joining your team. I look forward to the opportunity to meet with you to discuss further how my skills and background can be of value to your organization.

Sincerely,

(Your name)",1531,245,280
47,"Dear Hiring Manager,

I am extremely excited to apply for the Data Scientist position that is available at your esteemed organization. I come with a strong background in data analytics and a firm understanding of machine learning and AI.

As a passionate learner, I have always been intrigued by new and emerging technologies in the field of data science. Over the years, I have equipped myself with advanced skills in data analytics, visualization, and modeling. I strive to constantly update my knowledge and skills to stay ahead in this competitive field. 

Apart from data science, sports are my true passion. I admire how data is changing the world of sports by transforming game strategies, players performance analysis, and fan engagement. I am fascinated by the use of AI in developing smart algorithms for predicting sports outcomes, player performance, and much more.

I believe that my skills, passion for data science, and love for sports make me a great fit for your organization. I am keen to bring my expertise and creativity to your team and help you advance your business goals. I am confident that I can make a valuable contribution by applying my skills in data analysis, visualization, predictive modeling, and AI.

Thank you for considering my application. I am looking forward to hearing from you soon.

Sincerely,

[Your Name]",1349,221,254
48,"Dear Hiring Manager,

I am thrilled to submit my application for the Data Science position in your esteemed organization. As a highly motivated and ambitious individual, I am confident that my skills and passion align perfectly with the requirements of this role.

As an avid lover of Artificial Intelligence and technology, I have always been fascinated by the applications of data science in various industries. My academic background in Mathematics and Computer Science has provided me with a strong foundation in programming languages such as Python and R, as well as machine learning libraries like Scikit-learn and TensorFlow. Additionally, I have worked on numerous data analytics and visualization projects, both individually and as part of a team.

Outside of my professional interests, I am also an ardent enthusiast of sports, which I believe provides a unique opportunity to apply various data science techniques such as predictive modeling and decision-making algorithms. My diverse interests have enabled me to develop a unique perspective and a creative approach to problem-solving.

I am eager to use my skills and expertise to contribute to the success of your organization. I am confident that I have the necessary qualities to be an asset to your team. Thank you for considering my application. I look forward to the opportunity to further discuss my qualifications.

Sincerely,
[Your Name]",1409,220,249
49,"Dear Hiring Manager,

I am writing to apply for the Data Science position at your organization. As a passionate individual with a desire to learn and grow, I am confident that I am the ideal candidate for this role.

My background in Data Science, combined with my passion for AI and Sports, makes me a strong candidate for this position. With years of experience working in the field, I have gained valuable skills that enable me to analyze complex data sets and derive meaningful insights. Moreover, I am highly motivated and always eager to learn more about the ever-changing field of Data Science.

In addition to my technical skills, I possess excellent communication and collaboration skills that allow me to work effectively with cross-functional teams to meet project objectives. I am confident that my ability to work with others and my analytical skills will be an asset to your team.

Finally, I would like to express my enthusiasm for your organization's mission and values. I believe that the work you do is critical to society, and I would be honored to contribute my skills towards achieving your goals.

Thank you for considering my application. I look forward to the opportunity to discuss my qualifications further with you.

Sincerely,

[Your Name]",1267,210,237
50,"Dear Hiring Manager,

I am writing to express my interest in the Data Science position currently available in your company. I am a highly motivated and passionate individual who is eager to learn and help contribute to your team's success.

My love for AI and data analysis has driven my pursuit of a career in Data Science, where I have developed skills in data visualization, machine learning algorithms, and statistical analysis. I believe that these skills would be incredibly valuable in the Data Science role within your company.

My passion for sports has only enhanced my interest in the field, as I have utilized statistical analysis and data visualization to better understand the key drivers of team performance, player performance, and fan behavior. I am excited to see how I can leverage this expertise in your company.

As an individual, I value teamwork, collaboration, and a continuous learning mindset. I am confident that these values, coupled with my technical abilities, problem-solving skills, and strong work ethic, would make me a valuable addition to the team.

Thank you for taking the time to consider my application. I am excited about the opportunity to further discuss my qualifications and how they align with the expectations for the role.

Sincerely,

[Your Name]",1295,209,239
