,text,chars,words,tokens
67,"Dear Hiring Manager,

I am delighted to submit my application for the Data Science position at your esteemed organization. I recently earned my degree in Data Science with a specialization in Artificial Intelligence and I am eager to put my knowledge and skills to work in a real-world setting. 

As someone who is passionate about data science and AI, I am excited about the myriad of possibilities that the field of data science offers. Over the course of my studies, I have honed my technical skills in programming languages like Python and R, data visualization tools like Tableau, and machine learning algorithms. Alongside these technical skills, I have also developed a strong understanding of statistical concepts and analytical techniques.

One of my biggest passions in life is sports. I have always been interested in the intersection of sports and data, and the insight that can be gained from analyzing data to improve athlete performance. As such, I have been actively involved in several data science projects that involve analyzing sports data. Specifically, I have worked on projects that involve analyzing in-game statistics and player performance metrics within the context of various sports leagues.

I am a self-starter, a quick learner, and a team player, and I believe that my passion for data science, dedication to AI, and love for sports will make me a valuable addition to your team. I am excited to contribute and learn from your talented team of data scientists and contribute to the company's continued success.

Thank you for considering my application. I look forward to the opportunity to meet with you to discuss my qualifications further.

Sincerely,

[Your Name]",1698,274,314
68,"Dear Hiring Manager,

I am writing to express my interest in the Data Science role that has recently opened up in your company. With my strong background in data analysis and programming, as well as my passion for AI and sports, I am confident that I would be an excellent candidate for the position.

As someone who is motivated, curious and eager to learn, I believe that I would thrive in a dynamic and fast-paced work environment, such as yours. Furthermore, I find myself constantly drawn to the latest advancements in the field of data science and AI, which I believe is one of the most exciting areas of technology today.

In particular, I am impressed by your company's reputation for innovation, cutting-edge research, and the potential to shape the future of the industry. I am thrilled at the prospect of contributing my skills and expertise to help advance this mission.

As an avid sports enthusiast, I am particularly excited by the possibility of applying my passion for data science to the field of sports analytics. I believe that data analytics can offer insights and generate solutions that can help teams make better decisions and achieve greater success.

In summary, I am excited about the possibility of joining your team, and I look forward to the opportunity to contribute to your mission. Thank you for your consideration, and I look forward to hearing back from you soon.

Sincerely,

[Your Name]",1423,240,272
69,"Dear Hiring Manager,

I am writing to apply for the Data Science position in your esteemed organization. With a Bachelor's degree in Computer Science and a strong passion for AI and data analysis, I am confident that I have the skills, knowledge, and enthusiasm to contribute to your team.

As a highly-motivated individual, I have extensive experience in using statistical modeling and predictive analysis to gain insights into various datasets. My proficiency in programming languages such as Python, R and SQL, coupled with my deep understanding of ML algorithms and frameworks, makes me an excellent candidate for this position.

Moreover, I have a keen interest in the application of data science in different industries. As a sports enthusiast, I am intrigued by the possibilities of using data science to analyze and predict performance trends and outcomes in different sports. I believe that my passion for sports, coupled with my expertise in data science, will enable me to bring a unique perspective to your organization.

What truly excites me about this position is the opportunity to work on challenging projects and to continuously learn and develop my data science skills. I am confident that the welcoming and supportive work culture in your organization will provide me with the perfect environment to harness my skillset and deliver exceptional results.

Thank you for considering my application. I eagerly anticipate the opportunity to discuss my qualifications further and to learn more about the exciting opportunities in your organization.

Sincerely,

[Your Name]",1587,247,280
70,"Dear [Hiring Manager],
 
I am writing to express my interest in the position of Data Scientist with [Company Name]. As an enthusiastic and highly motivated individual, I believe I would be an excellent fit for this position.

My passion for data science began during my undergraduate studies in Mathematics, where I was first introduced to the exciting new field of artificial intelligence. Since then, I have been eager to explore the many ways that AI can be used to analyze complex data and solve real-world problems.

In addition to my academic background, I have worked as a data analyst for [Company Name], where I gained hands-on experience with a variety of data tools and platforms. Through my work there, I honed my data-driven problem-solving skills and developed a knack for using data to communicate insights to non-technical stakeholders.

Outside of work and school, I am an avid sports fan, and I am passionate about finding new ways to use data to enhance performance and optimize strategies in a variety of sports. I believe this passion gives me a unique perspective that would be valuable in any data science role.

Overall, I am excited about the opportunity to join the team at [Company Name] and contribute my skills and enthusiasm to help develop innovative data-driven solutions. Thank you for considering my application.

Sincerely,

[Your Name]",1371,224,263
71,"Dear Hiring Manager,

I am writing to apply for the Data Science position that has recently become available at your esteemed organization. I am confident that my strong background in data analysis, combined with my motivation and eagerness to learn, make me an excellent candidate for the role.

I have a Bachelor's degree in Computer Science and have been working as a data analyst for the last three years. Throughout my career, I have gained a wealth of experience in data visualization, data manipulation, and machine learning. I have worked on various projects involving large amounts of data, which have required me to demonstrate my ability to work under pressure, meet deadlines and deliver high-quality results.

My love for AI is what truly drives my passion for Data Science. I am fascinated by the potential that AI holds for society, and I am constantly seeking to develop my skills in this field. My interest in sports has also played a major role in driving my passion for data analysis. By applying concepts from sports to data, I am able to generate insights and drive value for businesses.

What excites me most about your organization is your commitment to innovation and your focus on using data to drive decision making. I am confident that, as part of your team, I will be able to apply my skills towards contributing to this vision of innovation and progress.

Thank you for considering my application. I am looking forward to an opportunity to demonstrate my passion and skills in Data Science through an interview. Please feel free to contact me if you require any further information.

Sincerely,

[Your Name]",1636,275,309
72,"Dear Hiring Manager,

I am pleased to apply for the position of Data Scientist with your esteemed organization; I am keen to bring my skills, knowledge and enthusiasm to deliver success in this role.

I am highly motivated and eager to learn, and I have a special interest in the field of AI. My passion for using data to drive insights has led me to pursue a career in data science. I am confident that my technical skills, interpersonal abilities, and the love for sports have prepared me well for this role.

I am experienced in creating complex predictive models, working with large datasets, and developing innovative algorithms to create real-world value. I have extensive experience with data analytics tools and programming languages such as Python, SQL, and R. Additionally, I have experience in machine learning, statistical techniques, and data visualization tools.

Through my experience in data science, I have gained a deep understanding of the importance of robust and high-quality data in driving insights and making impactful decisions. I am confident that my skills in data engineering, data modeling, and data analysis will enable me to deliver value to your organization.

Furthermore, as a dedicated sports fan, I have a deep understanding of the value of data insights in sports. I am highly knowledgeable about trending data analysis methods used in the sports sector, and I am confident that I can contribute well to your organization.

Thank you for your time and consideration. I am excited about the opportunity to bring my skills and enthusiasm to your organization.

Sincerely,

[Your Name]",1619,262,300
73,"Dear Hiring Manager,

I am writing to express my strong interest in the Data Scientist position at your organization. As a highly motivated and experienced data analyst, I am eager to make a valuable contribution to your team by utilizing my skills and expertise in data science.

Throughout my career, I have had the opportunity to work with different data-driven projects, ranging from predictive analytics to machine learning algorithms. These experiences have helped me develop strong data manipulation and analytical skills, as well as excellent problem-solving abilities.

Moreover, I am passionate about artificial intelligence (AI) and have been keeping track of its latest advancements. I am always looking forward to learning something new and exploring new possibilities through AI. Exploring the world of data science and AI helps me keep motivated towards learning more.

In addition to my professional skills, I am also an avid sports enthusiast, and I bring this passion to the workplace. I believe that such interests can help bring a fresh perspective and unique ideas to any organization, and it is important for me to be a well-rounded individual both inside and outside of work.

I am excited about the opportunity to join your organization and contribute my skills and expertise to your team. Thank you for considering my application. I look forward to the chance to discuss my experience and qualifications further.

Sincerely,
[Your Name]",1461,230,261
74,"Dear [Hiring Manager],

I am writing to express my interest in the Data Scientist position at [Company]. As a highly motivated and eager learner, I am excited to apply my skills and experience in data analysis and modeling to contribute to your team's success.

My passion for data science began during my undergraduate degree in computer science, where I was able to gain experience in a wide range of data-related concepts and tools. Moreover, I acquired more specialized skills and techniques when I completed a Master's degree in data science. Since then, I have worked for several companies in the industry, gaining valuable experience that includes advanced programming skills in R, Python, SQL, and NoSQL. 

My technical expertise is extensive, but my interests in AI and sports are what makes me stand out. I am passionate about the study of machine learning and deep learning algorithms that can revolutionize many areas of our lives, including sports. One of my favorite projects is a classification algorithm, which identifies the best and worst players in a team based on different statistics. I am confident that my knowledge, experience, and passion make me the ideal candidate for this position.

I am excited to bring my technical skills and my love for AI and sports to [Company] and contribute to your innovative projects. My excellent problem-solving skills, strong attention to detail, and ability to work collaboratively make me confident in my ability to succeed in this position.

Thank you for considering my application.

Sincerely,

[Your Name]",1570,252,297
75,"Dear Hiring Manager,

I am pleased to submit my application for the Data Science position with your company. With my strong background in data analysis and machine learning along with my passion for sports and AI, I believe I would be a valuable addition to your team.

I am very motivated and eager to learn more about data science and its practical applications. With the rapidly changing landscape of technology, it is crucial to keep up with the latest advancements in the field. I am committed to continuous learning and staying up-to-date with the latest developments in data science.

My passion for AI and sports has led me to explore the intersection of these two fields in my academic and personal projects. I have experience building predictive models for sports outcomes and analyzing large datasets to extract insights and patterns. I am excited about the potential for data science to revolutionize the way sports are analyzed and understood, and I believe your company is at the forefront of this technology.

As an individual who is highly motivated, detail-oriented, and creative, I would make a great addition to your team. I enjoy collaborating with others and believe that team synergy is critical in achieving common goals. I am confident that my skills and passion for data science make me an excellent candidate for this position.

Thank you for considering my application. I look forward to the opportunity to discuss my qualifications further.

Sincerely,

[Your Name]",1493,244,272
76,"Dear Hiring Manager,

I am writing to express my strong interest in the Data Science position at your esteemed organization. As a highly motivated individual with a passion for AI and a love for sports, I believe that I would be an excellent addition to your team.

I hold a Bachelor's degree in Computer Science and have completed several online courses in data analysis, machine learning and AI. Throughout my academic and professional career, I have gained valuable skills in data collection, analysis and visualization. I have also worked on projects that involved developing predictive models for a variety of industries which gave me hands-on experience with solving real-world problems.

What sets me apart from other candidates is my eagerness to learn and my passion for sports. I have been a sports enthusiast my entire life, and I believe that data analysis can have a great impact on the future of sports. I am excited to bring my unique perspective to your team and work towards making data-driven decisions.

Furthermore, I have excellent communication and interpersonal skills, which enable me to work well within a team and communicate complex technical concepts to non-technical stakeholders.

I am confident that my skills and experience make me an ideal candidate for the Data Science position at your organization. Thank you for considering my application. I look forward to the opportunity to discuss my application further.

Sincerely,
[Your Name]",1469,235,266
77,"Dear Hiring Manager,

I am writing to express my interest in the data science position that is currently available at your organization. As someone who is deeply passionate about data science, I believe that this role is perfectly suited to my skills and experience.

More than anything else, I am eager to join a team that is passionate about data science and AI, as these are areas that have always fascinated me. I have spent a significant amount of time exploring these topics, and I believe that I have a solid understanding of the techniques and technologies that will be required in this role.

One of the things that sets me apart from other candidates is my love for sports. I believe that my passion for sports will be a real asset in this role, as it will enable me to bring a powerful perspective and insight to the data that we'll be working with. Whether we are analyzing player statistics, making predictions about game outcomes, or exploring trends in fan behavior, I am committed to ensuring that your organization is successful in all areas.

Finally, I would like to emphasize that I am someone who is incredibly motivated and eager to learn. I am confident that I will be able to make valuable contributions to your organization from the very beginning, and that I will continue to grow and learn as a data scientist throughout my time here.

Thank you very much for considering my application. I look forward to hearing from you soon.

Sincerely,

[Your Name]",1480,258,285
78,"Dear Hiring Manager,

I am writing to express my interest in the Data Scientist position available at your company. As a highly motivated and eager learner, I am excited about the opportunity to join your team and utilize my analytical skills to help solve complex data problems.

As a data enthusiast, I have always been fascinated by the world of data and its power to drive business outcomes. I am particularly interested in the field of artificial intelligence and its various applications. Through my academic and work experience, I have developed strong skills in statistical analysis, data mining, and machine learning. 

Apart from my academic background, sports are my passion, and I enjoy playing and watching them. I believe that sports offer a unique opportunity to understand and analyze data for better sports performance. I am confident that my experience and interests in sports and data science can bring value to your team.

Furthermore, I am a quick learner and always eager to acquire new skills. I bring a positive attitude and a collaborative approach to every project I undertake. 

Thank you for considering my application. I am excited about the potential opportunity to contribute to your mission and eager to learn from your team.

Sincerely,
[Your Name]",1281,208,235
79,"Dear Hiring Manager,

I am excited to apply for the Data Scientist position at your company. I am highly motivated to learn and have a passion for leveraging artificial intelligence technology to solve complex problems. Additionally, sports have always been a passion of mine, and I am thrilled to have the opportunity to contribute to a company that shares this interest.

With a background in statistics and data analysis, I possess the skills necessary to analyze large amounts of data and extract meaningful insights. Moreover, my experiences working with machine learning algorithms and natural language processing have enabled me to implement predictive models that can provide actionable insights for decision-making.

Throughout my academic and professional career, I have demonstrated the ability to work well within a team and communicate complex ideas in a concise and effective manner. I also have experience working within tight deadlines and under pressure, which will enable me to excel within a fast-paced work environment.

Thank you for considering my application for the Data Scientist position. I look forward to the opportunity to discuss my qualifications with you further.

Sincerely, 
[Your Name]",1220,186,209
80,"Dear Hiring Manager,

I am writing to express my interest in the Data Scientist position at your company. As a highly motivated and eager-to-learn professional, I am excited about the opportunity to use my skills and knowledge to your organization's advantage.

With a keen interest in AI and a passion for sports, I believe I am the ideal candidate for the job. My academic background in mathematics and statistics, combined with my experience in programming, data analysis, and machine learning techniques, makes me well-suited for the role.

I am confident that my skills, coupled with my strong problem-solving abilities and attention to detail, will enable me to make valuable contributions to your team. Furthermore, my excellent communication skills will ensure that I can work effectively with stakeholders at all levels of the organization.

I am always looking to learn and grow, and I believe that your company's focus on innovation and cutting-edge technology aligns perfectly with my own goals and ambitions. I am confident that I can help your organization achieve its objectives, while also advancing my own career.

Thank you for considering my application. I look forward to the opportunity to further discuss my qualifications with you.

Sincerely,

[Your Name]",1279,201,237
81,"Dear Hiring Manager,

I am writing to apply for the position of Data Scientist at your esteemed organization. Upon learning of your opportunity, I was immediately drawn to the innovative culture and excellent reputation for excellence that your company maintains.

As a highly motivated and aspiring data scientist, I am incredibly passionate about the field of artificial intelligence and the impact it can have on businesses and industries. Moreover, I'm deeply interested in utilizing my skills and education to make a significant contribution in the Data Science department.

I am confident that my degree in Data Science from a reputed university and my experience working with data analysis, machine learning, and visualization could make me an excellent fit for this role. I have also been an avid sports enthusiast from a young age, and the intersection of data science and sports is an area of research that I am quite interested in exploring.

I am excited about how the opportunity to work at your organization could expand my skill set, and be the perfect stage for me to contribute and learn new things. I am confident that my analytical skills, passion, and eagerness to learn, make me an ideal candidate for this role.

Thank you for considering my application. I am eagerly looking forward to discussing my qualifications with you and contributing to your team's continued success.

Sincerely,

[Your Name]",1422,230,258
82,"Dear Hiring Manager,

I'm excited to submit my application for the role of a Data Scientist at your organization. I'm confident that my skills and background make me an excellent candidate for this position and I am eager to contribute to your team's success.

As an individual who is deeply interested in AI and possesses a passion for sports, I believe that I am very well suited for this position. Throughout my academic and professional career, I have gained extensive experience in data analysis, mathematical modeling, and predictive analytics. These skills allow me to utilize large data sets and extract meaningful insights, and I have gained an appreciation for how data science can be used to drive success in a wide range of industries.

Moreover, I am confident that I possess the necessary technical skills and analytical aptitude to be successful in this role. I have worked with various programming languages, such as Python and R, and I am proficient in a range of data analytics tools, including SQL, Hadoop, and Spark. In addition, I have experience implementing machine learning algorithms, such as K-means, decision trees, and ensemble methods, to extract predictive insights from large datasets. 

As a highly motivated individual, I am always eager to learn and am committed to staying up to date with the latest developments in AI and data science. Moreover, I have a proven ability to work well under pressure, and I'm confident that I have the drive and determination to succeed in this role.

Lastly, I am impressed with your company's dedication to innovation and commitment to impacting the lives of people through technology. I believe that the environment of your organization, which values hard work and creativity, is the type of place where I can thrive both professionally and personally.

Thank you for considering my application. I look forward to discussing my qualifications with you further and hope to have the opportunity to contribute to the success of your team as a data scientist.

Sincerely,

[Your Name]",2050,334,385
83,"Dear Hiring Manager,

I am writing to express my strong interest in the Data Scientist position at your esteemed organization. I have a solid background in data analysis and statistical modeling, and I am deeply passionate about data science and its potential to transform the world.

As an aspiring data scientist, I am constantly seeking new challenges and learning opportunities. Whatever challenges I encounter, I am always eager to learn from them and apply those learnings in my work. I am confident that I have the skill and expertise to succeed in this role and contribute to your team's success. 

In addition, I have a keen interest in artificial intelligence and machine learning. I am constantly keeping up with the latest industry trends and advancements, and I am eager to apply my knowledge in these fields to help your organization take advantage of emerging technologies.

Furthermore, sports have always been my passion, and I believe that my expertise in data analysis can be a significant asset to your company when it comes to sports analytics. I am committed to using my skills to enhance your organization's ability to analyze data in your sports department.

In conclusion, I am very excited about the opportunity to join your organization and contribute to its success. Thank you for considering my application; I look forward to the chance to discuss my qualifications further.

Sincerely,

[Your name]",1428,232,261
