,text,chars,words,tokens
26,"Dear Hiring Manager,

I am writing to express my keen interest in the Data Scientist position advertised on your company's career page. I am an enthusiastic individual with an unmatched passion for Artificial Intelligence and using data science to solve real-world problems. Furthermore, my love for sports has driven my interest in exploring unique data sets to uncover new insights and gain a valuable competitive advantage. 

As a young professional, I am eager to learn and grow, which is why I am excited about the opportunity to join your team of experienced data scientists. With a degree in Mathematics and Statistics, I have developed a solid foundation in data analysis and have experience working with programming languages such as Python and R. Additionally, I am familiar with data visualization tools such as Tableau, which has allowed me to effectively communicate complex data to diverse audiences.

My exceptional organizational skills, coupled with my attention to detail, enables me to approach tasks with rigor and dedication. I am confident that my ability to creatively solve problems and my strong analytical skills make me a solid candidate for this role. In addition, my ability to work collaboratively in a team environment would complement your dynamic and innovative team culture.

Thank you for your time and consideration. I look forward to hearing back from you.

Sincerely,

[Your Name]",1418,224,254
27,"Dear Hiring Manager,

I am writing to express my enthusiastic interest in the Data Science position currently available within your esteemed organization. As a highly motivated individual with a deep passion for the field of data science, I am confident in my ability to contribute to your projects and add value to your team.

At my core, I am fascinated by the power of data and its ability to drive intelligent decision-making in just about any industry. From my earliest experiences with data analysis, I have been driven by a desire to see how powerful insights can lead to breakthroughs in performance, efficiency, and bottom-line results. Moreover, as someone with a keen interest in Artificial Intelligence, I am eager to explore the limitless possibilities of machine learning and predictive modeling, and I believe that your organization is the perfect place for me to do so.

Beyond my passion for data science, I also bring a wealth of practical experience to the table. In my most recent position, I worked as a Data Analyst at a marketing firm, where I was responsible for conducting market research, analyzing data trends, and generating actionable insights for clients across a variety of industries. Throughout this experience, I honed my technical skills in data wrangling, visualization, and modeling, and received strong feedback from colleagues and clients alike.

Bear in mind that my passion does not only lie in the field of data science, but also in Sports. Sports are my passion, and I believe that the power of data can revolutionize the way we understand athletic performance. For years, I have been avidly tracking stats and performance data for various athletes and teams, using that information to make predictions and gain deeper insights into various aspects of the game. I believe that this knowledge and experience can help me create a well-rounded perspective that allows me to excel in the field of data science.

In sum, I am eager to join your team and contribute my knowledge, skills, and passion to create innovative data-driven solutions. Thank you for considering my application. Please feel free to contact me if you have any questions or would like to schedule an interview. 

Sincerely,

[Your name]",2245,367,421
28,"Dear Hiring Manager,

I am writing to apply for the Data Science position at your esteemed organization. I came upon this opportunity on your company website and was immediately drawn to the innovation, technological advancement, and dynamic work culture that your company offers. I believe that my academic background and professional experience in the field of Data Science, coupled with my strong motivation and passion for sports and AI, make me an ideal candidate for this position.

As a graduate in Data Science, I am equipped with a robust foundation in statistical analysis, machine learning, data mining, and predictive modeling. My professional experience in the field includes working with tools and software such as R, Python, TensorFlow, and SQL, to name a few. I have worked on projects centered around natural language processing and image recognition, which have been well received and have helped me gain a deeper understanding of the complex world of Data Science.

My eagerness to learn and my insatiable desire to create something new and impactful has driven me throughout my academic and professional journey. I am confident that this drive, combined with my strong work ethic, will ensure my success in the position of Data Scientist at your organization. Furthermore, my passion for sports and AI has fueled me to undertake several personal projects focused on the intersection of these areas. These projects have given me valuable experience and have provided me with a thorough understanding of the challenges and opportunities in this field.

As a team player, I have thrived in environments that encourage collaboration and communication. I am excited about the opportunity to work with the talented team at your organization to contribute positively to your vision of innovative and impactful solutions.

I appreciate your consideration of my application for the Data Scientist position. I look forward to discussing how my skills, experience, and passion align with the goals and objectives of your organization. Thank you for your time and consideration.

Sincerely,

[Your Name]",2111,331,374
29,"Dear Hiring Manager,

I am writing to apply for the Data Science position in your esteemed organization. With my passion for the field of data science, I am highly motivated and eager to contribute to your team's success. My background in the study of data analysis combined with my passion for Artificial Intelligence (AI) and sports make me a prime candidate for this job.

Throughout my academic journey, I have developed an exceptional proficiency in statistics, mathematics, and computer science, along with an incredible understanding of data mining, data visualization, machine learning, and Natural Language Processing (NLP). My computational skills and statistical skills advanced greatly as I studied and developed various data models for courses and personal projects. I have developed an appreciation for AI and the role it plays in the world of data science. The possibilities of what AI can achieve excites me, and I am determined to learn more about it.

In addition to my skills and knowledge, sports are something that has always been close to my heart. Sports have taught me valuable life lessons such as teamwork, discipline, dedication, and resilience. This passion grew in me from a young age, and I have always been fascinated by the advanced statistical models used in sports analysis. They have provided insights into players and teams, thus transforming the game and making it more exciting.

Working for your organization would be a dream come true, given its outstanding reputation and excellence in the field of data science. I am confident that I possess the necessary skills and passion to make a significant contribution to your team. I am eager to learn more about the valued experience that your organization has to offer, and I am committed to a long-term relationship with your team of professionals.

Thank you for considering my application.

Sincerely,

[Your Name]",1903,306,350
30,"Dear Hiring Manager,

I am writing to express my heartfelt interest in the Data Science job opening that you have advertised on your organization's website. As an enthusiastic and highly motivated individual, I am confident that my skills and passion for AI coupled with my personal interest in sports make me an excellent fit for this position.

Over the last few years, I have acquired a wealth of experience and in-depth knowledge of data science through my education and practical work experience. I am familiar and proficient with the latest data science techniques and tools, including machine learning, artificial intelligence, statistics, and data visualization.

My insatiable appetite for learning, coupled with my passion for AI and sports, have inspired me to develop strong analytical and problem-solving skills. I have honed these skills through various academic and personal projects, which have further fueled my interest in data science.

I am not just an individual who is passionate about data science and AI; my enthusiasm spills over to my personal life as well. Sports are my passion, and I spend my leisure time analyzing player and team statistics. This has helped me develop various insights into how data analysis could enhance sports performance.

As an adaptable and collaborative individual, I have a proven track record of delivering quality work within tight deadlines. My strong communication skills and the ability to explain complex data concepts in layman's terms make me an excellent and reliable team player.

Thank you for your consideration, and I am looking forward to meeting with you to discuss more about this opportunity further.

Sincerely,

[Your Name]",1698,267,305
31,"Dear Hiring Manager,

I am very excited to apply for the Data Scientist position at your esteemed organization. My background in computer science, data analysis and machine learning, combined with my passion for AI and sports, have equipped me with the necessary skills and knowledge to succeed in this role.

From my previous internship at ACM Solutions, I developed strong experience in data wrangling and cleaning, data visualization, exploratory data analysis, and predictive modeling. This internship not only honed my technical skills but also allowed me to understand the importance of using data to drive business decisions.

Furthermore, I believe my passion for AI and sports will prove to be an asset in this role. I have always been an avid sports fan and I believe this industry has a great potential for growth with the use of data and machine learning models to optimize athlete performance, evaluate game tactics and fan engagement.

What motivates me the most is the constant learning and challenge that comes with working in the data science field. I am always eager to learn new techniques and technologies and I thrive in environments where I can continuously improve my skills.

I am confident that my background, passion and motivation make me an excellent candidate for the Data Scientist position at your company. I am excited about the opportunity to bring my skills and creativity to your team and contribute to your organization's success.

Thank you for considering my application. I look forward to discussing my qualifications further in an interview.

Sincerely,

[Your Name]",1606,258,290
32,"Dear Hiring Manager,

My name is [Your Name] and I am thrilled to apply for the Data Science position at [Company Name]. I am writing to express my interest in this role and share with you my passion for data analytics, AI, and sports.

As a highly motivated and dedicated individual, I am eager to join your team and contribute to your success. With [Number of years] years of experience in data analysis, I have developed skills in data wrangling, visualization, and statistical modeling. I have worked on several successful projects that have enabled me to develop expertise in data interpretation and communication skills. In addition, I have experience working with programming languages such as Python and R, as well as machine learning libraries such as TensorFlow and Keras.

What excites me most about joining your company is the opportunity to work on innovative AI projects that have the potential to revolutionize the sports industry. Given my passion for sports, I believe that I am uniquely positioned to contribute to your projects by developing data-driven insights that can inform strategic decisions.

Furthermore, I am committed to continuous learning and development. Therefore, I am constantly seeking opportunities to not only expand my skillset but also challenge myself to think outside the box. I am confident that my adaptability, resilience and strong work ethic will make me a valuable asset to your team.

In conclusion, I would like to thank you for considering my application. I am excited about the opportunity to contribute to your organization’s success and would welcome the chance to discuss my qualifications further. I am available for an interview at your convenience and look forward to hearing from you soon.

Sincerely,

[Your Name]",1774,285,330
33,"Dear Hiring Manager,

I am writing to apply for the Data Scientist position at your esteemed organization. As a highly motivated and analytical individual, I am confident that my skills and experience in data analysis, programming, and machine learning make me an ideal candidate for this role.

Having completed my bachelor’s degree in Computer Science, I have gained a solid foundation in various programming languages such as R, Python, and SQL. In addition, I have worked as a data analyst for two years, where I have developed my skills in data cleaning, data visualization, and statistical analysis. I am confident in my ability to leverage these skills to generate insights that enable data-driven decision-making in your organization.

I am also passionate about AI and making advancements in technology. During my studies, I have familiarized myself with machine learning algorithms such as regression, decision trees, clustering, and neural networks, and I have developed my ability to implement these algorithms efficiently using R, Python, and TensorFlow.

Aside from technology, sports are my passion. I have always been fascinated by how statistical analysis can be used to predict outcomes in sports. During my leisure time, I have explored various sports analytics use cases such as player performance, injury prediction, and game outcome prediction. I believe that my passion and knowledge of sports analytics combined with my data science skills could generate meaningful insights that would benefit your organization.

Overall, I am confident that I'm equipped with the necessary skills and passion to excel in this role. I welcome the opportunity to discuss further how I can contribute to your team. Thank you for considering my application.

Sincerely,

[Your Name]",1787,276,322
34,"Dear Hiring Manager,

I am writing to express my immense interest in the Data Science position currently available at your esteemed company. With a strong background in data analytics and machine learning, I am confident that I would make a valuable asset to your team.

As a passionate individual eager to learn new things, I am always hungry for innovation in the field of AI. My background in computer science has given me a solid foundation in programming, statistics, and data analysis. I am also familiar with various tools in data analysis such as Python, R, SQL, and Tableau. I understand the importance of using data to drive business decisions, and I am eager to apply my skills and knowledge to help your company achieve its goals.

Aside from my technical skills, I am also an avid sports fan. I believe that my passion for sports has taught me valuable lessons in teamwork, leadership, and determination, which I can translate into the workplace. With the combination of my technical know-how, and my passion for sports, I am confident that I can bring a unique perspective to the team and create innovative solutions to problems faced in the data science field.

Above all, I am extremely motivated and driven. I am constantly seeking new challenges and opportunities to learn and grow, which is what attracted me to apply to your company. I believe that your company is the perfect place for me to learn, grow and make a positive impact in the industry.

Thank you for considering my application for the Data Science position. I am confident that my skills, passion, and work ethic make me a perfect fit for the team.

Sincerely,

[Your Name]",1657,284,324
35,"Dear Hiring Manager,

I am reaching out to express my keen interest in the available position in Data Science at [company]. I have always been fascinated by the power of data and its potential to uncover meaningful insights and drive decision-making processes. As a highly motivated and driven individual, I believe that I have the skills and experience to make a valuable contribution to your team.

As a graduate with a degree in Computer Science, I have a solid understanding of programming languages such as Python, R, and SQL. Additionally, I have hands-on experience in data analysis and machine learning, which has allowed me to develop an analytical mindset and problem-solving skills.

What drives my passion for Data Science is AI. I believe that AI is the future of technology and that it holds immense potential to change the world we live in. Being a sports enthusiast, I have always been drawn to the application of AI in sports. I believe that the industry is ripe for innovation and creativity, and I am eager to be part of the team that drives this change.

What sets me apart from other candidates is my eagerness to learn and my ability to work both independently and in a team setting. I am a quick learner and am not afraid to ask questions to clarify my understanding. Additionally, I have excellent communication skills, which makes it easy for me to work collaboratively with team members and other stakeholders.

I am excited about the opportunity to work with your organization and contribute to your mission. Thank you for taking the time to consider my application. I look forward to the opportunity to discuss my qualifications in more detail.

Sincerely,

[Your Name]",1697,287,323
36,"Dear Hiring Manager,

I am delighted to apply for the Data Science position at your esteemed organization. I am a highly motivated and passionate individual who is eager to learn and contribute to the organization. Data Science has always been my area of interest, and I believe that my skills and experience make me the perfect fit for this role.

As I navigate through the world of Artificial Intelligence, I realize that the possibilities are endless. I am fascinated by the power of data, how it can be mined, analyzed, and transformed into insightful information. The idea of using data to solve complex problems inspires me greatly, and I believe that your organization shares the same vision.

In addition to my interests in AI, I am also passionate about sports. As an avid fan of sports, I am constantly seeking new ways to analyze data and gain insights about my favorite teams and players. This passion for sports and data has taught me the importance of attention to detail, data accuracy, and data-driven decision-making, skills that I believe will be valuable in this position.

I graduated from XYZ University with a degree in Data Science, where I learned how to apply various analytical and statistical tools to ease decision-making processes. During my time at the university, I had the opportunity to work on several projects that involved data mining, machine learning, and predictive modeling. I am confident that this experience has equipped me with the necessary skills and experience to excel in this role.

I am dedicated to learning and growing professionally. I am a proactive individual who is not afraid to take the initiative and go above and beyond what is expected of them. As an enthusiastic and motivated individual dedicated to achieving great results, I am confident that I would make a positive contribution to your team.

Thank you for considering my application. I look forward to discussing this opportunity with you.

Sincerely,

[Your Name]",1982,327,368
37,"Dear Hiring Manager,

I am writing to express my interest in the Data Science position currently available at your esteemed organization. As a highly motivated and eager learner, I am excited to apply for this opportunity and use my skills and expertise to make a meaningful impact in the field of Data Science.

I am a passionate individual with a deep interest in AI, Machine Learning and data analytics. Through my coursework, internships, and extracurricular activities, I have developed a strong foundation in data analysis, Python programming, statistical analysis, and data visualization. I am always on the lookout for the latest trends and technologies in the field of Data Science and regularly attend workshops and conferences to expand my knowledge.

One of my passions outside of Data Science is sports. I strongly believe that sports provide a great platform for data analysis and presenting meaningful insights that can make a significant difference to the sport. I have been an active participant in various sports data analysis projects where I have obtained relevant data, performed statistical analysis, and presented insights to the team. This experience has truly honed my problem-solving and presentation skills.

I have attached my resume and academic transcripts for your review. I am confident that my skills and experiences make me an excellent candidate for this position. I am excited to learn more about the position and your organization, and I hope to have the opportunity to discuss my qualifications in more detail with you soon. Thank you for your time and consideration.

Sincerely,

[Your Name]",1630,258,293
38,"Dear Hiring Manager,

I am writing to express my strong interest in the Data Science position currently available within your organization. As a highly motivated and eager learner, I bring a passion for data science and an unwavering commitment to delivering accuracy and insightful analysis to your team.

I am confident that I would be a valuable addition to your team, as I am well-versed in a variety of data science techniques, including machine learning, data visualization, and statistical analysis. My educational background in Computer Science and years of practical experience in this field have given me the knowledge and skills necessary to be successful in this role.

One area of particular interest for me is AI, an evolving field with vast potential for revolutionizing our world. I am continuously exploring and learning about the latest advancements in AI, and I possess the skills and knowledge to apply these advancements to data science projects.

Moreover, sports are my passion, and I firmly believe that data science can play a significant role in sports industries. I am enthusiastic about developing data-driven models that can assist with player scouting, team performance analysis, and game outcome predictions.

In addition, I am excited to work with a team of experienced professionals who share my passion for data science and my commitment to achieving excellence. I enjoy collaborating with colleagues, sharing ideas and knowledge, and learning from others. I am confident that I would thrive in your team-oriented environment.

Thank you for considering my application for this Data Science position within your organization. I look forward to the opportunity to further discuss my qualifications and learn more about how my skills can be used to contribute to the success of your organization.

Sincerely,

[Your Name]",1853,290,329
39,"Dear [Hiring Manager],

I am writing to express my interest in the Data Scientist position currently available at your esteemed organization. As a highly motivated candidate, I am eager to showcase my unparalleled skillset and knowledge of data science while also learning new techniques and trending developments in the field.

With a Bachelor's degree in Computer Science and a Master's degree in Data Science, I have had the opportunity to apply my knowledge in real-life situations in various roles. I possess highly developed data analytics and visualization skills, coupled with a refined understanding of data modeling and artificial intelligence. 

I am highly fascinated by artificial intelligence, which is what inspired me to specialize in the field of data science. Through my graduate studies and research, I have gained significant exposure to AI models in image and speech recognition, natural language processing, and predictive analytics. I believe that artificial intelligence will revolutionize the world, and I am eager to be part of the innovation, growth, and development at your organization.

Sports have also been my passion from an early age, and I strongly believe that the principles of teamwork, strategy, and performance can be applied to many aspects of life, including data science. I believe that sports and technology have a lot in common and can be harnessed to developing innovative solutions, which is something that I would love to contribute to your organization.

I am excited about the opportunity to work with your organization, and I believe that I can make a valuable contribution to your team. My passion and drive for excellence, coupled with my skills and knowledge in data science, make me an ideal candidate for this position. I look forward to having the opportunity to further discuss my qualifications with you and to explore how I can make a valuable contribution to your organization.

Thank you for considering my application.

Sincerely,

[Your Name]",2006,316,362
