,text,chars,words,tokens
0,"Dear Hiring Manager,

I am excited to apply for the Data Science position that has recently opened up at your company. With my strong interest in the field of data science, along with my motivation to learn more about emerging technologies, I am confident that I can make a meaningful contribution to your team.

As someone who has always been fascinated by exploratory data analysis and statististics, I am ecstatic about the prospect of utilizing my skills and passion to create novel insights that can support your company's goals. Apart from that, I am especially intrigued by the application of Artificial Intelligence and the possible use cases in the tech industry. I believe that there is always another model or algorithm that can improve the performance of predictions and insights, and I am constantly seeking new ways to enhance my skills so that I can help my team and the company as a whole.

I am also excited to bring my love of sports to the workplace. It's a passion of mine that has always helped me develop an analytical mindset, providing unique insights into how to optimize data to produce meaningful results. I believe that broadening the information used in analytical models can be especially beneficial, and I think that using sports data can be a useful tool in achieving that goal.

I am eager to bring my experience and dedication to your esteemed company and will work tirelessly to develop new solutions that can have a meaningful impact on your business. I appreciate your time and consideration for this position, and I look forward to the opportunity to speak with you about how my unique qualifications can aid in achieving your team's goals.

Thank you for considering my application.

Sincerely,

[Your Name]",1746,294,324
1,"Dear Hiring Manager,

I am excited to submit my application for the Data Science position at your organization. As a highly-motivated and enthusiastic individual, I am confident that I have the skills and expertise to excel in this role.

My passion for data science is driven by my love of AI and its potential to revolutionize the way we solve problems. I have completed advanced coursework in data science and machine learning, and I have experience in data collection, cleaning, analysis, and visualization. I am also proficient in statistical programming languages such as R and Python.

In addition, my passion for sports has led me to explore the applications of data science to sports analytics. I have collaborated on several projects involving data analysis of sports performance and game outcomes, which has further strengthened my skills in data science.

As a recent graduate, I am eager to apply my skills and learn more from experienced professionals in the field. I am a hard worker, quick learner, and team player, with strong communication and problem-solving skills. I am confident that I would make a valuable contribution to your team.

Thank you for considering my application. I look forward to discussing my qualifications further.

Sincerely,

[Your Name]",1280,205,238
2,"Dear Hiring Manager,

I am writing to express my interest in the Data Scientist position at your company. As a highly motivated and enthusiastic individual, I am confident that I possess the necessary skills and experience to make a positive contribution to your team.

I am passionate about data science and its potential to drive growth and innovation in organizations. My experience in data analysis, predictive modeling, and machine learning techniques has prepared me well for the challenges of the role. It excites me to work with data-rich companies such as yours, and apply my skills to improve business decisions and results.

Additionally, I love AI and its impact on our lives, as well as sports, which I am passionate about. I believe this combination of traits will allow me to bring a unique perspective to your team and contribute to the development of innovative solutions.

Throughout my career, I have demonstrated strong communication skills and a proven ability to work both independently and collaboratively. I am eager to learn new things, and I am always looking for ways to improve my skills and knowledge.

As a candidate, I am committed to exceeding expectations and contributing to the success of your organization. I am confident that my passion, skills, and experience make me a perfect candidate for the Data Scientist role in your team. I look forward to discussing my qualifications further and learning more about how I can contribute to your organization.

Thank you for considering my application.

Sincerely,

[Your Name]",1557,252,285
3,"Dear Hiring Manager,

I am thrilled to submit my application for the Data Scientist position at your company. I am a dedicated and motivated professional with a passion for data analysis, machine learning, and AI technology.

As someone who has always been fascinated by how data can be used to gain insights, I have pursued an education in statistics and computer science, where I have honed my skills in Python, R, SQL, and other important data analysis tools. I have also completed various online courses and practical certifications to further improve my understanding of data analysis.

My passion for AI and data analysis extends beyond the workplace. I enjoy following emerging trends in the field and exploring how they can be applied across other industries. In particular, I am interested in the ways that data can analyze and enhance sports performance, an area that combines my professional interests with my personal passion.

I also have experience working collaboratively with teams and value open communication and transparency. I am confident that my strong technical and interpersonal skills position me as an ideal candidate to join your ambitious team.

Thank you for considering my application. I am excited at the prospect of contributing my skills and passion towards the goals of your company.

Sincerely,

[Your Name]",1342,214,241
4,"Dear Hiring Manager,

I am writing to express my interest in the Data Science position available at your company. With a strong educational background in data science and a passion for AI, I am confident that my skills and experience make me a perfect fit for this role.

As a lifelong learner, I am constantly seeking opportunities to expand my knowledge and skills in the field. My experiences in data analysis and visualization have given me practical experience in identifying trends and patterns in data, and my passion for AI has driven my desire to explore the latest advancements in machine learning and predictive analytics.

I am particularly interested in the intersection of sports and data science, as I am an avid sports fan. I believe that applying data science in sports can help teams make better decisions and improve their overall performance, which is something I would love to be a part of.

Throughout my academic and professional career, I have consistently demonstrated strong analytical and problem-solving abilities, while also being a team player and effective communicator. I am confident that I would bring this same level of dedication and enthusiasm to your team.

Thank you for considering my application. I look forward to the opportunity to discuss my qualifications in more detail.

Sincerely,
[Your Name]",1340,217,240
5,"Dear Hiring Manager,

I am excited to apply for the Data Science position currently available at your company. After researching your company's vision and values, I am confident that my admixture of technical expertise and passion for AI will make me a valuable addition to your team.

As an individual who is highly motivated and eager to learn, I am thrilled to bring my spark to your innovative company. My ability to create data models, predict outcomes, and analyze data patterns can contribute to the development of data-driven solutions for your clients. I have spent the last four years working in data science, a domain in which my analytical and problem-solving skills have been honed. My specialization in artificial intelligence and machine learning has allowed me to develop autonomous decision-making algorithms that help address complex challenges in various industries. 

Moreover, I am passionate about sports, and I believe that your company's products and services can help improve the quality of the industry as well. My familiarity with sports analytics and analytics-driven decision making can bring a fresh perspective to your projects.

Thank you for considering my application. I am eager to learn more about this opportunity and would love to interview further with you.

Sincerely,

[Your name]",1321,207,238
6,"Dear Hiring Manager,

I am writing to express my interest in the Data Scientist position at your esteemed organization. As a passionate professional, I am confident that I possess the skills and dedication necessary to excel in this role.

I am thrilled by the prospect of joining the team at your company, as I have always admired the innovative solutions and latest technologies that your organization provides. As someone who is deeply interested in AI, I am excited about the opportunities that this position holds to work with cutting-edge technologies in the field.

Throughout my career, I have developed proficiency in various data science tools and techniques, and I am eager to apply these skills to drive business growth and success. I am a quick learner who is always eager to learn new technologies and methodologies, and I believe that this quality will benefit your organization immensely.

Moreover, sports are my passion, and I am confident that my experience and knowledge in this area will enable me to provide unique insights to develop practical solutions using data science.

I am confident that my skills, motivation, and enthusiasm make me an excellent fit for the role of Data Scientist at your renowned organization. I look forward to providing you with more details about my experience in an interview.

Thank you for considering my application. I hope to hear from you soon.

Sincerely,

[Your Name]",1427,233,260
7,"Dear Hiring Manager,

I am excited to apply for the Data Scientist position and I am writing to express my passion for this opportunity. As a data science enthusiast, I have always been intrigued by the potential that data has to reveal insights and drive innovative solutions, particularly in the field of AI. Additionally, my love for sports has given me the opportunity to see how data analysis can be used to optimize athlete performance.

I am a motivated and ambitious individual who is consistently eager to learn and develop new skills. I have completed multiple online courses in programming and statistical analysis, using languages such as Python and R, and I am proficient in data visualization tools like Tableau. I also have strong communication skills and am comfortable collaborating with team members, stakeholders and executives to identify business needs and recommend data-driven solutions.

As a Data Scientist, I would be committed to driving meaningful change in the organization by using data to provide valuable insights that pave the way for informed decision-making. I believe I would be a strong asset to the team, possessing both technical expertise and a genuine interest in making a positive contribution.

Thank you for considering my application. I look forward to the opportunity to further discuss my qualifications and how I can contribute to the team.

Sincerely,

[Your Name]",1413,225,251
8,"Dear Hiring Manager,

I am excited to apply for the data science job opening at your esteemed organization. I am highly motivated to learn and contribute my skills towards achieving the goals of the company. Having an immense passion for AI and sports, I believe that my knowledge and experience will be a perfect match for your organization's requirements.

As a data scientist, I have hands-on experience in analyzing complex data, developing predictive models, and presenting insights to stakeholders. I have worked on various projects, ranging from natural language processing, recommendation systems, and predictive modeling. During my previous work experience, I have acquired expertise in programming languages like Python, R, and SQL. Data visualization using Tableau, and big data processing using Apache Spark has also been part of my skill set.

Aside from my technical skills, I am an enthusiastic learner, an excellent team player, and a dedicated problem solver. I believe that through continuous learning and applying innovative approaches, I can provide valuable contributions that will enhance the overall performance of the organization.

In addition, my passion for sports has driven me to seek and develop analytical and machine learning skills relevant to the sports industry. Combining my skills in data science and passion for sports, I believe that I can contribute to projects related to sports analytics that your organization may have.

I am excited to take on new challenges and add value to your organization. Thank you for your consideration of my application. 

Sincerely,

[Your Name]",1616,249,289
9,"Dear Hiring Manager,

I am excited to apply for the Data Science position at your company. As a highly motivated and enthusiastic individual, I believe I have much to offer to the position and the company as a whole.

My passion for data science stems from a desire to better understand and analyze complex data sets. I am constantly seeking to deepen my knowledge and skills in this area, and I am confident that I possess the necessary background and experience to excel in this role.

Additionally, I have a deep interest in artificial intelligence and its many applications, and would relish the opportunity to work with cutting-edge technologies and develop innovative solutions. Furthermore, as a sports enthusiast, I have a strong understanding of the unique challenges and opportunities that arise in this field and would be well-suited to applying data science techniques to the world of sports.

In my previous experience, I have demonstrated a strong ability to work collaboratively and communicate effectively. I am confident that I can bring this same level of dedication, skill, and enthusiasm to your company.

Thank you for considering my application. I look forward to the opportunity to further discuss my qualifications and interest in the position.

Sincerely,

[Your Name]",1293,207,236
10,"Dear Hiring Manager,

I am excited to submit my application for the Data Scientist position at your esteemed organization. With a strong passion for AI and extensive skills in data analysis, I am confident in my ability to contribute to your team and successfully achieve your objectives.

I am highly motivated and enthusiastic about the prospect of utilizing data to drive decision-making and deliver measurable impact. My analytical background, coupled with my eager to learn, makes me a strong candidate for this role. Furthermore, my love of sports has taught me the value of teamwork, accountability and perseverance - all of which I believe would be an asset to your organization.

Throughout my undergraduate studies in data sciences, I gained extensive experience and knowledge in statistical analysis, programming and machine learning. During my internships, I have had a chance to apply these skills in practical, real-world settings. I have extensive experience working with Python, R, SQL, and data visualization tools such as Tableau.

What I loved about the job listing was that it mentions both technical and collaborative skills. Over the past few years, I have had the opportunity to hone my technical skills through coursework and various projects. Simultaneously, I have had experience working on collaborative projects that required me to communicate complex concepts to non-technical stakeholders.

I am confident that my unique blend of technical knowledge and collaborative qualities, coupled with my passion for AI and sports, would make me an excellent addition to your organization. I would be grateful for the chance to interview and discuss how my skills and experience would bring value to your team.

Thank you for considering my application. I look forward to hearing back from you soon.

Sincerely,

[Your Name]",1844,288,332
11,"Dear [Hiring Manager],

I am writing to express my strong interest in the Data Science position at [Company Name]. As a recent graduate of [University Name] with a degree in Computer Science, I am eager to jump-start my career in the field of Data Science.

From early on in my studies, I developed a keen interest in Artificial Intelligence and its potential to solve complex problems. I have always been curious about the power of Data Science in creating impactful solutions, and I believe that my skills make me a great fit for the position.

What sets me apart is my passion for sports. I have always believed that the principles of strategy, teamwork and analytics that govern sports also apply to the fields of Data Science and Machine Learning. I am confident that my experience in working as a sports analyst has helped me hone my skills of data collection, analysis and visualization.

My skills include proficiency in a variety of programming languages such as Python, R, SQL, and Java. Additionally, I have worked on several projects that have enabled me to develop key skills in data modeling, data mining, and data visualization. My projects have not only helped me gain experience in Data Science, but they have also given me the opportunity to work with real-life data sets.

I am excited about the prospect of joining your team at [Company Name] and contributing to its success. Thank you for considering my application. I look forward to discussing my passion for Data Science and sports further with you.

Sincerely,
[Your Name]",1547,262,301
12,"Dear [Hiring Manager],

I am writing to apply for the Data Science role that was recently advertised on your company's website. I am enthusiastic about this opportunity as I believe that I possess the skills and qualities that would make me a valuable addition to your team.

I am a highly motivated individual who is passionate about using data to find insights and create innovative solutions. I love learning new things and am constantly seeking to improve my skills. I have completed courses in machine learning, deep learning and data analysis and I have experience using Python and R for data manipulation and visualization.

My enthusiasm for data science stems from my love of sports. As an athlete, I've always been fascinated by the use of data in sports to gain a competitive edge. Through my own interest in sports analytics, I have gained insight into data-driven decision making, which I hope to use in a data science role.

I am confident that I would be successful in this role because I am a creative thinker and a problem solver. I thrive in an environment that challenges me to think outside the box and come up with innovative ideas. Through my experience working in a team, I have learned to communicate effectively, listen actively, and respond to feedback positively.

I'm eager to explore the potential of AI in sports and contribute to innovative solutions that drive the company forward. Thank you for considering my application. I look forward to hearing from you soon.

Sincerely,

[Your Name]",1521,256,288
13,"Dear Hiring Manager,

I am excited to apply for the Data Science position at your esteemed organization. As an individual with a passion for AI and a deep rooted interest in sports, I am confident that my knowledge of data science and eagerness to learn will make me a great fit for the role.

Having completed my Bachelor's degree in Computer Science and continued on to a Master's program in Data Science at XYZ University, I have gained a strong foundation in the technical aspects of data science. My academic background has equipped me with the necessary skills in programming, machine learning algorithms, statistical modeling, and data visualization. I am passionate about using data science to solve real-world problems and create efficient solutions.

In addition to my technical skills, I am also an ardent sports enthusiast. My passion for sports ignited my curiosity to explore opportunities to apply data science in analyzing sports data. For instance, I have independently worked on projects to predict the outcomes of football games using machine learning algorithms. Furthermore, I have also contributed to a research project aimed at analyzing the performance of cricket players using statistical models.

As a motivated and adaptable learner, I am eager to expand my knowledge and advance my skills in the field of data science. I am confident that my passion for AI and sports, combined with my technical knowledge and willingness to learn, will be an asset to your team.

Thank you for considering my application. I look forward to the opportunity to discuss my qualifications further.

Sincerely,
[Your Name]",1629,262,296
14,"Dear Hiring Manager,

I am writing to express my interest in the Data Science position currently available at [company name]. From my past experiences in the field and my passion for data analysis, I am confident that I possess the skills necessary to excel in this role.

My passion for technology led me to pursue a bachelor's degree in Computer Science, and during my academic tenure, I discovered a love for data-processing algorithms and artificial intelligence. After graduating, I dove into the world of data science and have been honing my skills with each project I’ve undertaken in the years since.

One thing that sets me apart from other candidates is my deep interest in sports. As an avid sports fan, I find myself fascinated by the ways that data can be used to predict outcomes and optimize team performance. If given the chance, I would love to apply my skills and passion to this area.

I thrive in an environment that values collaboration and the pursuit of knowledge, and from what I've learned about [company name], it sounds like your team shares those same values. With an emphasis on innovation and cutting-edge research, [company name] represents an exciting opportunity for me to grow both professionally and personally.

Thank you for taking the time to consider my application. I look forward to the opportunity to contribute to your company and continue sharpening my skills in data science.

Sincerely,
[Your name]",1444,240,276
15,"Dear Hiring Manager,

I am excited to apply for the Data Science position at your esteemed organization. As a highly motivated and passionate individual, I am confident that my skills and experience align perfectly with the requirements of this role.

I am extremely interested in the field of AI and its limitless potential to revolutionize the way we approach data analysis. I have completed several projects involving machine learning algorithms, natural language processing and computer vision as a part of my studies in Data Science. My ability to analyze, interpret and visualize data has helped me gain experience in different domains and developed a unique perspective towards data analysis.

Another area that I am passionate about is sports, and I have been fortunate enough to combine this passion with data science on various occasions. From building prediction models and identifying key performance indicators in sports analytics, to designing algorithmic trading strategies in the sports betting market, my exposure to the application of data science in sports has made me appreciate the value of data-driven decision making.

Furthermore, I am eager to learn and expand my skillset. I have a proven track record of adapting quickly to new tools and technologies, and my strong analytical and problem-solving skills have enabled me to tackle complex projects with efficiency and accuracy.

Thank you for considering my application. I am excited to bring my passion and expertise to your organization, and I believe that my commitment and willingness to learn would be an asset to your team.

Sincerely,

[Your Name]",1630,256,286
16,"Dear Hiring Manager,

I am writing to apply for the Data Science position currently open at your company. Admittedly, I am driven and motivated to join your talented team due to your reputation for operating within a dynamic and challenging environment. With your company's focus on Artificial Intelligence, I see much potential for both personal and career-based growth.

I am excited to apply for this role as I have always been drawn to the power of data and its ability to drive intelligent solutions which make a positive impact. Being an avid sports enthusiast and having recognized that there's a correlation between the performance of a sports team and the data tracked during a game, I became enthusiastic about data science in sports. I am confident that this experience and interest in sports would bring a unique perspective to your team and ultimately lead to successful data-driven decisions.

Additionally, I am a quick learner and constantly challenge myself to stay ahead of the industry trends, technologies, and tools. I have pursued advanced certifications to strengthen my technical skills in programming languages such as R and Python, enabling me to wrangle and analyze large datasets.

I am thankful for the opportunity to apply for the Data Scientist position at your company and to add my skills, experiences, and abilities to the team. Thank you for considering my application. I am excited about the opportunity to move forward.

Sincerely,

[Your name]",1481,239,271
