,text,chars,words,tokens
17,"Dear Hiring Manager,

I am writing to express my strong interest in the Data Scientist position that has recently become available at your company. As a highly motivated individual who is passionate about AI and sports, I am confident that my skills and experience make me an excellent fit for this role.

In my previous experiences, I have gained valuable data analysis skills and experience working with machine learning algorithms. Additionally, my strong mathematical background and superior analytical skills have allowed me to turn complex data sets into actionable insights. As someone who is constantly eager to learn more and grow, I see myself as a lifelong learner who is excited by the prospect of working and learning alongside like-minded individuals.

My love for AI and sports is what has led me to pursue a career in data science, and I believe that your company is the perfect place for me to combine my passion with my skills. Your dedication to using innovative methods and cutting-edge technology aligns with my personal and professional goals, and I believe that I would thrive in this environment.

I am confident that my education, skills, and experience make me a great candidate for this Data Scientist role, and I look forward to contributing my expertise and learning from talented professionals like yourself. Thank you for your time and consideration, and I hope we can speak further about how I can contribute to your team.

Sincerely,

[Your Name]",1479,243,270
18,"Dear Hiring Manager,

I am writing to express my interest in the Data Science position available at your organization. As a motivated and eager learner, I believe that I have the skills and enthusiasm necessary to thrive in this role. Furthermore, my passion for sports and AI makes me an ideal candidate to excel in this position.

With a Bachelor's degree in Computer Science and several years of professional experience, I am confident that I possess the technical skills necessary to take on this role. Additionally, I have a strong background in statistics and data analysis, which will be invaluable in the realm of Data Science. In my previous roles, I have demonstrated a keen ability to handle complex data sets and communicate insights to non-technical stakeholders.

Moreover, my love for AI and sports sets me apart from other candidates in this field. I have worked on several projects that involved analyzing sports data, specifically football statistics. This experience has taught me how to apply a data-driven approach to sports analysis, and I believe that this skill set will be valuable in analyzing other types of data as well. Furthermore, my interest in AI drives me forward in the pursuit of finding new and innovative ways to use data to solve complex problems.

I am excited about the possibility of working for your organization and would welcome the opportunity to contribute my skills to the team. Thank you for considering my application.

Sincerely,

[Your Name]",1493,245,276
19,"Dear Hiring Manager,

I am excited to express my interest in the Data Science position at your company. As someone who is very motivated and eager to learn, I have a passion for utilizing AI and data analysis to drive impactful decisions. Moreover, I have a strong background in sports and believe that a data-driven approach can revolutionize the way teams operate and achieve success.

I have completed my undergraduate degree in Computer Science and have also completed several online courses related to data science, including programming languages and statistical analysis. I possess strong analytical skills with the ability to solve complex problems and make data-driven decisions that have a positive impact on business objectives.

In my previous work experience, I have worked on various data analysis projects, utilizing multiple programming languages and visualization tools. I have also demonstrated the ability to work collaboratively with cross-functional teams to achieve project goals and objectives.

I am confident that my knowledge, experience, and passion for data science make me an ideal candidate for the job. I am excited about the opportunity to work with a dynamic team and contribute to the company's growth.

Thank you for considering my application. I look forward to hearing from you soon.

Sincerely,
[Your Name]",1344,208,237
20,"Dear Hiring Manager,

I am writing to express my interest in the Data Science position currently available within your organization. My study and experience in data analysis and my passion for Artificial Intelligence and sports, make me a suitable candidate for the job.

As someone who is highly dedicated and motivated, I am eager to learn and grow as a professional. I come from an academic background in Computer Science, and have done extensive research work in Data Science. During my studies, I developed a strong understanding of various analytical tools and technologies necessary for interpreting and communicating data insights. With my technical knowledge and expertise, I am confident in my ability to make meaningful contributions to your team.

As I mentioned earlier, I am extremely passionate about AI and how it can be leveraged in the field of sports. My experience working with data, combined with my love for sports, has led me to explore the possibilities of how artificial intelligence can revolutionize the way we think, train and strategize in sports.

I believe that my skills, knowledge and passion make me an ideal fit for your team. I am confident in my ability to bring fresh ideas and a proactive approach to your organization. I am excited about the prospect of working with you and contributing to the growth of your organization.

Thank you for considering my candidacy. I look forward to the opportunity to further discuss my qualifications with you.

Sincerely, 
[Your Name]",1510,246,278
21,"Dear [Hiring Manager],

I am writing to express my interest in the open position of Data Scientist at [Company]. As a recent graduate in Data Science, I am very excited to have the opportunity to apply my skills and knowledge in a real-world setting. 

I am a highly motivated and eager learner with a passion for applying data science to solve complex problems. My love for AI stems from my eagerness to explore the frontiers of technology and seek out innovative solutions. Additionally, my passion for sports has taught me about the importance of collaborating in a team, setting clear goals and working towards achieving them with dedication and perseverance.

During my studies, I worked on several projects that required me to use analytical tools to extract insights from data. I am proficient in several programming languages, analytical tools and data visualization software. I have also worked on several machine learning projects and have experience in various algorithms and techniques.

Your company's values align well with my interest and passion. I am impressed by the work that [Company] does in the field of [specific field or project], and I would be delighted to become a part of this mission-driven company.

Thank you for considering my application. I am excited for the opportunity to bring my skills and enthusiasm to [Company] and contribute to the growth and success of the team.

Sincerely,
[Your Name]",1429,233,270
22,"Dear Hiring Manager,

I am writing to apply for the Data Science position at your renowned organization. The moment I learned about the opening, I knew I had to apply because it aligns perfectly with my career aspirations and passion for data-driven insights. 

As a recent graduate in computer science, I have gained a solid foundation in coding languages and data analysis, which I believe prepared me well for this role. I have interned at various start-ups, where I got to work with several data science tools, such as SAS, Python, and R. My hands-on experience with these technologies enabled me to analyze complex datasets and extract meaningful insights from them.

I am highly motivated and eager to learn new techniques and algorithms that will help me become a better data scientist. I am also an avid enthusiast of machine learning and artificial intelligence, and I am confident that this role will provide me with the opportunity to expand my knowledge in these areas.

Additionally, sports are my passion, and I have always been fascinated by the vast potential that data science has in the world of sports. I have even developed a few sports-related projects, such as predicting the results of football matches using machine learning algorithms, as well as analyzing player performance using statistical models. 

In conclusion, I believe that my skills, academic qualifications, and motivation make me a suitable candidate for this role. Your organization has an outstanding reputation within the industry, and I would be thrilled to contribute to its continued success. Thank you for your time and consideration, and I look forward to hearing from you soon.

Sincerely,

[Your Name]",1699,275,317
23,"Dear Hiring Manager,

I am writing to express my sincere interest in the Data Scientist position available at your organization. As a recent graduate with a Bachelor’s degree in Computer Science and a strong passion for AI, I am eager to apply my skills and knowledge to make a meaningful contribution to your team's goals.

Throughout my studies, I have developed a strong foundation in mathematics, statistics, and coding with a specific focus on machine learning and data analysis. I have completed several projects in the field of AI and have experience working with algorithms, frameworks, and libraries such as TensorFlow, PyTorch, and Scikit-learn.

Moreover, I am an avid sports fan and enjoy analyzing the data behind different team strategies and player performance. This passion has not only allowed me to understand the importance of data-driven decision-making but also spurred me to explore how emerging technologies are transforming the sports industry.

As a professional, I am committed to maintaining the highest standards of accuracy, precision, and efficiency in my work. I have excellent problem-solving skills, and I am always eager to take on new challenges and responsibilities. I am confident that my intelligence, adaptability, and love for learning will make me an excellent fit for your organization.

Furthermore, I would like to express my enthusiasm towards your company's culture of innovation and technology. I believe that this opportunity offers the perfect environment for me to thrive both as a Data Scientist and as a professional.

Thank you for considering my application. I am looking forward to hearing from you and discussing how I can contribute to your company's success.

Sincerely,

[Your name]",1741,272,319
24,"Dear Hiring Manager,

I am writing to express my strong interest in the Data Science position currently available at your esteemed organization. As a passionate and motivated individual with a strong academic background in data science, I believe that I possess the necessary skills and knowledge to excel in this role.

From a young age, I have always had a keen interest in sports and technology. Given this passion, I was naturally drawn to the field of data science, which has allowed me to explore my enthusiasm for sports analytics, using data to optimize team and player performance. Through my coursework and research projects, I have gained hands-on experience in using statistical methods and machine learning algorithms to model large sets of complex data, making accurate predictions and actionable insights.

One of the main reasons why I am excited about this position is the opportunity to work with AI, which is an emerging field with almost limitless possibilities. I am particularly interested in deep learning algorithms and their potential applications in the sports industry, which include predicting game outcomes, guiding coaching decisions, and identifying player-specific strengths and weaknesses.

Throughout my academic and professional experiences, I have learned to work independently as well as part of a team, implementing creative approaches and efficiently solving problems. With my strong critical thinking skills, attention to detail, and ability to think outside the box, I am confident that I would be an asset to your organization.

I look forward to the opportunity to contribute my skills, knowledge, and enthusiasm to your team. Thank you for considering my application. 

Sincerely,

[Your Name]",1737,267,304
25,"Dear [Hiring Manager],

I am excited to submit my application for the Data Science position at your company. As an individual who is motivated and eager to learn, I believe that I am a great fit for your team's culture and values.

I have a passion for leveraging data to drive insights, and I have been fascinated with artificial intelligence and machine learning for many years. Using my strong analytical skills, I am confident that I could contribute to your company's success by delivering data-driven solutions that make a real impact.

Beyond my professional qualifications, I have a great love for sports, which I believe is a critical outlet for personal growth and development. I am always excited to meet and work with people who share similar passions for fitness and competition, as it brings added meaning and richness to work and life.

Thank you for considering my application. I would love the opportunity to further discuss my qualifications with you and share more about my professional aspirations.

Sincerely,

[Your Name]",1043,171,195
26,"Dear Hiring Manager,

I am excited to submit my application for the Data Science position with (company name). With a strong background in data analytics and a passion for AI, I believe I would be an asset to your team.

As a recent graduate in computer science, I am eager to apply my knowledge and skills to real-world applications. My experience in data analysis and statistical modeling has taught me the importance of interpreting data for actionable insights. Additionally, my fascination with AI has driven me to stay current on the latest industry advancements and fueled my desire to contribute to the field.

Beyond my academic and professional experience, sports are my passion. Not only do sports bring me joy and a sense of community, but there are also endless opportunities for data analysis and prediction models. I believe that my love for sports can translate well into my work and enhance my perspective on data analytics.

I am highly motivated and eager to learn, and I believe that my skills, interests, and enthusiasm would make me a valuable asset to your team. I have attached my resume for your review and look forward to the opportunity to discuss my qualifications further.

Thank you for considering my application.

Sincerely,

[Your Name]",1269,211,237
27,"Dear Hiring Manager,

I am writing to apply for the Data Scientist role your company currently has open. I am thrilled at the opportunity to bring my skills, passion, and energy to contribute to your team. 

I am a highly motivated individual with a strong passion for data science, AI, and sports. I am confident that my skills and experience make me an ideal candidate for this role. I have extensive experience using various data tools and techniques to extract insights from data. My career has been driven by a passion for leveraging data-driven insights to make informed business decisions. 

Furthermore, I am committed to continued learning and growth within the field of data science. I have recently completed additional coursework in machine learning, which has been a passion of mine. I am also deeply committed to professional development and staying up-to-date with industry trends and best practices. 

In addition to my enthusiasm for data science, I am also a dedicated sports enthusiast. I believe that my passion for sports could be an asset to your team in exploring ways to use data science to enhance sports-related applications. 

Thank you very much for considering my application. I look forward to discussing this opportunity further, and I am excited at the prospect of contributing to your company's success as a Data Scientist.

Sincerely,
[Your Name]",1380,224,259
28,"Dear Hiring Manager,

I am excited to apply for the Data Scientist role at your company. With a strong background in data analytics and a passion for AI and sports, I believe I am the ideal candidate for this position.

As a recent graduate, I have gained knowledge and experience in data analysis through various internships, coursework and personal projects. These experiences have provided me with a deep understanding of data structures, algorithms and database management. I am skilled in various coding languages, including Python, R, and SQL, which I have used to develop effective data-driven models.

My passion for AI has led me to explore various applications of Machine Learning, and its potential for improving athlete performance. I believe the power of data and AI to optimize performance and better predict outcomes is immense. I have pursued several projects in this area, combining my passion for sports and data analytics, which demonstrates my enthusiasm and innovative approach.

As a professional, I am a quick learner, detail-oriented, and a strong problem-solver. My eagerness to learn and dedication to quality work make me confident that I can contribute significantly to your organization's success.

Thank you for your time and consideration. I look forward to discussing how my skills and enthusiasm can help you achieve your company's goals.

Sincerely,

[Your Name]",1396,219,258
29,"Dear [Hiring Manager],

I am writing to express my strong interest in the Data Scientist position at [Company]. As a recent graduate in Data Science, I am eager to start my career in the field and believe that my skills and passion align perfectly with the requirements of this role.

What excites me most about data science is the endless possibilities it offers to solve real-world problems. I have always been fascinated by the potential of AI and its role in the future of technology. At the same time, I am also a dedicated sports enthusiast, and I believe that data science can have a significant impact on the sports industry through insights into player performance, game strategy, and fan engagement.

Throughout my studies, I have developed strong analytical skills, and I am proficient in various programming languages such as Python, R, and SQL. I have also worked on various projects that have provided me with a deep understanding of data visualization, data cleaning, and data analysis techniques.

What sets me apart from other candidates is my eagerness to learn and my ability to work collaboratively with others. I am a quick learner, and I thrive in environments that challenge me to think creatively and adapt to new situations. Moreover, my passion for data science and sports has given me a unique perspective on the value that this field can add to society.

As an individual committed to progress and innovation, I am confident that I would make a valuable contribution to your team. I would welcome the opportunity to discuss my application in further detail and learn more about the role that I could play within your organization.

Thank you for your consideration.

Sincerely,

[Your Name]",1718,287,326
30,"Dear Hiring Manager,

I am writing to express my strong interest in the Data Science role at your esteemed organization. As a highly motivated individual with a passion for AI and a strong background in data analysis, I believe I am the perfect candidate for this position.

My educational background in Data Science, combined with my experience working on various data analysis projects, has equipped me with the technical skills necessary to excel in this role. Furthermore, my eagerness to learn and adapt to new technologies and methodologies make me confident in my ability to contribute to the success of your team.

In addition to my technical skills, I have a deep passion for sports, which fuels my enthusiasm for data science in this field. I believe that my knowledge of sports and proficiency in data analysis can drive innovation and bring value to your organization.

I am excited about the opportunity to contribute to your team and to continue growing in my professional development. Thank you for considering my application. I look forward to the opportunity to discuss my qualifications and potential contributions with you in more detail.

Sincerely,

 [Your Name]",1183,192,213
31,"Dear Hiring Manager,

I am writing to apply for the Data Science position at your esteemed organization. With my strong passion for data analysis, artificial intelligence, and sports, I believe I would be a valuable addition to your team.

As a motivated and eager-to-learn professional, I am excited to bring my skills and experience to your company. I have pursued a degree in Data Science and have experience working on several data analysis projects. I am proficient in programming languages such as Python and R, and I also have experience in data visualization and machine learning techniques.

My passion for AI is what drove me towards data science, and I am always excited to learn more about the field as it evolves. Additionally, sports are one of my major interests, and I have been an active participant in events and tournaments where I have learned valuable lessons in teamwork and leadership.

I am confident that my skills and passion for the field make me an excellent candidate for the Data Science position at your organization. Thank you for considering my application. I look forward to the opportunity to further discuss how I can contribute to your team.

Sincerely,
[Your Name]",1202,200,226
32,"Dear Hiring Manager,

I am thrilled to apply for the Data Scientist position currently available at your company. As a motivated individual with a passion for AI and an avid sports enthusiast, I am confident that my skills and experience align well with the requirements of this role.

As a recent graduate in computer science, I have gained a solid foundation in data science and machine learning techniques. During my academic years, I have worked on multiple research projects related to predictive analytics and have applied my skills on real-world problems. These experiences have equipped me with strong analytical and problem-solving skills that will enable me to excel in this role.

Additionally, my love for sports has led me to explore the use of data science techniques in sports analytics. I have worked on various sports-related projects where I have gained a deep understanding of the importance of data-driven insights and decision making in the sports industry. This knowledge, coupled with my technical skills, will enable me to bring unique perspectives to the realm of data-driven decisions in your company’s sports department.

What excites me most about this opportunity is the potential to learn and grow in a dynamic and innovative team. I am eager to be part of a team that combines cutting-edge technology with consumer insights to build innovative solutions that drive business growth.

Thank you for considering my application. I look forward to discussing my qualifications in further detail and how they may align with the needs of your company.

Sincerely,

[Your Name]",1600,256,287
33,"Dear Hiring Manager,

I am excited to submit my application for the Data Science position at your company. I am confident that my passion for utilizing data to drive insights and my eagerness to learn will make me an asset to your team.

As a data enthusiast and an AI aficionado, I am constantly seeking new opportunities to grow and develop my skills. I am passionate about leveraging data science techniques to create value for businesses, and I am convinced that your company shares this belief.

What sets me apart from other candidates is my background in sports. As a passionate sports enthusiast, I understand the importance of data-driven decision making in competitive industries, and I have had the opportunity to work on several projects that have yielded outstanding results for both athletes and teams.

I am confident that my experience and passion for data science will enable me to contribute significantly to your team. Thank you for considering my application, and I look forward to hearing back from you soon.

Sincerely,

[Your Name]",1054,174,195
