,text,chars,words,tokens
53,"Dear Hiring Manager,

I am excited to apply for the Data Science position at your esteemed organization. As an analytical and detail-oriented individual who is passionate about AI, I believe that I have the necessary skills and knowledge to thrive in this role.

I am extremely motivated and eager to learn more about the world of data science. Throughout my academic and professional journey, I have always been drawn to the field of data analysis, statistics, and machine learning. I am confident that my experience and passion will enable me to excel in this position and make a valuable contribution to your team.

Apart from my academic and professional background, I have a keen interest in sports as well. From a young age, I have been fascinated by the way data analytics have transformed the world of sports. I believe that the intersection of data science and sports is a particularly exciting avenue that holds vast potential. If given the opportunity to work at your organization, I am confident that I would be able to bring a unique perspective and skill set to the team.

In summary, I am an enthusiastic and motivated individual who is eager to learn more about data science and make a meaningful contribution in this field. I am confident that my background in AI and my passion for sports make me a valuable addition to your team. Thank you for considering my application, and I look forward to discussing my qualifications in more detail.

Sincerely,

[Your Name]",1482,252,279
54,"Dear [Hiring Manager],

I am excited to apply for the position of Data Scientist with your esteemed organization. I believe that my passion for data science, combined with my strong analytical skills and enthusiasm for learning, makes me a strong candidate for the position.

As someone who loves to analyze data, I am intrigued by the potential that data science has for solving complex problems and generating valuable insights. I am confident that I can contribute to your organization in a meaningful way by leveraging my skills in the areas such as machine learning, predictive analytics, and statistical modeling.

Not only do I possess the technical skills necessary for the role, but I am also highly motivated and adaptable. I am always eager to learn and am constantly seeking out new challenges and opportunities in order to grow as a data scientist. I am confident that I can bring a fresh perspective to your team, and am excited to work alongside other talented individuals who share my passion for data science.

In addition to my interest in data science, I am also deeply passionate about AI and its potential to transform our world. As someone who is deeply interested in the intersection between technology and human life, I am excited about the possibility of contributing to the development of AI-driven solutions that can benefit individuals and society at large.

Sports have always been a major passion of mine, and I strongly believe that my experience as a sports enthusiast has honed my skills in problem-solving, collaboration, and effective communication. These skills are essential for success in any role, and I am confident that I can bring them to the table in my work as a data scientist.

Thank you for considering my application. I am eager to contribute to your organization’s success and am excited about the prospect of working with you.

Sincerely,

[Your Name]",1901,315,352
55,"Dear Hiring Manager,

I am writing to express my utmost interest in the Data Science position that is currently available in your esteemed organization. As a highly motivated individual with a passion for AI and an eagerness to learn, I believe I am an excellent fit for your team.

Since I first discovered the fascinating capabilities of artificial intelligence, I have been intrigued by the endless possibilities that it can bring. Over the last few years, I have been transforming myself into a proficient data analyst and scientific programmer. I have honed my skills in data visualization, machine learning, and statistical analysis to solve complex problems.

Throughout my academic career, I have always been drawn towards the intersection of data and sports. My passion for sports led me to explore the statistical analysis of players and games, which further fueled my interest in data science as a career. I have acquired substantial experience in this area through a variety of data analytics projects, which have enabled me to uncover insights and trends that could help to optimize the performance of professional athletes.

I am a quick learner and believe that continuous learning is vital in acquiring new skills and knowledge. As a result, I am excited to announce that I have recently completed a series of data science online courses, which have laid the foundation for me to excel as a data scientist within your organization.

As a data scientist, I believe that my skills and expertise will make me a valuable addition to your team. I am confident that I can bring a fresh perspection to the table, which can be leveraged to develop impactful data-driven strategies.

Thank you for considering my application. I eagerly look forward to the opportunity to discuss my qualifications further.

Sincerely,

[Your Name]",1837,299,335
56,"Dear Hiring Manager,

I am writing to express my interest in the Data Scientist position available at your esteemed organization. As a highly motivated and enthusiastic individual, I believe I have the necessary skills and knowledge to excel in this role and contribute meaningfully to your team’s success.

As a Data Science professional with a penchant for AI, I have always been fascinated by the power of data to transform businesses and improve decision-making processes. With a sound understanding of concepts such as machine learning, data mining, and predictive analytics, I am confident in my ability to leverage this knowledge to deliver valuable insights and drive positive outcomes for your organization.

In addition to my technical skills, I am a highly analytical and detail-oriented thinker with a passion for solving complex problems. I am confident that my ability to work collaboratively with colleagues and clients to identify and address challenges would make me a valuable asset to your team.

On a personal level, I am an avid sports fan with an unwavering passion for the games. I find the complexity and intricacies of the sports industry to be fascinating and believe that my deep interest in this field would allow me to bring a unique perspective to any data-related projects within it.

Overall, I am very excited about the opportunity to work for your organization in this capacity. I am confident that my skills, passion, and experience make me the ideal candidate for this role and I look forward to the opportunity to contribute to your team’s success. Thank you for considering my application.

Sincerely,

[Your Name]",1652,267,303
57,"Dear Hiring Manager,

I am writing to express my interest in the Data Scientist position at your esteemed organization that I recently came across on your company’s job board. As someone who is passionate about data science and machine learning, I am thrilled at the possibility of joining an organization that is at the forefront of innovation.

I am a recent graduate with a Bachelor's degree in Computer Science and a specialization in data science. Throughout my academic career, I have developed a keen interest in analyzing data to draw insights and I believe that this can be applied to a wide variety of fields, including sports. As an avid sports fan, I am especially interested in using data to help teams optimize their performance.

I appreciate your team's commitment to working with cutting-edge technologies in the field of AI and I am eager to learn from the experts in your team. I have worked on various internships projects as a data analyst that have provided me with hands-on experience and exposure to modern data tools such as Python, R, and SQL. Using these tools, I have explored various datasets, cleaned the data, and gained insights from them using various statistical and machine learning techniques.

I am confident that I have the necessary skills and motivation to contribute to your organization. I am an enthusiastic learner who thrives in challenging environments. I am a self-starter who is passionate about working in a collaborative, high-performing team to develop innovative solutions.

Thank you for considering my application. I would be grateful for the opportunity to discuss my qualifications and experience further, and how it can contribute to the overall vision of your team.

Sincerely,

[Your Name]",1748,284,324
58,"Dear Hiring Manager,

I am thrilled to submit my application for the position of Data Scientist in your esteemed organization. I consider this an opportunity to channel my analytical abilities, creativity, and passion for Data Science into contributing to your organization's success. 

As an accomplished Data Science professional, I am an inspired and highly motivated individual who is eager to learn about your organization's objectives and goals. Applying my professional experience as well as Data Science knowledge in this dynamic field would be a great contribution to your team.

Alongside my strong analytical ability, I have a deep understanding of AI and its potentials, which has fueled my enthusiasm for Data Science. More so, my passion for sports plays a significant role in my thirst for exploring Data Science in this field. I am confident that my experience, love for AI, and sports, will enable me to make valuable, data-driven contributions to your organization's success.

Throughout my career, I have successfully undertaken various Data Science projects, which have helped companies solve problems and make informed business decisions. Furthermore, I am highly experienced in advanced statistical methods, supervised and unsupervised machine learning algorithms, and data visualization tools.

I am eager to join your team, contribute my expertise, learn as much as I can, and help your organization implement data-driven solutions seamlessly. Thank you for considering my application. I look forward to discussing my application with you soon.

Sincerely,

[Your Name]",1593,239,283
59,"Dear [Hiring Manager],

I am writing to express my interest in the Data Scientist position currently available at your company. As a highly motivated and eager learner with a passion for AI and sports, I believe I would be an excellent fit for this role.

With a Bachelor’s degree in Data Science and extensive background in computer programming, I have gained valuable expertise in data analysis, machine learning, and statistical modeling. In my previous roles, I have had the opportunity to work on a range of interesting projects, including developing predictive models for customer behavior and creating algorithms for real-time image recognition.

I am particularly excited about your company's focus on AI and believe that my skills in this area would add value to your data science team. I am fueled by a passion for technology and am constantly seeking new opportunities to develop my skills in this rapidly evolving field.

Additionally, sports are a significant passion of mine, and I appreciate the role that data analytics plays in driving performance improvements in this area. I recently worked on a project analyzing sports performance data and found the results to be fascinating. I believe that combining my interest in sports with my experience in data science would be a unique asset to your team.

As a highly motivated and dedicated individual, I am confident in my abilities to perform exceptionally in this role. I am committed to finding innovative solutions and continuously expanding my knowledge base. I am excited about the prospect of contributing to your team and bringing my expertise to the table.

Thank you for your time and consideration.

Sincerely,

[Your Name]",1699,274,306
60,"Dear Hiring Manager,

I am writing to express my sincere interest in the Data Scientist position available at your esteemed organization. As a motivated and highly driven individual, I am confident that my skills and experience make me a perfect match for this role.

Throughout my academic and professional career, I have developed a keen understanding of statistical modeling, data analysis, and machine learning techniques, which have equipped me well for analytical roles. My love for data science originated when I attended an Artificial Intelligence seminar in college. I was fascinated by the way machines can understand human language and perform tasks that otherwise would require the intervention of a human. Since then, I have been passionate about data science and keeping up-to-date with the latest machine learning and artificial intelligence trends.

Additionally, I have a strong affinity for sports. Whenever I am not working on data analysis or machine learning techniques, I indulge in sports. I believe this passion for sports will enable me to apply the same analytical thinking to the data surrounding sporting events, and find correlations and patterns that were previously overlooked. The results would be more accurate analyses and predictions of sporting events.

As an adaptable individual, I am comfortable working within a team or on individual projects, having worked on several projects that have honed my problem-solving, communication, and project management skills. I am always eager to learn and readily embrace opportunities to take on challenging tasks. My strengths include data management, data cleansing, statistical analysis, model selection, and predictive modeling. I always focus on developing solutions that are user-friendly and have substantial business value.

I am excited about the prospect of joining your team and contributing to your company's success. I drive results and take on new responsibilities with ease, making me an ideal fit for the position. Thank you for considering my application, and I look forward to hearing from you soon.

Sincerely,

[Your Name]",2118,323,370
61,"Dear Hiring Manager,

I am writing to express my strong interest in the Data Science position currently available within your organization. As a highly motivated and eager learner with a strong passion for AI and sports, I am confident that my skills and experience will make me a valuable addition to your team.

With a background in computer science and a keen interest in the latest data trends, I believe I have the necessary technical expertise to excel in this field. I have experience developing complex algorithms and working with large amounts of data sets to identify key insights and trends that can inform key business decisions.

My passion for AI and machine learning has led me to explore new technologies and tools, and I have become proficient in Python, R, and SQL, as well as several machine learning frameworks such as Scikit-learn, TensorFlow, and Keras. Furthermore, I have experience applying these tools to real-world business problems, enabling me to deliver value and results for my team.

In addition to my technical experience, I am also deeply passionate about sports. I believe that my knowledge of sports, combined with my analytical skills, would enable me to deliver unique insights and perspectives to your team. Moreover, my ability to work well under pressure and deliver quality results within tight deadlines makes me an ideal candidate for this position.

I am excited about this opportunity, and I am confident that my skills and experience make me the ideal candidate for this role. Thank you for considering my application, and I look forward to hearing from you soon.

Sincerely,

[Your Name]",1635,268,305
62,"Dear Hiring Manager,

I am writing to express my sincere interest in the Data Science position that has become available within your esteemed organization. As a highly motivated and enthusiastic individual, I believe that my dedication and passion for AI, combined with my love for sports, make me an excellent fit for this role.

As an aspiring data scientist, I have always been fascinated by the power of data to inform and transform decision making. With a strong educational background in computer science and statistics, I have been able to cultivate a solid foundation in the principles of machine learning, data analysis, and data visualization. I have honed my skills in programming languages like Python, R, and SQL, as well as data processing platforms such as Hadoop and Spark.

What sets me apart from other candidates is my unique perspective derived from my passion for sports. As an athlete, I have gained a deep understanding of the importance of data-driven decisions in this field. I have observed how data analysis can be used to provide insights into player performance, team strategies, and even fan engagement. This practical experience has given me the curiosity and drive to apply my skills in data science to the sports industry. I believe that I could bring a fresh perspective and innovative ideas to the team.

In addition, I am a fast learner and constantly seek to expand my knowledge by keeping up with the latest trends and developments in the field of data science. I have obtained additional certification in big data processing and machine learning algorithms and have contributed to a number of open-source projects.

I am excited about the opportunity to join your team and contribute to your mission. Thank you for considering my application. I look forward to the opportunity for further discussion.

Sincerely,
[Your Name]",1863,305,343
63,"Dear Hiring Manager,

I am writing to express my sincere interest in the Data Science position that has recently become available at your esteemed organization. Upon reviewing the job description, I am confident that my skills and motivations align with the requirements and expectations of this role.

As a motivated and dedicated individual, I am passionate about the field of data science and its potential to drive innovation and change in various industries. My background in mathematics, statistics, and computer science has equipped me with a strong foundation in data analysis, interpretation, and visualization.

At the same time, I am always eager to learn and expand my knowledge and capabilities. In fact, I consider myself to be a lifelong learner who thrives in dynamic and challenging environments. I am excited about the prospect of joining a team of like-minded individuals who share my passion for analyzing complex data sets, solving problems, and contributing to impactful projects.

Beyond my technical skills, I also have a deep interest in artificial intelligence and machine learning, which I believe will play an increasingly important role in the future of data science. I am constantly exploring new developments and applications in this field, and I am eager to contribute to its growth and evolution.

Outside of work, I am also an avid sports enthusiast, which has allowed me to appreciate the importance of data analysis in optimizing team performance and strategy. I believe that my passion for sports and my deep understanding of data science make me a unique and valuable candidate for this position.

In conclusion, I would like to thank you for considering my application. I believe that my combination of technical skills, motivation, and passion for data science and AI make me an ideal fit for this role. I welcome the opportunity to discuss my qualifications further, and I look forward to hearing from you soon.

Sincerely,
[Your Name]",1976,317,357
64,"To Whom It May Concern,

I am writing to express my interest in the Data Scientist role at your esteemed organization, and to share my excitement and enthusiasm for the field of data science. As an aspiring data scientist, I have been constantly driven by the limitless possibilities and innovative nature of this field that can revolutionize the world in so many ways. I am confident that my passion, strong work ethic, and technical skills would make me a valuable addition to your team.

As a self-motivated and analytical individual, I have always been drawn to the world of data science. I am impressed with the ability of data-driven insights to generate solutions that not only benefit businesses but can also improve people's lives. I have pursued academic and industry training in data science, data analysis and programming, and am very keen to develop and learn more in this field. I firmly believe that staying up-to-date with the latest advancements is paramount in data science, and so I am constantly evaluating innovative approaches and investigating new resources to apply relevant ones.

Artificial Intelligence (AI) is one of the areas of data science that I am particularly interested in. I am fascinated by how AI can be used to analyze data from different sources and provide predictive insights, ultimately enhancing decision-making processes. In addition, sports have been an important part of my life since childhood, and I would be thrilled to combine my passion for data science and AI with my sports interests to contribute towards impactful solutions driving sports analytics.

I am confident that my technical expertise, proficiency in programming languages such as Python, SQL, Tensorflow, and experience applying machine learning algorithms such as Random Forest and Linear Regression, have prepared me well to take on the responsibilities of the Data Scientist position. Additionally, my experience working independently as well as in team environments have equipped me with the communication and organization skills necessary to work on complex interdisciplinary projects.

Thank you for taking the time to review my application. I look forward to the opportunity to further discuss my qualifications and passion for data science, and how I can contribute to your team's success.

Sincerely,

[Your Name]",2338,368,420
65,"Dear Hiring Manager,

I am excited to apply for the Data Science position at your esteemed organization. With my passion for AI and a knack for sports, I am confident in my ability to contribute positively to your team’s objectives.

As someone who is eager to learn, I am thrilled at the prospect of working on cutting-edge technologies that will enable me to enhance my skills even further. My previous experience working in a data-driven environment has refined my expertise in analyzing complex data sets across multiple domains. Thus, I believe that my knowledge of data mining, statistical modeling, and machine learning algorithms aligns with the requirements of the position.

Apart from being an individual who can keep up with your organization’s dynamic work standards, I possess an unwavering commitment to excellence. My critical thinking abilities combined with strong problem-solving skills allow me to quickly identify and resolve complex issues. With a preference for precision and accuracy, you can trust me to deliver results with the utmost attention to detail.

I have a deep passion for sports which has given me a diverse perspective on understanding data trends and patterns. My ability to recognize and predict patterns within data could enable me to provide unique insights into the performance metrics of athletes and teams alike. Additionally, my knowledge of machine learning and deep learning algorithms could be leveraged in developing predictive models to forecast the outcomes of future sporting events.

I am looking forward to using my skillset to contribute to the growth of your organization. Thank you for taking the time to review my application. I am eagerly waiting for an opportunity to bring my skills and experience to your organization and add value.

Thank you for your consideration. 

Sincerely,
[Your Name]",1855,293,332
66,"Dear Hiring Manager,

I am thrilled to submit my application for the Data Science position at your esteemed organization. With a strong passion for data science, AI, and a solid understanding of the key data-driven concepts, I am confident that I can make a great contribution to the growth and development of your team.

I hold a bachelor’s degree in Computer Science, which has exposed me to various analytical and mathematical models that are essential in data science. My academic background has also enabled me to gain vast knowledge in programming languages like Python and R, advanced statistical methods, as well as machine learning algorithms. This has helped me to develop critical thinking skills and a strong eye for detail.

I am particularly buoyed by the fact that sports and physical activity are integral components of your organization, as sports is also one of my major passions outside work. I believe that my interest in sports, coupled with my educational background, will enable me to contribute in developing data-driven insights that can help advance the organization's mission.

Furthermore, I am confident that my innovative mindset, intellectual curiosity, as well as my ability to work effectively in a team will thrive in your fast-paced and dynamic work environment. I am eager to bring my skills and knowledge into your organization, to add value by contributing to the development of robust models that can enhance efficiency and profitability.

Thank you for your time and consideration. I look forward to speaking with you in person soon.

Best regards,

[Your Name]",1601,257,291
