,text,chars,words,tokens
34,"Dear [Hiring Manager],

I am writing to express my interest in the Data Scientist position that has recently become available within your organization. As a highly motivated individual with a passion for data science, I am eager to contribute my skills and knowledge to further advance your company's mission.

I have a Master's degree in Data Science and have gained significant experience working with datasets, data analysis, and machine learning algorithms. With my experience working in a team and my ability to communicate complex ideas, I'm confident I could be an asset to your team.

As someone who is also passionate about AI and sports, I am excited about the possibilities that arise when combining these two fields. As a sports fan, I have a deep appreciation for the complexity and richness of sports analytics, and I am constantly on the lookout for exciting new ways to apply data science tools and techniques to make better predictions, find new patterns, and gain valuable insights.

Overall, I am committed to lifelong learning and always eager to develop new skills and knowledge. I think that your company's dedication to innovation and excellence aligns well with my perspective and goals, which is why I am so excited about the possibility of joining your team.

Thank you for considering my candidacy for this position. I look forward to hearing back from you soon.

Sincerely,

[Your Name]",1414,232,265
35,"Dear Hiring Manager,

I am writing to express my strong interest in the Data Scientist position with your company. As an accomplished individual with a passion for data science, artificial intelligence and sports, I am confident that I possess the necessary skills and experience required for this role.

I have a degree in Computer Science and have been working as a Data Scientist for the past three years, where I have gained extensive knowledge in data analysis, machine learning, and predictive modeling. In my last position, I was responsible for developing and implementing data-driven solutions to improve business performance and identify opportunities for growth.

My love for data science goes beyond my professional work, as I have been exploring artificial intelligence and its impact on sports. This has allowed me to develop unique insights and ideas for how emerging technologies can enhance the sporting world.

I am a fast learner and a self-motivated individual who is always eager to take on new challenges. I possess strong analytical and problem-solving skills, along with a keen eye for detail, which are essential qualities for any data scientist. I am confident that my passion for this field and my experience make me a perfect candidate for this role.

I would love the opportunity to meet with you to discuss my qualifications further. Thank you for considering my application.

Sincerely,

 [Your Name]",1431,228,258
36,"Dear Hiring Manager,

I am writing to express my interest in the Data Science position at your company. Upon learning about the opportunity, I was immediately drawn to the role and the prospect of contributing to your team.

As a data enthusiast, I am extremely motivated and eager to learn. I take great pride in my ability to work collaboratively with a team while also being able to work independently. My passion lies in utilizing data to identify patterns and insights that can lead to better decision-making.

I have always had a keen interest in the field of artificial intelligence, and I continually follow the latest advancements in this area. I believe that AI has the potential to revolutionize the world of Data Science, and I am excited to be a part of this transformation.

Sports has always been a passion of mine, and I believe that the principles of teamwork, strategy, and determination can be applied to my work in Data Science. Sports has also taught me the importance of resilience and perseverance, qualities that are necessary for success in any field.

As a graduate of a reputable Data Science program, I am confident that I possess the skills necessary to excel in this role. I am proficient in various programming languages, including Python and R, and have experience working with data visualization and machine learning algorithms.

I would like to thank you for taking the time to review my application, and I look forward to the opportunity to further discuss my qualifications and experience with you. Thank you for your consideration.

Sincerely,

[Your Name]",1593,266,299
37,"Dear Hiring Manager,

I am writing to express my interest in the position of Data Scientist at your company. It is my great pleasure to submit my application for this position, as I am very motivated and eager to learn more about the field of data science.

I have always been fascinated with the application of Artificial Intelligence in the sports industry. I have spent countless hours analyzing data from various sports events, and I believe that there is a lot of potential for AI to revolutionize the way decisions are made in the sports industry. As a data scientist, I would be thrilled to work on projects that incorporate my passion for sports with my expertise in data analysis.

My academic background in computer science and mathematics, along with my experience in data analysis and AI programming, have given me a strong foundation in the field of data science. I have also had the opportunity to work on several projects where I have analyzed large datasets, conducted statistical analyses and created predictive models. This experience has further strengthened my interest in the field of data science and my ability to be a valuable asset to your team.

What differentiates me from other candidates and makes me particularly passionate about this position is my eagerness to learn. I am always looking to learn as much as possible and explore new opportunities to apply my skills. I believe that your company offers an environment that is conducive to continued learning, growth and professional development, and I am excited about the opportunity to work with such a dynamic group of professionals.

Thank you for considering my application. I look forward to discussing how I might contribute to your team and your company’s data science initiatives.

Sincerely,

[Your Name]",1795,296,326
38,"Dear [Hiring Manager],

I am writing to express my interest in the Data Scientist position that is currently available in your esteemed organization. As an avid learner and a data science enthusiast, I believe that my skills and expertise would be well-suited for this role.

Having completed my degree in computer science and data science, I found my true passion in the field of data science. I am always eager to learn and keep myself updated with the latest technologies in this field. With a deep understanding of machine learning algorithms and statistical analysis techniques, I have strong analytical skills that would be an asset in this position.

I also have a keen interest in AI and experience with implementing deep learning models. With the growth of AI in businesses and industries, it has become an exciting field that I can’t wait to be a part of. Additionally, sports are my passion, and I am keen on exploring the data science techniques in this context. I believe that my combined interests in AI and sports would bring a unique perspective to the work that is being done in your organization.

I am excited about the opportunity to work for your organization, and I look forward to contributing my skills and expertise to further advance its objectives. I believe that my motivation, dedication, and passion for data science would make me an excellent fit for this position.

Thank you for considering my application. I look forward to hearing from you soon.

Sincerely,

[Your Name]",1505,253,285
39,"Dear [Hiring Manager],

I am writing to express my keen interest in the Data Science role at [Company]. As an aspiring Data Scientist, I am highly motivated to contribute to your team and utilize my skills to drive your organization's growth.

With a passion for technology and data, I am eager to immerse myself in various roles that can help me grow and learn. Additionally, I have a strong analytical background and a desire to make a difference in the field of AI, which is why I believe I am the perfect fit for the Data Science role in your organization.

As a true sports enthusiast, I know that success requires hard work, perseverance, and dedication, and I look forward to applying these values in the workplace. I am driven to excel in my career and my personal life, and I am confident that this drive, along with my experience in data cleaning, preprocessing, and machine learning models, would be a valuable addition to your team.

I believe that there are always opportunities to learn and grow in every role, and I am committed to continuing my education and enhancing my skill set to be a valuable asset to the organization. Furthermore, I am excited to join an innovative team and challenge myself to be at the forefront of technology.

I believe that my passion, drive, and analytical skills make me an excellent candidate for your team. Thank you for your time and consideration, and I look forward to the opportunity to discuss my qualifications further.

Sincerely,

[Your Name]",1500,259,297
40,"Dear Hiring Manager,

I am writing to express my strong interest in the data scientist position with your company. As a highly motivated and enthusiastic individual, I am confident that my skills and experience make me a strong candidate for this position.

In my current role, I have gained extensive experience analyzing large data sets, creating models, and using advanced statistical techniques to gain insights into business performance. I am confident in my ability to take on the challenges posed by this position and use my experience to drive the success of the company.

I am highly motivated and passionate about the field of data science. In particular, I am fascinated by the potential of artificial intelligence and machine learning to solve complex problems and make processes more efficient. I am committed to staying up-to-date with the latest advancements in these areas and am always eager to learn new skills and techniques.

In addition, I am an avid sports fan with a particular interest in sports analytics. Combining my passion for sports with my skills in data science would be a dream come true. I am excited at the prospect of being able to apply my skills to improving the performance of sports teams and athletes.

Thank you for considering my application. I am excited at the prospect of joining your team and contributing my skills and experience to the success of the company.

Sincerely,

[Your Name]",1433,237,263
41,"Dear Hiring Manager,

I am writing to express my strong interest in the Data Science position at your company. As a highly motivated individual with a passion for AI and sports, I believe that my skills and enthusiasm align well with your organization's values and mission.

Throughout my academic and professional career, I have consistently demonstrated a strong ability to analyze data and provide valuable insights. My experience in AI-related projects and familiarity with various data analysis tools and techniques, including machine learning algorithms and statistical models, makes me confident in my ability to contribute to the success of your team.

In addition to my technical skills, I possess excellent communication and interpersonal skills that enable me to work collaboratively with team members and stakeholders. My ability to explain complex technical concepts to non-technical audiences, coupled with my eagerness to learn and grow in a dynamic environment, make me an ideal candidate for this position.

I am excited about the opportunity to join your company as a Data Scientist and contribute to the development of innovative solutions that enhance sports-related data analysis. Thank you for considering my application, and I look forward to discussing my qualifications further.

Sincerely,

[Your Name]",1328,200,228
42,"Dear Hiring Manager,

I am writing to express my deep interest in the Data Science position currently available within your organization. As a highly motivated and eager learner, I am confident that I would excel in this role and make valuable contributions to your company.

With a background in Mathematics and Statistics, I have developed a solid foundation in data analysis, modeling, and visualization, which I believe would be assets in this position. I am also passionate about AI and have been following the latest advancements in this field for some time now, and I am eager to apply my knowledge in a practical setting.

In addition, sports are my passion, and I have always been fascinated by the application of data science in this realm. I believe this interest has given me a unique perspective on how data science can be used to enhance sports-related decision making and strategy.

As a professional who takes pride in attention to detail and is well-versed in programming languages like Python, R, and SQL, I am confident that I would be able to deliver innovative solutions in a timely and efficient manner. What's more, I am a quick learner, and I am always eager to explore new technologies and methodologies to stay ahead of the curve.

Furthermore, I firmly believe that I would be a great addition to your team, as I am a team player who values collaboration and constructive feedback. And with my strong communication and interpersonal skills, I am confident that I would be able to work effectively with cross-functional teams and stakeholders.

I appreciate your time and consideration and would welcome the opportunity to discuss my qualifications further. Thank you for considering my application.

Sincerely,

[Your Name]",1750,288,326
43,"Dear [Hiring Manager],

I am excited to apply for the Data Science position at your company. As an enthusiastic and motivated individual with a passion for AI and a love for sports, I believe I would be a great fit for your team.

With a strong background in data analysis, predictive modeling, and statistical inference, I have acquired valuable skills that have helped me understand the importance of data in driving business insights and improving decision-making processes. As a data science enthusiast, I am constantly keeping up with the latest developments in the field and I am eager to apply my knowledge to real-world problems in a professional setting.

Additionally, I am confident in my ability to work well in a team setting and to act as a collaborative and supportive member of any group. I am a quick learner and have a strong desire to continuously improve and develop my skills, which makes me a perfect candidate for your company.

In my free time, I enjoy playing sports and taking part in various activities related to it. It has helped me develop not only discipline and teamwork skills, but also a passion for developing AI technologies that revolutionize the sports industry.

I believe that my skills and passion for Data Science, combined with my strong work ethic and desire to learn make me an excellent candidate for your team. I am excited for the opportunity to contribute to your company and grow as a professional.

Thank you for considering my application.

Sincerely,

[Your Name]",1516,255,286
44,"Dear Hiring Manager,

I am excited to submit my application for the Data Science position in your esteemed company. As a motivated and dedicated individual, I am eager to apply my skills and knowledge to contribute to the growth of your organization.

My passion for data science started when I was introduced to the world of Artificial Intelligence during my college days. Since then, I have dedicated myself to learning more about the application of data science in solving real-world problems. I have also completed several courses online and earned certificates in data science, machine learning and deep learning.

Apart from my love for data science and Artificial Intelligence, I am also very passionate about sports. I firmly believe that data science can play a vital role in enhancing the performance of athletes and sports teams. I have previously contributed to a project on predictive analytics in sports and found it to be a remarkable and rewarding experience.

I am confident that my skills, combined with my desire to learn and passion for data science and sports, make me the ideal candidate for this position. I would relish the opportunity to apply my analytical and problem-solving skills to advance the goals and objectives of your organization.

Thank you for considering my application. I look forward to discussing my candidacy further in an interview.

Sincerely,

[Your Name]",1402,226,252
45,"Dear Hiring Manager,

I am writing to express my keen interest in the Data Science position that was recently advertised in your esteemed organization. I am a highly motivated individual with a deep passion for data science, artificial intelligence, and sports. My academic background, coupled with my practical experience, positions me as the perfect candidate for this role.

As a Data Science enthusiast, I am enthusiastic about the opportunity of joining your team to make impactful contributions to your organization. I am knowledgeable in data analysis, machine learning, and statistical modelling, and I am eager to put my skills to work in real-world scenarios.

Furthermore, my love for sports has fueled my interest in using data science to fuel advancements in athlete performance and sports analytics. I am confident that my knowledge in data science combined with my passion for sports will enable me to contribute uniquely to your organization.

Throughout my academic and professional experiences, I have consistently displayed a high degree of excellence in data science assignments, problem-solving, and data-driven decision making. My strong analytical, critical thinking, and communicative skills set me apart as an exceptional candidate for the role.

I am excited about the opportunity to learn from your seasoned team of data scientists and grow professionally in your organization. I am confident that I could contribute positively to your team, by bringing my passion for data science, and dedication to excellence.

Thank you for considering my application. I look forward to discussing my qualifications with you further.

Sincerely, 

[Your Name]",1673,254,293
46,"Dear Hiring Manager,

I am writing to express my strong interest in the Data Scientist position currently open in your company. As someone who is motivated, eager to learn, and passionate about AI and sports, I believe that I would be an excellent fit for the role.

I have always been drawn to the potential of data to uncover insights and drive change. I recently completed my Bachelor’s degree in Data Science, which has given me a solid foundation in statistics, programming languages such as Python and R, and cutting-edge data technologies. I am excited to apply this knowledge in a professional setting and take on new challenges as part of your team.

In particular, I am drawn to the work that your company is doing in the areas of AI and machine learning. These fields have tremendous potential to revolutionize industries from finance to healthcare, and I am eager to contribute my skills and enthusiasm to these efforts.

Outside of work, I am an avid sports fan, and I believe that the intersection of sports and data offers exciting opportunities for innovation. I am particularly interested in using data to improve player performance and sports analytics.

In addition to my technical skills, I have a strong work ethic, excellent communication skills, and a passion for learning. I am confident that I would be a valuable asset to your team, and I look forward to contributing to your mission of using data to drive innovation and growth.

Thank you for considering my application. I am excited about the possibility of joining your company and contributing to your success in the field of data science.

Sincerely,
[Your Name]",1644,277,312
47,"Dear Hiring Manager,

I am writing to express my keen interest in the Data Scientist position at your esteemed organization. I have always been fascinated by the world of data and analytics; the more I learn, the more intrigued I become. With years of experience in data analysis, I am confident that I can contribute to your top-performing data team and help you exceed your goals.

I am excited about the opportunity to work with your company because not only am I motivated but I am also eager to learn new things. I love delving deep into complex data sets, finding patterns, and delivering insights that help drive business growth. I believe a career in Data Science will not only fulfill my passion but also make a significant impact on the world.

One of my major interests is Artificial Intelligence, and how it can be used to solve real-world problems. I am always seeking to learn new skills and keep up to date with the latest industry developments. I have taken various online courses and attended workshops to keep myself up-to-date with the latest technologies and tools in data analysis. I am confident that my experience, coupled with my eagerness to learn, will make me a significant asset to your team.

In addition to my work in Data Science, sports are my passion. I have been an athlete all my life and understand the importance of hard work and team collaboration. Over the years, I have learned how to work as part of a team, and this has helped me deliver outstanding results. At the same time, I am also an analytical person, which makes me good at identifying patterns and predicting outcomes.

Thank you for considering my application. I am available for an interview at any time, and I look forward to hearing from you about the next stage of the application process. I am confident that I can bring value to your team and am excited about the prospect of being part of such a dynamic organization.

Sincerely,

[Your Name]",1951,342,385
48,"Dear Hiring Manager,

I am writing to apply for the Data Science position at your esteemed organization. As a seasoned data analyst with a strong passion for AI and a love for sports, I am confident that I possess the skills and motivation necessary to excel in this role.

I am an avid problem-solver who enjoys acquiring new skills and knowledge. My background in data analysis and machine learning has prepared me to work on complex projects that require an analytical mind and attention to detail. I have experience working with large datasets to derive meaningful insights and develop predictive models that enable informed decision-making.

My passion for AI and emerging technologies motivates me to stay up-to-date with the latest developments in the field. I am excited to leverage my skills to contribute to the growth and success of your organization. I am confident that I can make valuable contributions using my expertise in various programming languages and tools like Python, R, and Tableau.

Furthermore, as a sports enthusiast, I understand the importance of data analytics in the sports industry. I am thrilled to be part of a team that leverages data to enable evidence-based decision-making and provides insights that drive better outcomes on the field.

In summary, I am eager to join your team and contribute my skills and talent to create value for the organization. I am confident that my expertise and enthusiasm make me an ideal candidate for the role. Thank you for considering my application.

Sincerely,

[Your Name]",1546,252,286
49,"Dear Hiring Manager,

I am writing to express my strong interest in the Data Scientist position at your company. As a highly motivated and dedicated individual, I am confident that my skills and experience make me a strong candidate for the role.

As a lover of AI, I am passionate about applying data science techniques to solve complex problems in a variety of fields. In addition, my love for sports has given me a unique perspective on how data can be used to drive insights and make informed decisions. These combined interests have fueled both my personal and professional pursuits and have led me to pursue a career in data science.

One of my key strengths is my eagerness to learn. I pride myself on my ability to quickly understand new concepts and technologies, and apply them to real-world problems. Additionally, my strong analytical abilities, coupled with my attention to detail, make me confident in my ability to extract valuable insights from complex datasets.

I have experience working with a variety of data science tools and techniques, including Python, R, SQL, machine learning, and data visualization. I am thrilled by the opportunity to apply these skills to real-world problems, and I am excited to explore new challenges and learn from experienced professionals.

Thank you for considering my application. I would welcome the opportunity to further discuss my qualifications and appreciate your time and consideration.

Sincerely,

[Your Name]",1471,237,270
