,text,chars,words,tokens
67,"Dear Hiring Manager,

I am writing to express my deep interest in the Data Science position at your esteemed organization. As an enthusiastic and highly motivated individual, I am eager to bring my skills and knowledge to a dynamic and forward-thinking team like yours.

My passion for a career in data science began during my undergraduate studies in Computer Science. I was drawn to the exciting field of Artificial Intelligence and its potential to transform industries and societies. Since then, I have pursued various advanced-level courses in AI and Machine Learning, which has enhanced my analytical skills and expanded my knowledge base in this field.

I believe that my skills and knowledge make me an excellent fit for this position. I have the ability to analyze complex data sets, develop data models and visualizations, and communicate insights effectively to diverse audiences. Over the years, I have gained experience working with various statistical and machine learning techniques and programming languages.

In addition to my technical skills, I am a passionate sports enthusiast. I understand that your organization works closely with sports data, and I believe that my passion for sports could bring value to your team. I enjoy analyzing sports data in my free time, and I am confident that my expertise in data science will enable me to contribute to the data-driven decisions made in the sports industry.

I am thrilled to become part of a team that values innovation and encourages creativity. I am committed to continuing my learning to maintain my proficiency in the field and keep up-to-date with the latest developments in data science.

Thank you for your consideration. I am excited about the opportunity to meet with you to discuss the contributions I can make as a Data Scientist to your organization. 

Sincerely,

[Your Name]",1858,299,335
68,"Dear Hiring Manager,

I am writing to express my strong interest in the Data Scientist position currently available within your esteemed company. I am excited to apply for this position to showcase my analytical abilities, my passion for data science and my keenness to learn more about AI, which has become the accelerant for innovation in every sector of our life. Sports are also my passion, and I aspire to explore the applications of data science in this field.

I hold a Master's degree in Data Science from a prestigious university, where I gained a comprehensive understanding of data mining techniques, deep learning algorithms, statistical analysis and data visualization tools. Moreover, I have honed my technical skills and practical experience through various internships where I was able to put into practice some of these concepts in a collaborative and challenging setting. Furthermore, I was part of a multidisciplinary team that won the National Analytics Competition, which gave me a sense of professional and personal accomplishment.

What sets me apart from other applicants is my insatiable sense of curiosity and my ability to stay abreast of new advancements in the field of data science. I enjoy immersing myself in new research articles, programming languages, frameworks and online platforms designed for data science professionals. I am committed to surpassing my potential and contributing my technical skills at its best to the ever-growing field of data science.

As a sports enthusiast, I can appreciate the positive impact data science can have in the sporting industry at various levels, ranging from game/player analytics to marketing strategies, and I am keen to explore its potential in this field.

Thank you for considering my application. I look forward to hearing from you soon about the chance to meet with you and discuss how I can contribute to this position.

Sincerely,

[Your name]",1928,306,352
69,"Dear Hiring Manager,

I am writing this letter to express my interest in the Data Science job that your company is offering. The position perfectly aligns with my career goals as I am determined to pursue a career in data science and analytics.

With a degree in Computer Science, I have gained a substantial amount of experience in data analysis and programming, which has enabled me to develop stronger analytical and technical skills. I have also completed various online courses and training programs in data analysis, statistics, and programming languages such as Python, R, and SQL, which has helped me broaden my expertise in the field of data analysis.

Apart from my education and skills, I possess a strong passion for artificial intelligence, and I am impressed by your company's initiatives involving the same. I am eager to learn more about AI and implement its applications in the field of data science.

Additionally, sports have been my passion since childhood, and I have always been fascinated by the analysis of sports data to derive insights about players, strategies, and game outcomes. With the aid of data science, I believe that many game-changing insights can be discovered and implemented.

I am a motivated individual and take pride in my ability to work effectively in a team environment. Finally, I am confident that my qualities, passion, and expertise align perfectly with the qualities you are seeking, and I am eager to bring my skills to your organization.

Thank you for considering my application. I look forward to the opportunity to further discuss my qualifications with you.

Sincerely,

[Your Name]",1639,267,305
70,"Dear Hiring Manager,

I am writing to express my interest in the Data Science position available at ABC Company. As an individual with a passion for utilizing data to drive insights and decisions, I am excited to have the opportunity to bring my skills and enthusiasm to a team committed to providing innovative solutions.

Throughout my academic and professional career, I have developed a strong foundation in data analysis, statistical modeling, machine learning, and programming languages such as Python, R, and SQL. I have put these hard skills into practice by working on various data-driven projects, including developing predictive models and conducting sentiment analysis, for both academic and industry clients. I have also gained experience in data visualization and communication, presenting findings and insights in a clear and compelling manner.

One of the areas that excites me the most is the application of AI to various industries. As someone who is passionate about sports, I have often thought about the potential for AI to revolutionize how we think about sports performance and strategy. I believe that data science can help sports teams make more informed decisions, optimize their performance and stay ahead of the curve in a constantly evolving industry. 

As a motivated individual, I am eager to learn about new tools and technologies to stay current in the field. I am passionate about staying up-to-date with the latest industry trends and continuously developing my technical and analytical skills. I am confident that I can bring a fresh perspective and an innovative approach to the team at ABC Company.

Thank you for considering my application. I look forward to the opportunity to further discuss how I can contribute to your team.

Sincerely,

[Your Name]",1792,284,321
71,"Dear Hiring Manager,

I am excited to apply for the Data Science position at your company. With a passion for both AI and sports, I have been eagerly looking for a role where I can combine my interests with my skills in data analysis and problem-solving. I believe that this position would be a perfect fit for me, and I am eager to take on the challenge of contributing to your company's success.

As a recent graduate in Data Science, I have had the opportunity to learn about cutting-edge techniques in machine learning, data visualization, and statistical analysis. I have worked on a number of projects during my studies, and I am confident in my ability to apply my skills to real-world problems. Beyond my coursework, I have also taken the time to hone my skills by participating in online competitions and working on personal data projects, which have helped me to build a strong foundation in the field of data science.

I am highly motivated and eager to learn, and I believe that your company would provide a supportive environment where I could continue to grow and develop. I am also excited about the opportunity to work on projects that would enable me to apply my skills to my passion for sports. With a deep interest in sports analytics, I have spent much of my free time reading about the latest trends and advancements in the field. I believe that my enthusiasm, coupled with my strong work ethic and attention to detail, would make me a valuable asset to your team.

Thank you for considering my application. I look forward to the opportunity to speak with you in further detail about how I can contribute to your team.

Sincerely,

[Your Name]",1664,292,325
72,"Dear Hiring Manager,

I am writing to express my interest in the Data Science position that has recently become available at your esteemed organization. As a highly motivated individual with a passion for data science, I am eager to bring my skills and expertise to contribute to the success of your company.

My passion for data science began during my undergraduate studies, where I majored in statistics and learned the fundamentals of data analysis. Through my academic journey, I was exposed to various tools and techniques that enable me to extract insights from complex data sets. With my strong foundation in mathematics and statistics, I am confident in my ability to apply this knowledge to real-world problems.

My fascination with Artificial Intelligence (AI) is one of the reasons I aspire to work in data science. It is a constantly evolving field that presents endless possibilities. By using predictive analytical models and algorithms, we can enhance decision-making processes, automate tasks, and gain insights that change the way we view the world. I am excited to be part of this technological revolution and contribute to its advancement.

Sports have always been my passion. From following professional teams to enjoying a friendly game with friends, sports have taught me the value of teamwork, discipline, and perseverance. When it comes to data science, sports are a trove of data just waiting to be analyzed. By examining player performance, team stats, and fan behavior, we can make informed decisions that can have a significant impact on the industry.

I am eager to learn and grow as a professional in the field of data science. I am a strong believer in the importance of lifelong learning and take the initiative to stay updated with the latest trends and innovations in the industry. I have also contributed to the data science community by participating in online forums, attending conferences, and sharing my projects on GitHub.

I am confident that I have the skills, passion, and dedication to be an asset to your organization. Thank you for considering my application. I look forward to the opportunity to discuss my qualifications and experience with you further.

Sincerely,

[Your Name]",2227,360,408
73,"Dear [Hiring Manager’s Name],

I am writing to apply for the Data Scientist position advertised in [Source of Job Posting]. As an ambitious and driven individual, I am excited about the opportunity to further develop my skills in data science and contribute to your esteemed organization. 

I graduated with a Bachelor's degree in Computer Science from [University’s Name], where I gained valuable insight into various analytical tools and techniques. I have also completed several online courses to enhance my knowledge of data science, including [Name of Courses]. These programs have provided me with a sound understanding of machine learning, data visualization, and data analysis.

I have always been passionate about artificial intelligence and its application in sports. My love for analyzing sports data, tracking athlete performance, forecasting outcomes, and making predictions has led me to pursue a career in data science. With the growing importance of AI in sports analytics, I believe that your organization presents an excellent opportunity for me to learn, excel, and make a significant contribution.

I am confident that my skills and experience make me a strong candidate for the Data Scientist position. My proficiency in programming languages such as Python, R, SQL, and Java, combined with my experience using analytical tools such as Tableau and Excel, would allow me to analyze large and complex datasets efficiently. 

In addition, I have developed excellent communication and teamwork skills through various work experiences, including collaborating with colleagues from different regions and cultural backgrounds. I am confident that my strong work ethic, analytical skills, and analytical aptitude make me an excellent fit for this position.

I would be delighted to discuss my qualifications further in an interview. Thank you for your consideration, and I look forward to hearing from you.

Sincerely,

[Your Name]",1944,294,346
74,"Dear Hiring Manager,

I am excited to submit my application for the Data Science position at your esteemed organization. As an aspiring data scientist, I have been following your organization for a while now and seen the remarkable strides you have made in the data analysis and decision-making industry. I believe my skills and passion for data science align with the objectives and values of your organization.

I am an enthusiastic and highly motivated individual who is eager to learn and take on new challenges. I am confident that my skills in data analysis and machine learning will be an asset to your organization. I hold a Bachelor's degree in Computer Science and a Master's degree in Data Science. My academic background has equipped me with extensive knowledge in the field, and I have developed skills in Python, R, machine learning, data visualization, and statistical modeling.

In addition, I have an evolving interest in Artificial Intelligence and its practical applications, and I acknowledge the significance it holds for the future. I am up-to-date on the latest AI methods and technologies, and, as a Data Scientist, I see myself contributing meaningfully to your organization's industry-leading developments.

Sporting activities are one of my passions, and in my free time, I enjoy watching and analyzing sports data. I have previously used this hobby to teach myself how to employ data analysis to develop insights, which has coupled my love for both sports and data analytics.

I am excited about the prospects of working with a team that is enthusiastic, collaborative, and focused on achieving the organization's objectives. I am committed to continuous learning and improving my data analytical skills, which will undoubtedly complement your organization's valuable data practices.

Thank you for considering my application. I hope to have the opportunity to contribute meaningfully to your organization as a Data Scientist.

Yours sincerely,

[Your name]",1985,311,360
75,"Dear Hiring Manager,

I am writing to express my interest in the Data Science position currently available at your esteemed organization. As an aspiring data scientist with a deep passion for sports and a keen interest in AI, I believe I possess the necessary skills and qualities to excel in this role.

With a bachelor’s degree in computer science and substantial experience in the field of data analysis, I possess a solid foundation in the principles of statistics and machine learning. I have honed my proficiency in programming languages such as Python, R, and SQL, and have demonstrated the ability to develop predictive models, perform data cleansing, and conduct data mining analyses, among other essential skills.

What sets me apart from other candidates is my genuine passion for sports - a passion that I believe can be integrated into data science to yield insightful and valuable findings. I strongly believe that my unique combination of skills, coupled with my deep understanding of sports, makes me an ideal candidate for this position.

I am incredibly motivated and dedicated to my craft, and I am constantly seeking out new challenges and opportunities to learn. I am committed to delivering top-notch work that meets or exceeds stakeholder expectations, and I have a proven track record of meeting tight deadlines and delivering high-quality results.

I have attached my resume to this email and invite you to peruse it at your convenience. I would welcome the opportunity to further discuss how I can contribute to your organization and how my skills can be harnessed to fulfill your data science needs. Thank you for considering my application and for your time and consideration.

Sincerely,
[Your Name]",1728,280,316
76,"Dear Hiring Manager,

I am writing to express my sincere interest in the Data Science job opening within your esteemed organization. The opportunity to be a part of a team that is dedicated to driving meaningful insights, utilizing analytics, and advancing artificial intelligence excites me. I am eager to contribute my talents and ideas to this exciting field.

My passion for data science stems from my inquisitive nature and strong desire to solve complex problems. I am a highly motivated individual who is constantly seeking opportunities to learn and expand my skill set. I believe that the field of data science offers a limitless source of intellectual challenge, and I am eager to embrace this challenge fully.

As an avid sports enthusiast, I am intrigued by the intersection of data science and sports. I enjoy using data to predict outcomes, gain valuable insights, and optimize athlete performance. I strongly believe that the combination of sports and data science has great potential to revolutionize the way we approach athletic training and competition.

Throughout my academic and professional experiences, I have developed a strong foundation in data analysis techniques such as regression, clustering, and classification. I am proficient in R and Python programming languages, and I have experience utilizing machine learning algorithms to build predictive models. I am also familiar with data visualization tools such as Tableau, which help me to communicate complex insights in an easily digestible format.

With my passion for data science and my proficiency in analytical techniques, I am confident that I will be a valuable asset to your team. I am excited to hear about the innovative projects that your team is working on and to work alongside experienced professionals in the field. Thank you for considering my application. I look forward to hearing from you soon.

Sincerely,
[Your Name]",1918,303,342
77,"Dear Hiring Manager,

I am writing to express my interest in the Data Science position at your esteemed organization. As a dynamic and dedicated individual with a passion for AI and an unyielding enthusiasm for sports, I am confident that I have the skills and aptitude to make a meaningful contribution to your team.

My past experience in data science roles has instilled in me a deep appreciation for the role that data analysis and machine learning play in driving business outcomes, and my particular interest in AI has led me to continuously pursue knowledge and experience. I am confident that I have the ability to harness the power of technology to help your business achieve maximum possible success.

My academic qualifications, combined with my natural curiosity, strong analytical skills, and detail-oriented mindset, enable me to excel in data-driven problem-solving. I hold a degree in Computer Science, which has given me a holistic understanding of the technical tools and methodologies that are used in data science. Additionally, my experience in creating data models and using data analysis software will be a valuable asset to your team.

Beyond my technical qualifications, I am passionate about sports and have seen firsthand how data analysis and machine learning models have transformed the sporting world. Through my passion for sports, I have developed data analysis insights that have helped identify new market opportunities and drive business results related to the sports industry. With this experience, I am confident I will be able to bring the same drive and passion to your company and expand that skillset in the broader business world.

In conclusion, I strongly believe that my unique combination of academic qualifications, technical skills, and passion for AI and sports will enable me to make a valuable contribution to your organization. I look forward to discussing my application further with you and providing any additional details you may need.

Thank you for considering my application. 

Sincerely,

[Name]",2055,324,365
78,"Dear Hiring Manager,

I am writing to express my enthusiastic interest in the Data Science role at your esteemed organization. I am thrilled to apply for this position as data science is my true passion, while my love for AI and sports is equally strong, which I believe will hold me in good stead in this position.

I am currently equipped with the skill set required to succeed as a data scientist, with hands-on experience in data processing, modeling, predictive modeling, machine learning, computer vision, and natural language processing. My proficient knowledge of programming languages like Python, R and SQL, and my excellent mathematical and statistical abilities furnish me with a firm foundation to tackle the most intricate of data puzzles.
 
Furthermore, I am motivated, enthusiastic and eager to learn new skills and techniques in data science. Challenge and creativity drive me to constantly push boundaries, and I believe that joining your company will provide me with an opportunity to continue to learn and grow in this field.

What sets me apart is my passion for both AI and sports. This has equipped me with a unique perspective in how data can be used in the sports industry to improve sports performance and enhance fan engagement. Being analytical and having a sports background has allowed me to amalgamate the two fields in a way that leverages the power of data.

As someone who consistently seeks to enhance my skills, I am certain that my abilities in conjunction with my passion will allow me to make significant contributions to any team, to your company.

Thank you for taking the time to review my application. I look forward to the opportunity to speak with you further.

Sincerely,

[Your Name]",1730,287,323
79,"Dear Hiring Manager,

I am excited to apply for the Data Science position that has opened up in your esteemed organization. As a Data Science enthusiast with a passion for AI and sports, I believe that my skills, experience, and passion make me a strong candidate for the role.

As an individual who is always eager to learn, I am confident that I would be an excellent addition to your team. I have been consistently keeping up with current trends and advancements in the field of Data Science while building on my existing knowledge and skills. With a solid foundation in mathematics, statistics, and computer science, coupled with my keen analytical mind, I have gained proficiency in programming languages such as Python, R, and SQL. I have also worked with several statistical modeling techniques, machine learning algorithms, and data visualization tools, which I’m eager to put to use in a professional environment.

Moreover, my passion for AI and its applications is fuelled by a belief that it has the potential to change the world positively in ways that we cannot even begin to imagine. I am committed to this vision and constantly challenge myself to improve my knowledge and work towards contributing to this cause.

I would also like to emphasize that my love for sports has allowed me to develop a unique perspective on how Data Science can be used to improve athletic performance. I have participated in several analytics projects with a focus on sports data to provide insights to coaches and teams, which have led to improved decision-making and better outcomes.

Overall, I am an enthusiastic team player who enjoys working collaboratively with others to achieve shared goals. I am confident that my skills, experience, and passion for this field make me a strong candidate for the Data Science position, and I look forward to learning more and contributing to your team.

Thank you for considering my application.

Sincerely,

[Your Name]",1959,324,365
