,text,chars,words,tokens
0,"Dear Hiring Manager,

I am extremely excited to apply for the position of Data Scientist at your esteemed company. With a strong passion for AI and sports, I am confident that my skills and enthusiasm make me an ideal candidate for this role.

Throughout my academic and professional career, I have been constantly fascinated by the use of data science techniques to solve complex problems. Having completed a Bachelor's degree in Computer Science with a specialization in AI, I have gained significant expertise in data gathering, analysis, and interpretation. Additionally, I have worked on various projects that have allowed me to develop skills in data cleaning, machine learning, and data visualization.

One of the aspects of data science which particularly piques my interest is the utilization of machine learning models to analyze sports data. As a lifelong sports enthusiast, I find the application of data science in sports to be truly fascinating. Over the years, I have actively followed various sports events and have meticulously analyzed player stats and game outcomes. My expertise in data science combined with my passion for sports makes me a perfect candidate for this role.

I am extremely motivated and eager to learn more about the latest tools and techniques in data science. I am confident that your company’s dynamic and enthusiastic work environment will provide me with the perfect platform to expand my skillset and excel in my career. I am eager to join a team of experts who are equally passionate about data science and strive to make a positive difference in the industry.

Thank you for considering my application. I look forward to the opportunity to discuss my qualifications further with you and can't wait to be a part of your team.

Sincerely,

[Your Name]",1795,293,327
1,"Dear Hiring Manager,

I am excited to express my interest in the Data Science position at your esteemed organization. After reviewing the job posting, I am convinced that my passion for AI and sports, combined with my technical expertise and eagerness to learn, make me a strong candidate for the role.

With a Bachelor's degree in Computer Science and specialization in Data Science, I have gained the foundational knowledge necessary to understand and analyze complex data sets. My coursework in statistics, data mining, and machine learning has equipped me with advanced analytical skills that I am ready to apply in the real world.

In addition to my academic background, I have gained practical experience working as a Data Analyst Intern at XYZ Company. During this time, I contributed to various projects, from developing methods to conduct A/B testing to analyzing customer behavior data to identify the most popular products. This opportunity exposed me to new technologies, tools, and techniques that enhanced my ability to process, analyze, and visualize data.

As someone who is deeply passionate about AI and its many applications, I am always on the lookout for opportunities to acquire new knowledge and skills. I am a self-starter who enjoys taking on challenging projects and am confident that my critical thinking, problem-solving, and communication abilities would allow me to excel in this role.

Furthermore, as a dedicated sports enthusiast, I understand the power of data in transforming the way athletes train and perform. I am excited to have the chance to work with a team that shares this passion and is committed to driving progress through cutting-edge technology.

In closing, I would like to express my strong interest in this position and thank you for considering my application. I am excited about the opportunity to bring my skills, experience, and enthusiasm to the team and contribute to the growth and success of the organization.

Sincerely yours,
[Your Name]",1998,319,365
2,"Dear Hiring Manager,

I am writing to apply for the Data Scientist position available within your organization. As a highly motivated individual with a passion for data science and a desire to learn and grow, I am confident that my skills, experience, and enthusiasm make me an excellent candidate for this role.

I am an AI enthusiast who is passionate about exploring data to uncover new insights and drive informed decision-making. I understand that data science is a constantly evolving field, and I am eager to keep up with emerging trends and best practices to achieve business goals. My education and training in computer science and statistics have provided me with a strong foundational understanding of both data analysis techniques and programming languages such as Python, R, and SQL. These technical skills, combined with my creativity, problem-solving abilities, and attention to detail, allow me to turn complex data sets into actionable insights.

Furthermore, I am a strong supporter of data science innovation within the sports industry. Sports are a significant part of my life, and I believe that data science can revolutionize the way we analyze games and improve player performance. I am excited about the potential to leverage data science techniques to develop game-changing strategies and drive success on the field.

I am confident that I would be a great asset to your team, and I look forward to contributing to your organization's continued success. Thank you for your time and consideration. I look forward to discussing my qualifications and enthusiasm for data science in more detail.

Sincerely,

[Your Name]",1641,261,296
3,"Dear Hiring Manager,

I am writing to express my deep interest in the Data Science position available in your esteemed organization. I am highly motivated and eager to learn all aspects of data science, including the latest trends in AI and machine learning. My passion for sports has instilled in me a keen ability to analyze data and derive meaningful insights to achieve success. I am confident that I possess the skills and qualifications required to excel in this role, and I am excited about the opportunity to contribute to your team.

I recently completed a rigorous data science program where I acquired expertise in statistical modeling, data exploration, machine learning, and predictive modeling. I have also gained valuable experience through research assignments that have involved utilizing big data for sports analysis. My passion for sports has not only allowed me to apply my quantitative skills, but it also instilled in me the desire to better understand the human element in data-driven decision-making, which I believe is a vital component of successful data science.

In addition to my technical expertise, I possess excellent communication, collaboration, and problem-solving skills, which I believe are essential qualities for a successful data scientist. I am confident that I will make a positive contribution to your team by working collaboratively with other team members and stakeholders to derive meaningful insights from complex data sets.

Lastly, I would like to emphasize my eagerness to learn and my commitment to professional development. I believe that learning is a lifelong pursuit, and I always strive to stay up-to-date on the latest industry trends and best practices in data science. I am convinced that your organization offers the ideal environment for me to learn, grow and make significant contributions to the data science field.

Thank you for considering my application. I am looking forward to the opportunity to discuss my qualifications and experience further.

Sincerely,

Your Name.",2038,318,359
4,"Dear Hiring Manager,

I am writing to express my interest in the Data Scientist position at your organization. As a highly motivated and experienced data analyst with a passion for AI and an avid interest in sports, I believe that I am a perfect fit for this role.

Over the years, I have honed my skills in data collection, analysis and interpretation, as well as data visualization, while working as a data analyst at some of the reputable companies. My experience has been invaluable in helping organizations to make more informed decisions and achieve business objectives through data-driven approaches.

In addition, I am highly versed in the areas of machine learning, statistical modeling, and deep learning, which have given me the confidence to predict and analyze complex data sets with a high degree of accuracy. My ability to identify trends and patterns in data, combined with my proficiency in programming languages such as Python, R and SQL, and experience with various machine learning libraries, makes me an effective problem solver and an asset to your team.

Apart from my technical abilities, I am also highly motivated and eager to learn new skills and techniques in the data science field. I constantly seek opportunities to expand my knowledge and expertise and have a strong track record of professional development, attending workshops, online learning platforms, and reading research papers in my free time. 

Moreover, as a passionate sports fan, I firmly believe that my love for sports plays a significant role in my approach to problem-solving through the use of data. My passion for sports has given me a unique perspective that allows me to think beyond the numbers and put them into context, making predictions that account not only for data but also for the human element of sports.

In summary, I believe I have the skill set, motivation, and passion to excel in the Data Scientist position at your organization. I am confident that I can use my expertise to help your organization achieve its data-driven goals. Thank you for considering my application. I look forward to discussing my qualifications further with you.

Sincerely,

[Your Name]",2179,356,404
5,"Dear Hiring Manager,

I am excited to apply for the Data Science position at your esteemed organization. As a talented and motivated candidate, I am eager to contribute my skills and passion to the team.

I have a strong background in data science, with extensive experience in statistical analysis, data modeling, and data visualization. My educational background in computer science, mathematics, and statistics has equipped me with a solid foundation to analyze complex data sets and solve real-world problems.

I am particularly drawn to the field of artificial intelligence and its applications across various industries. As a lifelong learner, I am always eager to explore new techniques and stay up-to-date with the latest trends in this dynamic field. In addition, I believe that my passion for sports gives me a unique perspective on data analysis and its potential impact on the industry. With my combination of technical skills and creative thinking, I am confident that I can make a valuable contribution to your organization.

Aside from my technical skills, I have strong communication skills and have been praised for my ability to collaborate effectively within teams. I thrive in a fast-paced and challenging environment and am motivated to pursue my goals with enthusiasm and drive. 

Thank you for considering my application. I look forward to the opportunity to discuss my qualifications further and demonstrate how I can contribute to your team.

Sincerely,
[Your Name]",1490,234,266
6,"Dear Hiring Manager,

I am excited to submit my application for the position of Data Scientist at your esteemed organization. With my immense passion for AI and my unwavering interest in sports, I feel that I am the ideal candidate for the role.

Recently, I completed my degree in Data Science, where I had the opportunity to learn about the technologies and techniques that are currently shaping the field. Throughout my academic journey, I have sharpened my analytical skills and developed a solid understanding of the fundamental principles of data analysis, including data wrangling, machine learning, and statistical modeling.

I am highly motivated and driven to learn, so I am eager to bring my skills and experience to the team at your organization. My passion for AI and its application in the world of sports has driven me to explore various projects and research topics, including predictive modeling and data visualization. I am confident that I can contribute significantly to your organization's mission and goals.

Aside from my academic pursuits, I have engaged in a wide range of extracurricular activities that have further refined my skills and demonstrated my commitment to excellence. I have engaged in internships that have allowed me to work with challenging data sets, strengthen my programming abilities, and enhance my communication and presentation skills.

Overall, I believe that I can make a valuable contribution to your organization as a Data Scientist. I am enthusiastic, committed, and always eager to learn and grow. Thank you for considering my application, and I look forward to hearing from you soon.

Sincerely,

[Your Name]",1664,264,306
7,"Dear Hiring Manager,

I am writing to express my interest in the Data Scientist position that your esteemed organization has advertised. With a passion for data and an eagerness to learn, coupled with a drive for delivering results, I am confident that I can bring immense value to your team.

My academic background in computer science has provided me with a strong foundation in programming languages such as Python, R and SQL, as well as with a solid understanding of machine learning and other data science techniques. I am excited to apply my knowledge to real-world challenges, and to work with other talented professionals to solve complex problems.

Furthermore, I am particularly intrigued by the intersection of artificial intelligence and sports. As a lifelong sports enthusiast, I believe that data science can offer new insights and uncover untapped potential in the industry. I am eager to explore this possibility, and I am excited about the opportunity to apply my skills in this area.

In addition to my technical competencies, I am also a team player with excellent communication and interpersonal skills. Throughout my academic and professional experience, I have consistently demonstrated my ability to collaborate with others, develop strong relationships, and build consensus around complex projects.

I believe that my experience, knowledge, and passion make me an ideal candidate for this position. I would be honored to contribute to a dynamic and innovative team such as yours, and I am confident that I would thrive in this environment. Thank you in advance for your consideration, and I look forward to hearing from you soon.

Sincerely,

[Your name]",1678,267,304
8,"Dear Hiring Manager,

I am writing to express my strong interest in the role of Data Scientist that is currently open at your esteemed organization. As a recent graduate with a degree in Data Science, I believe that my skills and qualifications align perfectly with the requirements for the role. I am highly motivated and eager to learn and I have a deep fascination for everything related to the field of Artificial Intelligence. Additionally, sports are my passion, and I am excited at the possibilities for using data science to innovate and transform this industry.

At [insert name of university], I gained in-depth knowledge of the different aspects of Data Science, including statistical analyses, machine learning, data visualization, and data mining techniques. During my studies, I have worked on several projects that have equipped me with the necessary skills to excel in the field. My projects have ranged from sentiment analysis on tweets, to developing a recommendation engine for an e-commerce website, to working with big data using Hadoop, MapReduce, and Spark.

Furthermore, I have been consistently commended on my strong work ethic, attention to detail, and ability to thrive in team environments. As an enthusiastic learner, I am confident that I will be able to quickly understand and adapt to any new technology or techniques that I may need to utilize in this role.

My passion lies in AI, and I am confident that I can contribute meaningfully to the development of intelligent systems that can make a tangible difference in the lives of individuals and society as a whole. With a strong work ethic, excellent communication skills and a creative mindset, I am certain that I would make a significant and positive impact on your team.

Thank you for considering my application. I look forward to the opportunity to discuss my qualifications further.

Sincerely,

[Your Name]",1899,308,353
9,"Dear [Hiring Manager],

I am writing to express my strong interest in the Data Scientist position at [Company Name]. Upon researching your company and reading through the job description, I was immediately drawn to the innovative projects your company is involved in and the opportunity to work alongside a dynamic team of professionals. As a highly motivated and enthusiastic individual, I am confident that my skills and experience make me an ideal candidate for this role.

I have a passion for learning and a deep fascination with Artificial Intelligence. I am eager to explore the myriad of ways that AI can be applied in the field of Data Science. I believe that the integration of AI technologies can lead to great strides in our understanding of the world around us, and the development of innovative solutions that will change the way we live and work.

Sports are also a great passion of mine. I believe that the intersection of sports and data science presents limitless opportunities for discovery and innovation. I am excited to explore this area further and to use my skills to bring new insights to the field.

In terms of my qualifications, I hold a Bachelor's degree in Mathematics from [University Name], and have worked as a Data Analyst for [Company Name] for the past 2 years. During my time at [Company Name], I was responsible for collecting and interpreting data, performing complex advanced data analysis, and creating insightful reports. I have experience using various software tools, including Python, R, and SQL, and am always eager to learn new technologies.

I believe that my expertise in advanced analytical and data processing tools, combined with my passion for AI and sports, make me an ideal candidate for this position. I am confident that I can offer your team a unique set of skills and insights that will drive success for your business.

Thank you for considering my application. I am eager to discuss my qualifications further, and can be contacted at [Email] or [Phone].

Sincerely,

[Your Name]",2039,339,387
10,"Dear Hiring Manager,

I am writing to express my keen interest in the Data Science job opportunity at your esteemed organization. As a highly motivated individual with an insatiable thirst for knowledge, I believe I possess the skills, expertise, and qualities necessary to excel in this role.

From a young age, I was always fascinated by the power of Data Science and its ability to transform the world. That's exactly what led me to pursue a degree in Computer Science, with a focus on Intelligence Systems, and ultimately led me towards a career in Data Science. I have always been fascinated by the way AI is changing the game and making a profound impact in our daily lives.

With a passion for sports that has been with me since childhood, I have developed an appreciation for how data science and machine learning can be applied to revolutionize the world of sports. As such, I have developed a keen interest in using Data Science to extract insights from sports data.

With a wealth of experience working in the data science domain, I bring a unique blend of skills, knowledge, and expertise to the table. My experience in statistical analysis, data exploration, data visualization, and machine learning techniques will be a great asset for this position.

Furthermore, I possess a strong work ethic, unparalleled attention to detail, and an eagerness to learn that will undoubtedly contribute to my success in this role. I am confident that my passion for Data Science combined with my demonstrated expertise in the field will result in exceptional output.

Thank you for your time and consideration of my application. I look forward to the opportunity to contribute to your organization's success in the Data Science field.

Sincerely,

[Your Name]",1759,292,333
11,"Dear Hiring Manager,

I am writing to express my interest in the Data Science role currently available at your organization. As an aspiring Data Scientist, I am highly motivated and eager to learn about this field, and I believe that your company would be the perfect platform for me to embark on this exciting journey.

Data Science has always been a topic of interest to me, particularly in the field of Artificial Intelligence. I find it fascinating how data can be used to predict and drive decisions, and how it can improve the way we live and work. In my previous academic and professional experiences, I have gained valuable exposure to various data analysis tools such as R, Python and SQL among others. This has allowed me to work on different projects that involved data extraction, cleaning, analysis, visualization and prediction. As a result, I have had the opportunity to develop excellent programming, analytical and critical thinking skills.

In addition, I am particularly passionate about sports. I believe that sports can be a source of inspiration as well as a means of promoting teamwork and discipline. Through data science, I believe that sports can be analyzed and improved upon, making it not only a more enjoyable experience but also a more strategic one. I am excited to apply my skills and knowledge to help foster innovation in the sports industry and make a real difference.

I am impressed by the reputation of your organization and the opportunities you offer to your employees to grow and develop professionally. I am excited to be part of such a dynamic and innovative team, and I am confident that I can contribute positively to your organization.

Thank you for considering my application. I look forward to the opportunity to speak with you further about how I can contribute to your organization.

Sincerely,

[Your Name]",1859,310,345
12,"Dear Hiring Manager,

I am writing to express my strong interest in the Data Scientist position at your esteemed company. My passion for data science has led me to pursue a career in this field, and I am eager to apply my skills in a professional setting. I was particularly drawn to the opportunity to work with your company because of your impressive reputation for innovation and excellence.

As a highly motivated individual, I am committed to continuous learning and growth in the field of data science. I have earned a Bachelor's degree in Computer Science and a Master's degree in Data Science, where I gained significant exposure to advanced analytical techniques such as predictive modeling, machine learning, and natural language processing. I believe that my strong academic background and practical experience in the field of data science make me an excellent candidate for this position.

I am passionate about using data science to solve real-world problems and drive innovation. I am particularly interested in the application of artificial intelligence and machine learning in various industries, and have been following the latest developments and advancements in this area with great interest. I have also had the opportunity to work on a variety of projects related to sports analytics, which is my personal passion. These experiences have taught me how to effectively analyze and interpret data to derive meaningful insights and recommendations.

Moreover, I have excellent communication and collaboration skills that allow me to work effectively in a team-oriented environment. I am confident that my attention to detail, critical thinking skills, and problem-solving abilities will contribute to the success of your team and company as a whole.

Thank you for considering my application. I am excited about the opportunity to contribute my skills and experience to your company and am eager to discuss my qualifications further in an interview.

Sincerely,
[Your Name]",1990,311,345
