,text,chars,words,tokens
0,"Dear [Name], 

Greetings from [Company Name]! We are thrilled to connect with you and appreciate the opportunity to introduce our paper company. 

[Company Name] is a leading paper manufacturer that specializes in producing high-quality paper products that cater to the diverse needs of our clients. Our top-notch paper solutions are designed to enhance productivity while reducing costs, making us the preferred choice for businesses across various industries.

We have an extensive range of paper products that include but are not limited to printer paper, copy paper, specialty paper, and many more. We understand that your business has unique needs, and we are happy to offer customized paper solutions that will help you achieve your goals.

Our commitment to quality is unrivaled, and we take pride in producing sustainable paper products that are eco-friendly and support environmental conservation. We strive to ensure that our clients have a seamless experience with us, from placing orders to delivery, and guarantee prompt customer support to resolve any issues that may arise.

We believe that a personal connection is essential to understand your business's complete requirements and identify ways to optimize our services for your benefit. We would like to invite you to our office located at [Office Address] on Wednesday at 2PM. We can discuss your specific paper needs in detail and find the right paper solutions that fit your requirements and budget.

We would appreciate it if you could confirm your availability for the meeting via email or phone. Should the proposed time be unsuitable, please let us know, and we can reschedule it for a time that works best for you.

Thank you for considering [Company Name] as your preferred paper supplier. We look forward to a fruitful collaboration with your business and meeting you soon.

Best regards,

[Your Name]

[Company Name]",1894,300,352
1,"Dear [Recipient’s Name],

My name is [Your Name], and I am writing to introduce our paper company and discuss a potential business offer with you.

At [Company Name], we specialize in providing high-quality paper products to businesses across various industries. Our goal is to help our clients streamline their operations by providing them with affordable and efficient solutions that meet their specific needs.

Based on our research, we believe that your company could significantly benefit from our extensive range of paper products. Our product selection includes everything from standard printer paper to specialty papers like carbonless, thermal, and pre-printed forms.

Furthermore, we offer customized products and solutions tailored to meet your unique needs. Our team of experts is always available to work with you and provide guidance on the most efficient and affordable solutions for your specific business needs.

I would like to invite you to our office for a meeting on Wednesday at 2 PM to discuss this further. This will be an excellent opportunity for us to get to know each other better and for you to learn more about our products, pricing, and services.

Additionally, we can discuss any challenges that your business currently faces in terms of paper needs and explore ways we can help you reduce your costs while increasing the efficiency of your operations.

Thank you for your attention. I look forward to meeting with you soon.

Sincerely,

[Your Name]",1481,236,271
2,"Dear [Recipient’s Name],

I hope this email finds you well. My name is [Your Name], and I am reaching out to you on behalf of [Your Company Name], a company that specializes in high-quality paper products. 

Our company has been in the business for several years and has the reputation for producing premium-grade paper products that meet the needs of our clients. We are consistently innovating to provide our customers with cutting-edge solutions that guarantee satisfaction.

I am writing to introduce our company's unique product offerings. We have a wide range of paper products, including but not limited to, journals, notebooks, diaries, memo pads, and sketchbooks. Our products come in different sizes, paper variants, cover designs, and colors to cater for various needs.

We believe that our products will cater to the specific needs of your business and will contribute to the success of your operations. We commit to delivering excellence in all our products and services, and therefore we are confident that we can fulfill any demands you may have.

I would like to invite you to our office on Wednesday at 2 PM to discuss more details about our products and services. We are based at [insert your office address here]. Please let me know if this timing works well for you or if there is a more convenient time for our meeting.

I am looking forward to hearing from you soon. Thank you for considering our offer, and I am excited about the prospect of working together.

Best regards,

[Your Name]",1510,254,299
3,"Subject: Introduction to XYZ Paper Company and Our Offer

Dear [Name],

I hope this email finds you well. I am writing to introduce you to XYZ Paper Company and our range of high-quality paper products that are available for your business needs.

We at XYZ Paper Company are dedicated to providing our clients with the best quality products at competitive prices. We believe that choosing the right paper is important for any business, which is why we only offer premium quality, sustainable paper that is suitable for any printing task.

Our product range includes a variety of paper options, including copy paper, coated paper, uncoated paper, and specialty papers such as textured paper and cardstock. All of our products are produced in-house, ensuring that we maintain complete control over production quality and timelines.

We would like to invite you to come to our office on Wednesday at 2PM to learn more about our products and services. During this meeting, you will have the opportunity to discuss your business needs, and we will provide you with a detailed overview of our range of products and how they can benefit your business.

We believe that our products and services will meet the needs of your business and would be happy to provide you with samples of our products, so you can see for yourself the quality of our paper before committing to larger orders.

At XYZ Paper Company, we are committed to providing our customers with the best service possible. We understand that every business has unique needs, which is why we offer personalized solutions tailored to meet your specific requirements. Our customer service team will be available to provide you with support and assistance as you make the transition to our products.

We thank you for considering XYZ Paper Company as your paper supplier; we look forward to meeting you on Wednesday at 2PM. Please let us know if you would like to confirm your attendance or if you have any questions.

Sincerely,

[Your name]",1992,334,378
4,"Dear [Client’s Name],

Greetings! I am writing on behalf of [Company Name], a renowned paper company with a wide range of high-quality products. I am excited to reach out to you and to introduce our company to you.

At [Company Name], we specialize in producing paper products that offer exceptional quality, reliability and versatility. We take pride in our commitment to provide excellent customer service to meet your business needs. Our product range includes various types of papers including bond paper, cover stock, and text paper suitable for a range of business needs.

We understand the importance of quality products in business. Our paper is manufactured to high standards and is rigorously tested to ensure that it meets the highest quality standards. We work with top suppliers and manufacturers to ensure that our products meet expectations and exceed industry standards.

We value your time, and it would be an honor to meet with you to discuss how our products can support your business. We would like to invite you to come to our office for a meeting at 2PM on Wednesday. During the meeting, we will discuss your specific paper needs, and our team of experts will provide you with information about our products, services, and competitive pricing. 

We would appreciate the opportunity to demonstrate how our products can optimize and enhance the productivity and efficiency of your business. At [Company Name], we believe that customer service is our top priority, and we are committed to providing you with high-quality products and services.

Please let us know if the scheduled meeting works for you or if you would like to reschedule. We are flexible and can accommodate your schedule to ensure that we meet your needs.

Thank you for considering [Company Name] for all your paper-based needs. We look forward to meeting you soon and building a successful business relationship.

Best Regards,

[Your Name]",1929,314,363
5,"Dear [Name of the Potential Client],

I am delighted to introduce our paper company to you and present the several offers that could be of interest to your business.

Our company has been in the paper industry for a number of years and we provide a wide range of high-quality paper products that meet different business requirements. We cater to businesses of all sizes and industries, and have built a strong reputation for excellence in service delivery.

Our products and services include custom paper production, bespoke design, and top-quality printing at affordable rates. We offer a wide selection of paper products from mailing supplies to fine paper stocks and labels. We believe our expertise and flexibility allow us to provide outstanding service that meets your business’ specific needs.

We are excited to partner with your company and provide you with the best paper products that suit your needs. Our focus is on building long-lasting relationships and adding value to your business. We aim to achieve this by providing excellent customer service that makes every client feel valued.

We believe that a meeting with you is the best way to discuss how our products and services can help your business grow. As such, I would like to invite you to our office at 2 pm on Wednesday for further discussion of how our partnership could be beneficial to your business. The office address is [insert address] and please let me know if that timing works for you.

Thank you for considering our proposal. We are excited to work with you and look forward to hearing back from you soon.

Best regards,

[Your Name]",1617,272,302
6,"Dear [Recipient],

I am writing to introduce you to our paper company, [Company Name]. We specialize in producing high-quality paper products that meet the needs of various businesses.

Our paper company has been in business for several years, and we pride ourselves on providing efficient and reliable service to all our clients. Our team members are highly skilled and experienced in the production process, ensuring that we deliver high-quality products consistently.

We have a wide range of paper products, from standard copy paper to specialized paper for specific uses, such as cardstock paper for business cards or heavy-duty paper for packaging. No matter the need, we strive to fulfill each order to your satisfaction.

Our company uses only sustainable materials in our products, ensuring that our production processes are eco-friendly and in line with current industry standards. We understand the importance of environmental sustainability and are committed to implementing sustainable practices throughout our business operations.

I would like to invite you to visit our office on Wednesday at 2PM. During this meeting, we can provide you with more detailed information about our paper company and how we can fulfill your business's paper supply needs. We can also discuss how we can work in tandem to help meet your expectations. 

Please let us know if this works for you and if there is anything else we can do to ensure a successful meeting. We appreciate your consideration, and we look forward to hearing from you soon.

Best regards,
[Your Name]",1567,249,286
7,"Dear [Recipient],

I hope this email finds you well. I am reaching out to introduce our paper company, [Company Name], and the products and services we offer that could bring significant value to your business.

[Company Name] is a company committed to providing high-quality paper products to businesses of different industries. With over 10 years of experience in the paper industry, we have built expertise in producing various types of paper products, ranging from traditional copy paper to specialized paper for printing and packaging.

We understand that businesses have different needs and requirements for paper products, and that is why we have a team of experts who can tailor our products and services to meet your specific needs. Our products are manufactured using the latest technology and are designed to meet the highest standards of quality and durability.

We take pride in our customer service, and we believe that building strong relationships with our clients is the key to success. We work closely with our clients to understand their specific requirements, and we strive to deliver products that exceed their expectations.

We believe that [Company Name]'s products and services could bring significant benefits to your business, and we would love to have the opportunity to discuss how we can help you. We are inviting you to a meeting at our office on Wednesday, [Date], at 2 PM. During the meeting, you will have the chance to learn more about our products, services, and the value they can bring to your business.

We look forward to meeting with you and discussing how we can partner together to meet your paper needs. Please let us know if this time works for you, or if you would like to reschedule.

Best regards,

[Your Name]

[Company Name]",1773,293,338
8,"Subject: Introduction of Our Paper Company and Offer

Dear Ms. [Recipient],

Greetings from [Your Company Name]!

I am writing this email to introduce our paper company and its range of quality products to you. We understand your company's requirements and are confident that we can cater to your needs. 

[Your Company Name] has been in the paper industry for [Number of Years] years and has a lot of experience in supplying paper to different types of clients, ranging from small retailers to large corporates. Our goal is to offer an array of quality paper products that meet the market's needs at competitive prices.

We specialize in [Types of Paper] and can provide paper of various sizes and thickness, depending on your specific requirements. Our paper products are of high quality, which means that they won't easily wear out and will withstand any harsh conditions during transportation or handling. We also prioritize eco-friendliness in our products, so you can be sure that our paper is sustainable and environment-friendly.

Additionally, our company has a dedicated customer support team that will be available to assist you at every stage of the purchase. We believe that a smooth and hassle-free customer experience is just as important as the quality of our products.

We would like to invite you to visit our office for a further discussion on our products and services. The meeting will be held on Wednesday at 2 PM. During the meeting, we can detail our paper range and pricing terms, and address any additional queries you may have. Our office address is [Your Company's Address]. Please inform us of your availability for the meeting, and we would be pleased to arrange the same.

Thank you for considering [Your Company Name] as your paper supplier. We are confident that we can provide the best products and services for your business.

Sincerely,

[Your Name]

[Your Company Name]",1906,314,373
9,"Dear [Recipient],

I am writing to you on behalf of [Your Company Name], a leading paper manufacturing company that provides quality paper products to businesses across various industries. Our company has been in business for many years and we have gained a reputation for producing high-quality paper products that are sustainable, environmentally friendly, and cost-effective.

We understand that as a business, you require reliable partners who can provide you with high-quality paper products that meet your specific needs. We have the expertise and resources to produce a range of paper products that are tailored to your requirements. Our products are manufactured using the latest technology, and our experienced team ensures that each product is of the highest quality.

We would like to invite you to a meeting at our office on Wednesday at 2 PM. During the meeting, we will provide you with more information about our products and services and discuss how we can be of assistance to your business. Our team will also share samples of our products to help you choose the best-suited paper products for your business.

At [Your Company Name], we take sustainability seriously and we implement eco-friendly techniques to minimize our environmental impact. We believe that it is important to contribute to a greener and more sustainable environment, and our practices reflect that commitment.

We value our customers and have built our business on long-term relationships. We seek to understand your business needs and provide you with the best products and services possible. Once you become a part of our family, you can be assured of exceptional customer service and reliable support.

We look forward to meeting you soon and discussing how we may be of service to your business. To confirm your attendance, please let us know your preferred meeting date and time by email or phone.

Thank you for considering [Your Company Name] as your paper product provider. We look forward to hearing from you soon.

Sincerely,

[Your Name]

[Your Position]

[Your Company Name]",2075,332,382
10,"Dear [Recipient’s Name],

I hope this email finds you well. My name is [Your Name] and I am the representative of [Company Name], a paper company that specializes in providing high-quality paper products to businesses of all sizes. Our company has been in the industry for [Years of experience] and we have gained a reputation for delivering premium paper supplies coupled with excellent customer service.

With an extensive array of options that cater to the diverse needs of our clients, we have created opportunities for businesses to access fabulous products at competitive prices. We take pride in our sustainability initiatives and we are committed to promoting eco-friendly solutions in the business world.

As a potential client of ours, we believe that you would benefit from our products, given that they meet the highest standards and are backed by our unwavering commitment to excellence. We offer a wide range of paper supplies, including but not limited to:

• Copy paper
• Specialty papers
• Envelopes
• Printing paper
• Inkjet and laser papers

We strongly believe that our paper products are some of the best on the market. Our commitment to customer satisfaction drives us to provide unmatched quality and service, while our competitive pricing makes us an attractive option for businesses on a budget.

That said, we would love to discuss further how we can partner with your business to satisfy your paper supply needs. I would like to invite you to our office at [Office Address] on Wednesday at 2 PM to discuss how we can best meet the needs of your business. I will also have samples of our paper products available for your perusal.

We look forward to the opportunity of doing business with you and are confident that our partnership would be mutually beneficial. If you have any questions or any further information you require, please do not hesitate to contact us.

Best regards,

[Your Name]",1920,320,369
11,"Subject: Introduction to High-Quality Paper Products and Inviting to a Meeting

Dear [Client Name],

It gives me great pleasure to introduce our company, [Company Name], to you. We are a leading supplier of high-quality paper products, serving various industries such as printing, publishing, packaging, and stationery across the country. We are eager to expand our reach and are confident in our abilities to meet the paper product needs of your esteemed company.

At [Company Name], we believe that paper products are more than just a commodity; they are an essential tool in creating a lasting impression and delivering a quality product. That is why we have invested in state-of-the-art equipment and a highly trained team of experts to produce exceptional paper products that meet the unique needs of each of our clients.

Our product range includes but is not limited to printing papers, specialty papers, coated papers, packaging boards, and office stationery. We offer a wide variety of sizes, finishes, and thicknesses to ensure we cater to your specific needs.

Additionally, we understand the importance of reliable and timely deliveries, and that is why we have implemented a streamlined production system, backed up by our efficient logistic and delivery team. We are confident that working with us will provide you with the paper products that you need, delivered when you need them.

We would like to take this opportunity to invite you to a meeting with us at your convenience to discuss how our company can be of service to your business. Our office is located at [Address], and we suggest we meet at 2 PM on Wednesday to allow ample time to discuss your paper products needs. Please let us know a suitable day and time for you.

Thank you for taking the time to consider our services, and we look forward to the opportunity to work with your esteemed company.

Sincerely,

[Your Name]
[Company Name]",1917,317,374
12,"Dear [potential client],

On behalf of [company name], I would like to introduce our paper company and express our interest in forming a business relationship with you. We take pride in being one of the leading paper products manufacturers, providing high-quality paper products combined with exceptional customer service, sustainability, and reliability over the years.

At [company name], we manufacture and supply a range of paper products, including but not limited to printing paper, writing paper, packaging paper, and specialty papers for various industries. Our products are designed to meet all your unique needs and requirements. We use advanced technology and processes to make sure our products are not only of the highest quality but also eco-friendly.

We understand that each company has different needs, which is why we’re committed to creating custom solutions that fit your unique business needs. Our team of experts works closely with our clients to understand their individual needs and offer solutions that meet their budget and business objectives, so you can rest assured that we have solutions tailored specifically for you.

We believe that nothing can take the place of a personal interaction when it comes to business, which is why we would like to invite you for a meeting at our office on Wednesday at 2PM. We would love to discuss the different options we offer and how we can collaborate together to achieve your business goals. Our team will be available to answer all of your questions, provide product samples, and go through our product portfolio.

We hope to build a lasting relationship with you and your company, and we’re excited about the possibilities that lie ahead. Please don’t hesitate to contact us via email or phone to confirm your attendance to the meeting or if you have any questions, and we look forward to seeing you on Wednesday.

Sincerely,

[Your name]

[Your position]

[Company name]",1941,313,360
13,"Dear [Recipient],

I am writing to introduce you to our paper company and our offer. We are a leading supplier of high-quality paper products with a reputation for excellent service and competitive pricing. With over [Number] years of experience in the industry, we have established ourselves as a reliable and trustworthy partner for businesses of all sizes.

At [Company Name], we are committed to providing our clients with the best possible products and services. We offer a wide range of paper products, including printing and writing papers, packaging materials, and specialty items for a variety of applications. Our products are of the highest quality, and we work directly with our suppliers to ensure that we are providing our clients with the most sustainable options possible.

We understand that every business is unique, and we pride ourselves on our ability to provide customized solutions that meet the specific needs of our clients. Whether you are looking for a reliable supplier for your day-to-day paper needs or are in need of a one-time special order, we are here to help.

We would like to invite you to a meeting in our office at [Address] at 2PM on Wednesday to discuss how we can best serve your paper needs. At this meeting, we will provide you with a comprehensive overview of our products and services, answer any questions you may have, and discuss how we can work together to achieve your goals.

We are confident that you will find our products and services to be of the highest quality, and we look forward to the opportunity to earn your business. Please let us know if you have any questions or if there is anything else we can do to assist you.

Thank you for considering us as your paper supplier.

Best regards,

[Your Name]

[Company Name]",1778,303,346
