,text,chars,words,tokens
57,"Subject: Introduction to XYZ Paper Company and Meeting Invitation 

Dear [Recipient’s Name], 

I hope this email finds you well. I am writing to introduce you to XYZ Paper Company and our paper products. Our company specializes in producing high-quality eco-friendly paper products that cater to various businesses. 

At XYZ Paper Company, we are committed to making a positive impact on the environment, and our products reflect this commitment. Our products are made from recycled materials and are biodegradable, compostable, and recyclable. We have a wide range of paper products including notebooks, printing paper, envelopes, and much more, all at competitive prices. 

We would love to have the opportunity to meet with you and discuss how our company’s paper products can benefit your business. We understand that finding the right supplier for your business is crucial, which is why we pride ourselves on providing excellent customer service and timely deliveries. 

I would like to invite you to meet with us at our office located [Address] on [Date] at [Time]. During the meeting, we can discuss our products, pricing, and answer any questions you may have about our company. We hope that this meeting will be an excellent opportunity for us to showcase our products and how they can meet and exceed your business expectations. 

Please let me know if this invitation works with your schedule, and we can confirm the details accordingly. We look forward to meeting you and showing you our top-of-the-line paper products. 

Thank you for your time and consideration. 

Sincerely, 

[Your Name] 

[Your Title] 

XYZ Paper Company",1638,259,322
58,"Dear [Recipient Name],

I am writing to introduce you to our paper company, [Company Name]. We are a leading supplier of high-quality paper products to clients across a range of industries. With over [Number] years of experience in the industry, we have a deep understanding of our clients' needs, and we are committed to delivering products that meet and exceed their expectations.

At [Company Name], we pride ourselves on our commitment to quality. We source our raw materials from the finest producers, and we use state-of-the-art manufacturing techniques to ensure consistent quality across our range of products. We offer a wide range of paper products, including printer paper, specialty paper, and packaging materials, all of which are designed to meet the needs of our diverse client base.

We understand that every client is unique, which is why we offer customized solutions to meet your specific needs. Our team of experienced professionals is always on hand to provide advice and guidance, so you can be sure that you are getting the best possible products and services when you work with us.

I would like to invite you to meet with us at our office at [Address] on [Date] at [Time]. This will be an excellent opportunity for us to further discuss your specific paper needs and how we can best meet them. During the meeting, we can also provide you with samples of our products and answer any questions you may have.

Thank you for considering [Company Name] as a potential partner for your paper needs. We are confident that we can offer you the highest quality products and services, and we look forward to the opportunity to work with you.

Sincerely,

[Your Name]

[Company Name]",1697,285,335
59,"Subject: Introduction to Quality Paper Products and Invitation to Meeting

[Recipient’s Name],

I am writing to introduce you to our paper company, Quality Paper Products. Our company is dedicated to providing the highest quality paper products to businesses like yours.

We have been in the paper manufacturing business for over ten years and our brand has become synonymous with quality and dependability. We pride ourselves on being leaders in the industry and paying close attention to details to ensure that our customers receive the best service possible.

Our paper products are made from the finest materials and are designed to meet the needs of businesses of all sizes. We offer a wide range of paper products that are perfect for office use, including copy, print, and writing paper, as well as various specialty paper options such as cardstock, envelopes, and labels.

Given your company’s reputation in the market, we believe that our products would be an excellent fit for your business needs. We are confident that you will be impressed with the quality of our paper products and the competitive pricing we offer.

To further discuss our products and services, we would like to invite you to a meeting at our office located at [insert address] on Wednesday at 2 PM. During this meeting, we will showcase our paper products, share information about the customization options available, and answer any questions you may have.

We look forward to meeting with you and building a valuable business relationship. Please let us know if this time and date work for you. We will be happy to reschedule if necessary. Thank you for considering Quality Paper Products for your business needs.

Kind regards,

[Your Name]

Quality Paper Products",1748,285,326
60,"Dear [Client Name],

I hope this email finds you in good health and spirit. My name is [Your Name] and I am writing to you on behalf of [Your Paper Company]. We are a leading paper manufacturer and supplier based in [City, Country]. Our company has a legacy of over [X years] years, and we have gained a reputation for providing high-quality paper products and excellent customer service to our clients.

We understand that every business has unique needs and demands, and we take pride in our ability to offer customized solutions to meet these requirements. We specialize in the production of a wide range of paper products that are suitable for various industries. Our product range includes paper rolls, paper sheets, notebooks, journals, and other paper items.

We are aware of your business and believe that our products can offer significant value to your operations. Our team of experts is knowledgeable, experienced, and dedicated to providing the best solutions for our clients. We would like to invite you to visit our office and discuss how we can assist your business in achieving its objectives.

We would like to schedule a meeting at our office on Wednesday at 2 pm. During the meeting, we will provide you with more information about our products, services, and solutions. We will also discuss your business requirements and how we can customize our solutions to match your expectations.

Please let us know if this date and time are suitable for you. We would be happy to reschedule the meeting at a more convenient time if necessary. Alternatively, if you are unable to visit our office, we can arrange for a call or an online meeting to discuss further.

Thank you for your time and consideration. We look forward to hearing back from you soon.

Best regards,

[Your Name]",1792,304,350
61,"Dear [Recipient],

I am writing on behalf of [Name of Paper Company] to introduce our company and services to you with great pleasure. As one of the industry's leading paper manufacturing and distribution companies, we pride ourselves on delivering exceptional quality and service to our clients.

Our products consist of a wide range of paper products, such as printing and copier papers, envelopes, stationery, business cards, and much more. Over the years, we have provided our clients with top-quality paper products that meet their needs and exceed their expectations. Our excellent products are worth mentioning without diminishing our world-class customer service, which sets us apart from our competitors.

Our primary goal is to provide our clients with customized solutions for all their paper product needs at a competitive price. Our team of experts is skilled in providing tailored solutions that will meet specific needs and budget requirements.

We believe that our company's values align with yours, which is why we would love to invite you to a meeting at our office on Wednesday at 2 pm. During our meeting, we will discuss how our services can be tailored to meet your business's unique requirements. We guarantee that our team of professionals will help you to streamline your paper product supply chain to save you time and money.

We understand that your time is valuable, and we aspire to make this meeting as productive as possible by answering all your questions and providing you with personalized solutions that will meet your specifications. Thank you for considering working with us.

Please let me know if you would be available for a meeting on Wednesday at 2 pm, and I will make the necessary arrangements.

We look forward to hearing from you.

Best regards,

[Your Name] 

[Name of Paper Company]",1830,297,342
62,"Subject: Introducing [COMPANY NAME] and Our Offer for Your Business Needs

Dear [CLIENT NAME],

I hope this email finds you well. I am writing to introduce [COMPANY NAME], a paper company that offers quality and eco-friendly paper products for various industries. We have been in the business for [NUMBER OF YEARS], and our commitment to excellent service has made us stand out in the market. 

We understand that your business demands the best possible supplies for your daily operations, and we believe that we can provide you with exactly what you need. We pride ourselves on our extensive selection of paper products that includes but is not limited to copy paper, writing paper, note cards, envelopes, and much more. 

Moreover, we understand the need to reduce the environmental impact of paper production and we take that responsibility seriously. All of our products are made from sustainable materials and we strive to reduce our carbon footprint every step of the way. 

I would love the opportunity to discuss our products with you further, and learn more about your specific business needs. I am available for a meeting at our office located at [ADDRESS] on [DAY], [DATE] at [TIME]. At our meeting, we can discuss our products, our pricing, and how we can create a customized plan that will help your business reach its goals. 

If you would like to make an appointment, please reply to this email or give us a call at [PHONE NUMBER], and our friendly customer service agents will help you schedule your visit. 

Thank you for considering [COMPANY NAME] as your paper supplier. We truly believe that our experience and commitment to sustainability will benefit your business in the long run.

We look forward to hearing from you soon.

Sincerely,

[YOUR NAME]
[COMPANY NAME]",1786,297,360
63,"Dear [Client's Name],

I hope this email finds you well. My name is [Your Name], and I am reaching out to introduce you to our paper company, [Company Name]. We specialize in providing high-quality paper products to businesses just like yours, and we would love to explore the possibility of working together.

At [Company Name], we understand the importance of having reliable and efficient paper supplies that can meet the needs of your business operations. That's why we offer a wide range of paper products, including printer paper, stationery, copy paper, and specialty paper products that can be customized to your unique specifications.

Our products are made from high-quality materials that are environmentally friendly, which means you can feel good about using them in your business operations. We also offer competitive pricing and a commitment to customer service that ensures you always get the support you need when you need it.

In light of this, I would like to invite you to a meeting at our office, which is scheduled for Wednesday at 2PM. During our meeting, we can discuss our products, services, and how we can work together to meet your paper supply needs.

Please let me know if this meeting time is convenient for you or if there is a better time that works best for your schedule. Also, if you have any questions or concerns that you would like to address prior to our meeting or would prefer to have a call instead, please do not hesitate to write back with your preferred option.

Thank you for considering our paper company for your business needs. We look forward to hearing from you soon and exploring the possibility of working together.

Best regards,

[Your Name]",1697,287,331
64,"Subject: Introduction of Our Paper Company and Offer

Dear [Recipient’s Name],

I hope this email finds you well. My name is [Your Name] and I am the marketing manager of [Your Company Name]. I am writing to introduce our paper company and offer our services to your esteemed organization.

We are a leading paper company based in [City name] and have been in the industry for several years. Our aim is to provide high-quality paper products that are sustainable and eco-friendly to help reduce the carbon footprint. We have a team of experienced professionals who understand the needs of the market and can provide custom solutions that cater to the specific requirements of your business.

We offer a wide range of paper products, including printer paper, letterhead paper, envelopes, business cards, and much more. We also offer customization services to ensure that the paper products match your company’s branding and theme. Our products are manufactured using the latest technology and adhere to strict quality control procedures to ensure the highest quality standards.

We understand that every business has unique requirements, which is why we offer competitive pricing and exceptional customer service. Our team is always available to provide expert advice and guidance to help you make the best decision for your business.

We would be honored to meet with you in person to discuss how we can benefit your organization. I am pleased to invite you to our office located in [Address] for a meeting on Wednesday at 2pm. During the meeting, we can provide you with more information about our paper products and services, as well as answer any questions you may have. 

I look forward to hearing from you. Thank you for considering our products and services.

Sincerely,

[Your Name] 
Marketing Manager 
[Your Company Name]",1829,297,348
65,"Dear Sir/Madam,

I am writing to introduce you to our esteemed paper company, which provides a wide range of paper products to businesses of all sizes. Our products are manufactured using high-quality materials that are eco-friendly as well as durable. Our offerings include a wide range of products like photocopier paper, print paper, envelopes, and packaging materials that can be customized as per your needs.

We have been in the paper manufacturing business for more than 10 years, and our experienced team has delivered exceptional service to our customers both locally and internationally. We have a reputation for providing top-quality products, competitive pricing, and excellent customer service.

We understand that the quality of paper products is crucial to the daily operations of any modern business. Our team has developed a range of paper products that perfectly match your needs for reliable, high-quality supplies. Further, we pride ourselves on delivering exceptional customer service and ensuring that our products meet and exceed your expectations. We are always open to hearing your feedback and are continually improving to ensure our products are simply the best.

I believe that our company would be a perfect fit for your business's paper product needs. I am requesting that you avail some time to visit our office and meet with our experts on Wednesday at 2 PM. This visit will provide you with ample opportunity to learn more about our products, service offerings, and any other queries you may have.

We would be honored to have the opportunity to earn your business and create a long-lasting relationship with your esteemed organization. Please feel free to contact us if you have any questions or to confirm your appointment. We look forward to hearing from you.

Best regards,

[Your Name]",1823,291,333
66,"Dear [Recipient],

I am writing on behalf of [Company Name], a leading paper company that specializes in providing top-quality paper products to businesses like yours. We are writing this email to introduce ourselves and our product line, as well as to discuss a potential business partnership with you.

[Company Name] has been in the paper business for [number] years and has built a solid reputation for providing our customers with only the finest paper products available in the market. From standard paper products like copy paper and envelopes to custom products like business cards and stationery, we offer a wide range of paper solutions to meet all your business needs.

We understand that your business is unique, and we are committed to designing custom solutions that fit your specific requirements while keeping your budget in mind. Our product line includes only high-quality and sustainable materials, ensuring that your business is always making an eco-friendly choice.

Moreover, we also offer design and printing services and work closely with customers to ensure that they are completely satisfied with their orders. Our team of experts will guide you throughout the process and ensure that all your expectations are met.

We would like to extend an invitation to you to visit our offices at [Address] at 2 PM on Wednesday to discuss how [Company Name] can provide your business with the best paper products and printing services. This will be an excellent opportunity for us to showcase our products and services and get you acquainted with our team and our mission.

We believe that with our experience, extensive product line, and customer-centric approach, [Company Name] is the ideal partner for your business. We believe that together, we can build a long-lasting and mutually beneficial relationship that will help your business grow and prosper.

Please let us know if you are available on Wednesday at 2 PM, and we will prepare a presentation for you. We look forward to meeting you at our offices soon.

Best regards,

[Your Name]

[Company Name]",2076,336,387
67,"Dear [Recipient Name],

Allow me to introduce myself. My name is [Your Name] and I am the owner of [Your Company Name], a leading paper company based here in [City Name]. It is with great pleasure that I write to introduce our services to your esteemed business. We believe that our products and services can be of immense benefit to your business, and we would like to invite you for a meeting to discuss our offer.

At [Your Company Name], we specialize in providing quality paper solutions to businesses of all sizes. Our experience in the industry has enabled us to understand the unique needs of each of our customers, and to offer a wide range of paper products that meet these needs. We stock paper of all grades, sizes and colors, and we pride ourselves in offering competitive prices, fast delivery and exceptional customer service.

We understand that your business may require a variety of paper products and services, and we are confident that we can provide them all. Whether you require plain, printed, specialty, or customized paper products, we have got you covered. We can customize products to meet your specific requirements, and our team of experienced professionals can advise you on the best product to suit your needs.

We understand that choosing a reliable paper supplier can be a daunting task, especially with so many options available in the market. However, with [Your Company Name], you can be assured of quality, reliability and affordability. We have worked with some of the biggest businesses in the city, and have a proven track record of delivering quality in every aspect of our services.

In light of the above, we would like to invite you to a meeting in our office on Wednesday at 2PM. During this meeting, we will be able to demonstrate our products, answer any questions you may have, and discuss how we can tailor our services to your specific needs.

Thank you for considering [Your Company Name] as your paper supplier. We look forward to meeting you soon, and building a long-lasting business relationship together.

Best regards,

[Your Name]

[Your Company Name]",2109,356,414
68,"Dear [Client Name],

I am writing to introduce you to our paper company and offer our services to you. We specialize in providing top-quality paper products to businesses in various industries. Our company has been in the industry for years and has maintained a strong reputation for delivering reliable and high-quality products and services.

As a business professional yourself, we understand how important it is to have a reliable paper supplier that meets your needs and demands. Our team of experts is dedicated to ensuring that our clients receive high-quality products at competitive prices. Our extensive range of paper products includes printer paper, office paper, specialty paper, and other paper-based products.

We guarantee that our products are of excellent quality, and we back it up with a 100% satisfaction guarantee. Our team is committed to working with you to understand your specific needs and provide customized solutions that fit your requirements.

I would like to invite you to visit our office to learn more about our products and services. Our team will be available to show you samples of our paper products, discuss pricing, and help you determine which products would be best suited for your business. We would be honored to earn your business and become your go-to paper supplier.

Please let us know if 2PM on Wednesday, [Date] works for you. We will ensure that our team is available to greet you and answer any questions that you may have. If you are unable to make it to our office at this time, please let us know and we will be happy to schedule an appointment that is convenient for you.

Thank you for considering our services, and we look forward to hearing from you soon.

Warm regards,

[Your Name]

[Your Company Name]

[Your Contact Information]",1791,298,343
69,"Dear [Recipient],

I hope this email finds you well. I am writing to introduce you to our paper company, and to discuss a potential collaboration between our two businesses.

We are a company dedicated to providing high-quality paper products to businesses of all sizes. Our product line includes standard office paper, specialty paper, and customized paper options that are suitable for a wide range of uses. We pride ourselves on our commitment to sustainability, using only environmentally friendly materials and production processes.

I believe that our paper products could be of great benefit to your business, and I would like to invite you to meet with me and my team at our office at 2PM on Wednesday to discuss this potential collaboration further. During this meeting, we can discuss exactly how our products can be tailored to meet your specific needs, as well as our pricing options.

I understand that you may have questions or concerns regarding our paper products, or about our company in general. Please do not hesitate to ask any questions that you may have during our meeting. We would be happy to provide you with any additional information that you may need to make an informed decision.

Thank you for considering our paper company, and we look forward to the opportunity to work with you. I will follow up with you later this week to confirm our meeting time, and to answer any additional questions that you may have.

Best regards,

[Your Name]",1468,247,277
70,"Dear [Client],

I hope this email finds you well. My name is [Your Name], and I am writing to introduce our paper company and its products. Our company takes pride in offering the highest quality paper products, which are perfect for meeting the needs of businesses like yours.

We would like to extend a special offer to your business on our range of products, which includes high-quality printing paper, stationery, and specialty papers. Our premium products are manufactured using state-of-the-art technology, and we guarantee that you will be satisfied with the quality of our paper.

Our company has built a reputation for delivering high-quality products and excellent customer service. We believe in working closely with our clients and providing the support they need to grow their businesses.

To that end, we would like to invite you to a meeting in our office at 2 PM on Wednesday. During our meeting, we will offer you more information about our company and our products, answer any questions you may have, and work to explore how we can collaborate and add value to your business.

Please let us know if you will be able to make it, and we will make sure to reserve a time slot for you. We look forward to meeting with you and discussing how we can help your business thrive.

Thank you for your time and interest in our company.

Best regards,

[Your Name]",1370,236,272
