,text,chars,words,tokens
28,"Dear [Potential Client],

I am reaching out to introduce you to our paper company and to extend an invitation to meet with you in our office at 2PM on Wednesday to discuss how we can assist your business needs.

At [Company Name], we understand how important the right paper products can be for your business operations. We specialize in providing high-quality, affordable paper solutions to businesses of all sizes. Our products are designed to help our clients streamline their operations and enhance their profitability.

We are dedicated to providing exceptional customer service to every person with whom we do business. We work tirelessly to understand the needs of our clients and to provide customized, flexible solutions that meet their unique requirements. Whether you are looking for high-volume printing paper or specialized paper products, we can help.

One of our major strengths is our ability to provide our clients with a broad range of paper and related products, all under one roof. This makes it easier and more cost-effective for you to manage your paper supply chain and to achieve greater efficiency and cost savings in your operations.

We believe that every business deserves access to high-quality paper products that are customized to meet its unique needs. That is why we have invested heavily in R&D to develop innovative, leading-edge paper products that help businesses improve the effectiveness and efficiency of their operations.

During the meeting, we will have the opportunity to showcase our products, discuss how they could benefit your business, and answer any questions you may have. We would be delighted to hear about your business needs, and to explore ways in which we can help you achieve your goals.

Thank you for considering our paper company, and we look forward to meeting with you on Wednesday.

Best regards,

[Your Name]

[Your Company Name]

[Your Phone Number]

[Your Email]",1929,310,355
29,"Dear [Client’s Name],

I hope this email finds you well. I am writing to introduce our paper company and provide information on the services we offer. We are a team of professionals who specialize in producing high-quality paper products for both commercial and personal use.

At [Company Name], we understand the importance of having reliable and durable paper products for business operations. Our products are manufactured using modern equipment and technology that ensures consistency in quality and durability.

We offer a wide range of paper products, including various sizes and finishes of printing paper, cards, envelopes, and speciality paper products. Our products are suitable for all types of printing machines, and we can also create custom designs for your business needs.

Our company prides itself on excellent customer service, timely delivery, and competitive pricing. We always strive to exceed our clients' expectations by ensuring that the products we provide are tailored to meet their specific needs.

I would like to have the opportunity to discuss our products and services in detail with you. I invite you to visit our office at 2 PM on Wednesday for a face-to-face meeting. During this meeting, we can go over your business needs, suggest paper products that would be suitable, and present samples for you to try.

Please let us know if you can make it on Wednesday. We would be happy to reschedule if the given date and time are not suitable for you. We hope to have the opportunity to do business with you in the near future.

Thank you for your time and consideration.

Best regards,

[Your Name]

[Company Name]",1643,269,313
30,"Dear [Recipient Name],

I hope this email finds you well. I am writing to introduce my paper company, [Company Name], and explore the possibility of working together.

[Company Name] has been a leader in the paper industry for over 15 years, with a focus on producing high-quality paper products that are environmentally friendly. We specialize in producing paper that is not only durable and strong, but also sustainably sourced and recycled.

Our paper products range from office essentials like printer paper and envelopes, to specialty items like paperboard and packaging materials. We are committed to providing our customers with the best possible products, and we are confident that we can meet your business needs.

We would be honored to have the opportunity to discuss your paper needs further. I would like to invite you to a meeting in our office at 2PM on Wednesday, where we can discuss your specific paper requirements and how we can best serve your company.

Please let me know if this time works for you. I understand that your time is valuable, and we will be respectful of it during our meeting. Thank you for considering [Company Name] as your paper supplier.

I look forward to hearing from you soon.

Best regards,

[Your Name]",1249,209,245
31,"Dear [Client Name],

I am writing this email to introduce our paper company and explore the possibility of working together. We are a dedicated team of professionals committed to providing high-quality paper products with exceptional customer service. Our company has been serving various industries for over a decade now and has established a reputation for providing reliable and eco-friendly products.

We understand that your company is equally enthusiastic about quality products and services just as we are. Hence, we would like to explore the possibility of providing you with a range of our products, including high-quality A4 paper, envelopes, and other stationery. We are confident that our products will meet your needs and exceed your expectations.

We also take pride in our eco-friendly initiatives and assure you that our products are made from renewable sources and are recyclable. Our commitment to the environment does not compromise the quality of our products, and we assure you that you will not be disappointed.

We would like to invite you to a meeting at our office on Wednesday at 2 PM. We hope this meeting will be an opportunity to discuss how your company can benefit from our products and services. Our team will be available to answer any questions you may have and provide you with a tailor-made solution that will meet your specific needs.

To confirm your attendance to the meeting, please reply to this email with your preferred date and time. Our team will be delighted to host you and provide you with a tour of our premises.

Thank you for taking the time to read this email, and we look forward to hearing from you soon.

Best regards,

[Your Name and Signature]",1700,283,318
32,"Dear [Client's Name],

I hope this email finds you in good health and high spirits. As a representative of [Your Company Name], I am reaching out to introduce our paper company and explore opportunities for collaboration with you and your business.

[Your Company Name] is a leading paper manufacturing company that specializes in producing high-quality paper products for various applications. Our products are known for their superior quality and reliability, and we have a proven track record of delivering excellent customer service.

We offer a wide range of paper products, from standard office paper to specialized industrial-grade paper. Our products are designed to meet the diverse needs of our customers, and we take pride in being able to provide customized solutions that meet their unique requirements.

We understand that every client has different needs and preferences, and we are committed to working closely with you to ensure that we provide the best possible service. Our team of experienced professionals is dedicated to delivering the highest standards of quality and customer service, and we guarantee that you will be satisfied with our products and services.

We would like to invite you to a meeting at our office at 2 PM on Wednesday, where we can further discuss our offer and explore potential areas of partnership. During the meeting, we will showcase our products and provide you with more information about our services. We are confident that we will be able to find a solution that meets your needs and exceeds your expectations.

Please let us know if this meeting time works for you or if you would like to schedule it for another day. We look forward to hearing from you soon.

Thank you for considering [Your Company Name] as your paper supplier. We are excited about the opportunity to work with you and help your business succeed.

Sincerely,

[Your Name]

[Your Company Name]",1916,313,353
33,"Subject: Introduction of Our Paper Company and Business Offer

Dear [Recipient’s Name],

I hope this email finds you well. I am writing to introduce you to our paper company, [Company Name], and present our business offer. We specialize in the production of top-quality paper products that cater to the diverse needs of our clients.

As we expand our business network, I came across your company, and I believe we can form a mutually beneficial partnership. With our expertise in the paper industry and your business experience, we can provide innovative solutions to your needs and grow our businesses together.

Our product range includes high-quality copy paper, printing paper, notebooks, diaries, envelopes, and a whole range of other paper products. We understand the unique nature of each business, and we can customize our products to suit your business preferences.

Moreover, we use eco-friendly manufacturing processes, which align with the values of many businesses today. We are dedicated to providing our clients with top-quality paper products that meet their sustainable business goals.

I would like to invite you to visit our facility on Wednesday at 2 pm to discuss our business offer further. In the meeting, we can discuss your business needs, and we will showcase our products that can take care of your paper needs. We can also answer any questions that you may have.

Please let me know if this meeting is convenient for you. I will be glad to prepare for our meeting by researching your business needs before you visit us. I look forward to meeting you.

Thank you for considering this invitation. Feel free to contact me if you have any questions or require further information.

Best regards,

[Your Name]

[Title]

[Company Name]",1757,286,337
34,"Subject: Introduction of Our Paper Company and Our Offer

Dear [Client name],

I hope this email finds you well. I am writing this to introduce our paper company and our services to your business. Our company, [Company name], is a leading provider of high-quality paper products that cater to different industries across the world.

Our company has been in the paper industry for several years now, and we have built a reputation of excellence through the quality of our products and services. We offer a wide range of paper products, including printer and copier paper, stationery, envelopes, packaging materials, and many more. We pride ourselves on our commitment to quality, value, and customer service.

We would like to offer our services to your business, and we are confident that our products and services can meet your needs and expectations. Our paper products are made from the finest materials to ensure durability, and they are designed to deliver high-quality output for your business operations.

We also understand that every business has different needs, and we offer customized solutions to ensure that your business objectives are met. Our team of experts will work with you to identify your business needs and develop a tailored solution that fits your requirements.

In light of the above, we would like to invite you to a meeting in our office at [Office address] on Wednesday, [Date] at 2 PM. During the meeting, we will discuss our paper products and services in detail, and we will answer any questions you may have.

Please feel free to let us know if you have any questions or concerns. We look forward to hearing from you soon.

Thank you for your time and consideration.

Best regards,

[Your name]

[Company name]",1744,290,341
35,"Subject: Introduction and Offer from XYZ Paper Company

Dear [Potential Client Name],

I am writing to introduce you to our paper company, XYZ Paper. We are a leading supplier of high-quality paper products in the region and have been in the business for over a decade. Our range of products includes a wide variety of paper grades to cater to the specific demands of our clients. 

We understand that finding the right paper supplier is important, and we are confident that we can provide you with the best quality products and services. We pride ourselves on our commitment to customer satisfaction, and we work tirelessly to ensure that our clients' needs are met, every step of the way.

We believe that our experience in the industry, coupled with a deep understanding of our clients' requirements, make us stand out from our competitors. With that in mind, we would like to offer our services to your esteemed organization.

Our product line includes printing and writing papers, packaging papers, paperboards, and specialty papers. We source our materials from reliable and sustainable providers, ensuring that our products meet industry standards. Our prompt deliveries and competitive pricing make us a preferred choice for many organizations in the region.

We would like to invite you to visit our office on Wednesday at 2 PM to discuss how we can best serve your paper product needs. We would be happy to provide you with a tour of our facilities and show you some of the products we have to offer. During our meeting, we can discuss your requirements and how we can tailor our services to meet your specific needs.

We are confident that our products and services will exceed your expectations. Our team is dedicated to ensuring that your experience with us is seamless, smooth, and hassle-free.

Thank you for your time and consideration of our offer. We look forward to hearing back from you soon.

Best regards,

[Your Name]

[XYZ Paper Company]",1961,328,375
36,"Dear [Recipient’s Name],

I am writing to introduce our paper company, [Company Name], and to offer our premium paper products and services to your esteemed organization. We are a leading supplier of specialized paper products that cater to different industries, ranging from the healthcare and hospitality sectors to the academic and retail industries.

We have built a reputation for providing only the highest quality paper products, which are sourced from reliable and sustainable sources. Our products are also available at competitive prices, without compromising on their quality. We believe that our products can enhance your organization’s operations and help you achieve your goals.

Our paper products are diverse and can meet specific business needs, ranging from eco-friendly paper and packaging to premium card stock and heavy-weight paper for printing purposes. We also offer customization services that allow customers to personalize their paper products, enhancing their brand identity.

We recognize that businesses thrive on productive relationships, which is why we would like to invite you to meet with us in our office on Wednesday, [Date], at 2 PM to discuss what our company can offer and to explore opportunities for collaboration. During the meeting, we will give you an overview of our paper products and answer any questions or concerns you may have.

Please let us know if you would like to accept our meeting invitation or if you have any further questions or require additional information. We look forward to hearing from you and to building a mutually beneficial relationship.

Best regards,

[Your Name]",1637,254,288
37,"Dear [Recipient],

I hope this email finds you well. My name is [Your Name] and I am the owner of a paper company that specializes in [specify your specialty]. We take pride in delivering high-quality paper products that meet the specific needs of our clients.

After conducting thorough research, we have identified your business as a potential client that would benefit from our services. Our team has a wealth of experience working with businesses in your industry, and we are confident that we can deliver the solutions you need to meet your business goals.

We offer a wide range of paper products that are designed to cater to the unique needs of our clients. Whether you need specialized paper for printing, packaging, or any other purpose, we have just the right solution for you.

We understand that your time is valuable, which is why we would like to invite you to a meeting at our office on Wednesday at 2 PM. During the meeting, we will provide you with more information about our products and services and how we can help take your business to the next level. You will also have the opportunity to tour our facility and see first-hand, the standard of our operations.

We believe that a face-to-face meeting is the best way to discuss your specific needs and show you the quality of our services. We encourage you to come prepared to ask questions so that we can address any of your concerns.

Please let us know if you would be able to attend the meeting so that we can make the necessary arrangements. We look forward to hearing from you soon and the possibility of doing business together.

Best regards,

[Your Name]",1634,287,323
38,"Subject: Introduction to [Company Name] and Offer Proposal

Dear [Recipient’s Name],

I am writing to introduce myself and my paper company, [Company Name], to your esteemed organization. Our company specializes in providing high-quality paper products to businesses and individuals alike, which we believe will align with your business needs.

We understand that the current market requires businesses to be versatile and adaptable, which is why we have worked hard to ensure that our products are of the highest quality, while remaining affordable. We take pride in our ability to customize our paper products based on our customers' needs, ensuring that our clients receive tailored solutions that align with their business goals.

Our paper products range from custom branded packaging products, stationery, and printing papers, to publishing papers, and many more. We are confident that we can provide your business with all of the paper products you require to enhance your operational efficiencies and productivity.

We would like to extend an invitation for you to schedule a meeting with us at our office, where we can discuss your business needs, requirements, and tailor our paper products to meet them. Our meeting is scheduled to hold on Wednesday at 2 PM, at [Company Address].

We look forward to the opportunity of working with you and hope that this partnership will help establish a mutually beneficial relationship that will be fruitful and profitable for us both.

Thank you for your time and consideration, and we anticipate receiving your response.

Best regards,

[Your Name],

[Company Name]",1615,252,295
39,"Dear [Recipient],

I am writing to introduce our paper company and our offer to your organization. We have been in the paper industry for over a decade and have established a reputation for providing high-quality, sustainable paper products at competitive prices.

Our product range includes various types of paper such as copy paper, printing paper, specialty paper, and more. We use eco-friendly manufacturing processes that minimize our impact on the environment. In addition, we prioritize using renewable materials and minimizing waste in our production processes.

As part of our offer to your organization, we would like to propose a consultation meeting to discuss your paper needs. During the meeting, we can provide samples of our products and answer any questions you may have. We can also discuss our bulk pricing options for larger orders.

We would like to invite you to our office for the meeting at 2PM on Wednesday. Our office is located at [Insert Office Address]. Please let us know if this time and location work for you or if there is a more convenient time we can schedule.

Lastly, I would like to thank you for considering our paper company as your supplier. We understand the importance of paper products in day-to-day business operations, and we are committed to providing reliable and sustainable solutions to meet your needs.

Looking forward to hearing from you soon.

Best regards,

[Your Name]

[Your Title]

[Your Company Name]",1459,237,276
40,"Dear [Recipient],

I hope this email finds you well. My name is [Your Name], and I am writing to introduce you to our paper company, [Company Name]. We are a professional paper manufacturer and distributor, offering a wide range of quality products for all types of businesses.

Our company has been in the paper industry for over [Number of years] years, and we have gained extensive experience and knowledge in producing and distributing quality paper products. We offer a variety of grades and sizes of paper ranging from bond, copy, laser, and digital printing paper to speciality papers such as parchment, vellum, and cardstock. With our exceptional services, we can cater to all your paper needs and provide efficient and cost-effective solutions for your business.

We understand how important it is to stay competitive and maintain high standards in today's fast-paced business environment. Therefore, we strive to provide excellent service to all our clients and ensure that they are satisfied with our products. In addition, we offer competitive pricing and timely delivery, ensuring that you receive your orders on time, every time.

We would like to extend an invitation to a meeting in our office at 2 PM on Wednesday to discuss your paper requirements and how we can offer you cost-saving solutions. Our team is excited to meet with you and hear about your paper needs, whether you are looking for regular supplies or have a unique request. We will provide you with our best services and solutions, tailored to your specific requirements.

Please let us know if you are available to meet with us at the time mentioned above. We look forward to the opportunity to work with you and establish a lasting business relationship with your company.

Thank you for your attention, and we hope to hear from you soon.

Sincerely,

[Your Name]",1846,306,357
41,"Dear [Recipient],

I hope this email finds you well. I am writing to introduce myself and my paper company, [Company Name], and to inquire about any paper needs your business may have.

At [Company Name], we specialize in providing high-quality paper products to businesses of all sizes. Our product range includes various types of paper, such as printer paper, specialty paper, and stationery. We take great pride in the quality of our products and the exceptional customer service we provide.

As a potential client, I wanted to reach out to you to discuss any paper needs your business may have. We offer flexible delivery options, competitive pricing, and customizable products to fit your unique needs. Our team of professionals is dedicated to providing you with a hassle-free experience from start to finish.

To further discuss our products and services, I would like to invite you to meet with me and my team at our office, located at [Address], on Wednesday at 2 PM. We will be happy to provide you with a tour of our facility and answer any questions you may have about our paper products.

I look forward to hearing back from you and potentially starting a long-term business relationship. If you have any questions or concerns, please do not hesitate to reach out to me directly.

Thank you for considering [Company Name] for your paper needs.

Best regards,

[Your Name]",1384,233,274
42,"Dear [Recipient],

I am writing to introduce my paper company, [Company Name], and present our offer for your printing needs. With years of experience in the industry, we have been providing excellent quality materials to businesses like yours.

Our company specializes in producing a wide range of paper products with varying sizes, weights, and textures, fit for your specific needs. We offer high-quality paper for business cards, brochures, flyers, envelopes, posters, and any other printing requirements you may have.

We are proud to say that we are using eco-friendly materials, which not only promotes sustainability but also ensures that we provide you with products that are safe for the environment.

I would like to discuss how our products can specifically benefit your company. There may be items you currently purchase at a higher cost and we can likely provide a more cost-effective solution for you. Our customer service is also unmatched in the industry and our team is always available to assist you with any issues you may face.

I would like to invite you to schedule a meeting in our office at 2 PM on Wednesday. My team and I will provide you with a comprehensive presentation and answer any questions you may have regarding our products and services. 

Thank you for considering [Company Name] for your printing needs. We look forward to discussing how we can help your business grow.

Sincerely,

[Your Name]",1433,235,275
