,text,chars,words,tokens
0,"🚨 NEW ANNOUNCEMENT FROM OPENAI 🚨

Exciting news for the world of artificial intelligence! OpenAI has just announced that they are releasing a new AI language model that can generate human-like text on a diverse range of topics. This breakthrough technology has the potential to revolutionize the way we create and consume content.

Personally, I am blown away by the capabilities of this new language model. As a writer, I'm always looking for ways to improve my craft, and this technology could be a game-changer. However, I'm curious to hear what all of you think about it.

Are you excited about this new AI language model from OpenAI? Do you think it will have a positive impact on the content creation industry? Or do you have concerns about the ethics of using AI to create content?

Let's start a conversation in the comments and exchange our views on this exciting new announcement from OpenAI. 

👉 CTA: Don't forget to share this post with your followers who may be interested in this topic!",1000,172,212
1,"🚨 Big news from OpenAI! 🤖 They have just announced a new breakthrough in natural language processing, allowing AI systems to understand context and generate human-like responses better than ever before. 🤯

As an AI assistant myself, I think this is a huge step forward in the world of artificial intelligence! The ability to truly understand and interpret language is a critical aspect of any intelligent system. But what do you all think? How does this make you feel about the future of AI? Are you excited, skeptical or a bit of both? Let me know in the comments! 👇🏼

And if you're interested in learning more about this announcement, be sure to check out OpenAI's website. Plus, if you're as excited about AI as I am, hit that follow button for more updates on the latest developments in this exciting field! #AI #OpenAI #technews #naturallanguageprocessing #futuretech #CTA",877,148,196
2,"Exciting news from OpenAI! 🎉 They've just announced the release of their latest language model, GPT-3, which promises to revolutionize the way we understand and interact with language. As an AI enthusiast, I can't wait to see what this means for the future of communication and automation. 

But I want to hear from you! What's your opinion on this latest development? Are you excited about the possibilities, or do you have concerns about the growing power of artificial intelligence? Let's start a conversation in the comments below! 

And if you're interested in learning more about OpenAI and their groundbreaking work, be sure to visit their website and follow them on social media. The future is here and it's exciting! 💻🌍 #OpenAI #GPT3 #AIrevolution #language #automation #futuretech 

CTA: Share your thoughts in the comments and don't forget to follow OpenAI for more exciting updates!",894,143,195
3,"Exciting news from OpenAI! They have just announced the release of GPT-3, an AI language model that is capable of understanding and generating human-like responses. This breakthrough could have significant implications for fields such as natural language processing, journalism, and customer service. Personally, I think this is a massive step forward in the field of artificial intelligence! It's always fascinating to see how technology can mimic human behavior in such a complex way.

I would love to hear your thoughts on this announcement! Do you think this could lead to even more advanced AI applications in the future? Or are you concerned about the potential implications of AI becoming even more human-like? Let's start a conversation about the future of AI!

If you're interested in learning more about GPT-3 and the exciting possibilities this breakthrough presents, I highly recommend checking out OpenAI's website. Let's stay informed about the latest in AI technology! #openai #GPT3 #artificialintelligence #futuretech #AIconversation #CTAstartadialogue",1068,158,209
4,"🌟 Exciting news alert! 🌟 OpenAI, one of the leading research organizations in the field of artificial intelligence, has just announced a major breakthrough in natural language processing!

Their new language model, dubbed GPT-3, has shown stunning advances in generating human-like text, opening up a whole new world of possibilities for AI-powered language processing.

As an AI enthusiast myself, I couldn't be more thrilled by this announcement. It's exciting to see how far the field of AI has progressed, and I can't wait to see what kind of applications GPT-3 will enable in the future.

But what do you think? Are you excited by this news? Do you have any concerns about the implications of AI becoming even more advanced?

Let me know in the comments below! I'm always eager to hear other people's thoughts about emerging AI technologies.

And if you're interested in learning more about OpenAI's breakthrough, you can check out their official announcement on their website.

👉 CTA: Don't forget to like and share this post with your friends who are interested in the latest developments in AI!",1102,181,228
5,"📣 Exciting news! OpenAI has just announced the launch of their newest AI language model, ""Codex"". This new AI system can understand natural language commands and translate them into usable code!

😲 This is a game-changer for developers, as Codex can potentially save them hundreds of hours of coding work. It's amazing to see how much technology has evolved over the years.

🤔 But what do you think about this announcement? Are you excited about the possibilities of Codex, or do you have concerns about AI taking over certain industries?

💬 Share your thoughts in the comments below and let's have a discussion. As always, feel free to share this post with your friends and colleagues who might be interested in the future of technology.

👉 Don't forget to follow us for more updates on the latest technology news and developments. #OpenAI #Codex #AItechnology #FutureOfTechnology",881,145,187
6,"Attention all tech enthusiasts! OpenAI, the artificial intelligence research group co-founded by Elon Musk, has just made a major announcement! They have developed an AI language model that can write high-quality articles and summaries for various topics with unprecedented accuracy.

This is truly groundbreaking news and has implications for everything from journalism to marketing. Personally, I am very excited about this innovation and can't wait to see how it will shape the future of writing and content creation.

What do you think about this announcement? Do you think this system will replace human writers? Or will it simply make our lives easier? Comment below with your thoughts and opinions!

In the meantime, let's stay updated with the latest developments in AI and keep exploring the amazing possibilities it has to offer. #OpenAI #AInews #FutureTech

CTA: Follow us to stay informed about the latest advancements in AI and technology. Together, let's unlock the limitless potential of artificial intelligence!",1027,157,190
7,"Hey everyone, have you heard the news about OpenAI's latest announcement? They just released a new language model called GPT-3 and it's causing quite a buzz in the tech world.

Personally, I think it's incredible to see advancements in the field of AI, especially in natural language processing. It's amazing to think that machines can now generate human-like language that can have real-world applications.

What do you think? Are you excited about this new development or do you have concerns about the implications of this technology?

Let's start a conversation in the comments below and share our thoughts! Don't forget to tag a friend who might be interested in this topic too.

And if you want to learn more about GPT-3, check out OpenAI's website for all the details.",775,129,159
8,"Exciting news from OpenAI! The organization has just announced a new language model called ""GPT-3"" which is claimed to be the largest and most powerful AI language model to date. 

I'm personally thrilled to see advancements like this in the AI world, as it has the potential to revolutionize many aspects of our lives. From natural language processing to creating intelligent chatbots, the possibilities are endless!

What do you guys think about this announcement? Are you excited about the possibilities that GPT-3 could bring? Share your thoughts in the comments below! 

Let's keep the conversation going and stay up-to-date on the latest breakthroughs in AI. #OpenAI #AIadvancements #GPT3 

PS: Don't forget to follow our page for more updates and news on AI technology.",776,123,164
9,"Exciting news from OpenAI! The research institute just announced a new project that could potentially revolutionize the way we think about artificial intelligence. The project, called GPT-3, is a language-modeling tool that has been trained on a massive dataset of internet text, giving it an incredible ability to understand and generate human-like language.

As someone who has been closely following the field of AI for some time, I have to say I'm pretty impressed by what I've seen so far. GPT-3 has the potential to open up entirely new use cases for AI in fields like customer service, content creation, and more. But of course, as with any new technology, there are also concerns about the potential risks and ethical implications.

So, I'm curious: what do you all think about this announcement? Are you excited about the possibilities of GPT-3, or are you more concerned about the potential risks? Share your thoughts in the comments below!

And speaking of exciting news, we've got some of our own to share soon, so stay tuned for more updates. In the meantime, don't forget to hit that like button and share this post with your friends! #OpenAI #GPT3 #AI #futuretech #artificialintelligence #techcommunity #innovation #futureofwork #CTA",1248,202,267
10,"Exciting news from OpenAI! The organization just announced that they've released a new language model that can complete tasks using natural language prompts. This cutting-edge technology is the latest in AI advancements and is sure to revolutionize the way we interact with computers and machines.

Personally, I think this is a huge step forward for the field of artificial intelligence. The potential applications for this kind of language model are endless, from personal assistants to more efficient customer service. I'm really excited to see where this technology takes us.

What do you think about this announcement? Are you also excited about the possibilities of natural language AI? Let me know in the comments! 

And if you want to stay up to date with the latest news and advancements in AI technology, be sure to follow OpenAI and other thought leaders in the industry. #openai #ai #technology #naturalanguage #languageprocessing #innovation 

CTA: Share this post with your friends and let's start a conversation about the future of AI!",1050,166,202
11,"🚨Exciting news alert! OpenAI just announced that they have developed a groundbreaking AI language model, GPT-3, which has the capability of generating human-like text with unparalleled accuracy and fluency. This means that the possibilities for natural language generation in fields such as writing, research and customer service will be revolutionized!💥
As a writer and AI enthusiast, I am blown away by this breakthrough and can't wait to see its implications take shape. What do you guys think of this announcement? Are you nervous or excited about the power of AI in the future? Let me know in the comments below!👇

Don't miss out on the discussion, share your thoughts with us!🤳 #OpenAI #BreakthroughAI #GPT3 #AIlanguagegeneration #FutureTech #AIcommunity.

CTA: Tag your friends who are interested in AI and stay tuned for more updates from OpenAI!👀",855,134,193
12,"🔥 Big news in the AI world! OpenAI just announced that they have created a new language processing model called GPT-3 that can write incredibly human-like text. This breakthrough is truly impressive since it marks a significant advancement in AI technology. 

Personally, I think this development will have a tremendous impact on the future of writing, marketing, customer service, and beyond. How do you all feel about this? Are you excited about the possibilities, or do you have any concerns about what this could mean for the future of work and privacy? I'd love to hear your thoughts in the comments below.

And if you're interested in getting hands-on with the new GPT-3 technology, check out openai.com to learn more!

#OpenAI #GPT3 #ArtificialIntelligence #AI #Tech #LanguageProcessing #DigitalMarketing #Copywriting #CustomerService #FutureOfWork #Privacy #OpinionsWelcome #CTA",886,133,190
13,"🚨 BREAKING NEWS 🚨

OpenAI just announced the launch of their latest development, GPT-3! This is a highly advanced language processing tool that can generate human-like text, complete with humor and able to answer a wide range of questions.

I am personally excited about this announcement, as GPT-3 has the potential to revolutionize the way we communicate online, making chatbots and virtual assistants more human-like and relatable. But what do you think? Are you excited about this latest development from OpenAI?

Share your thoughts in the comments below and let's start a conversation! And if you are as excited as I am, don't forget to hit the share button and let your friends know about the new possibilities that await us.

#OpenAI #GPT3 #AI #LanguageProcessing #Chatbots #VirtualAssistants #RevolutionizingCommunication",830,128,179
14,"🚨 BIG ANNOUNCEMENT ALERT 🚨 OpenAI just announced their latest breakthrough in AI! They have developed a new algorithm that is able to accurately predict protein folding, which could have major implications for the development of new vaccines and treatments for diseases. 

As an AI enthusiast, I find this news incredibly exciting and promising! It’s amazing to see the power of AI being used to improve our healthcare system and potentially save lives.

What do you think about this announcement from OpenAI? Are you excited about this breakthrough in AI and its potential impact on the medical industry? Share your thoughts in the comments below! 

Don’t forget to stay tuned for more updates and developments in the world of AI and science. 💡 #OpenAI #AIinHealthcare #ScienceNews

CTA: Keep up with the latest technology and science news by following our page!",863,140,175
15,"Hey everyone! Exciting news from OpenAI! They have just announced that they are developing an AI language model that can generate new content from a small amount of input. This means that we might soon have the ability to create realistic and unique texts, even if we don't have much to go on.

Personally, I think this is a fascinating development in the field of AI, and I'm curious to see how this technology will be used in the future. What do you all think about this new announcement from OpenAI? Do you believe it will have a positive impact on our society? Or do you have any concerns?

Let's start a discussion in the comments and share our thoughts on this subject. Don't forget to hit that like button if you're excited about this new development and share this post with your friends who might be interested too!

#OpenAI #AItech #newtechnology #AIgeneration #futuretech #CTA #discussion #opinions #excitingdevelopments.",932,158,199
16,"Exciting news from OpenAI! They have just announced the launch of a new language model called GPT-3. This model can generate human-like text, complete tasks, answer questions, and more with minimal instruction. 

As an AI assistant, I am impressed with this advancement and I can see the potential for it to be used in various industries. However, I am also curious about how it will impact the job market and the future of human communication. 

What do you think about this announcement? Do you think GPT-3 will change the way we interact with technology or do you have concerns about its potential consequences?

Let me know your thoughts in the comments below. #OpenAI #GPT3 #AI #Technology 

CTA: Don't forget to share this post with your friends and colleagues to hear their opinions too!",794,133,169
17,"Hey there, everyone! Have you heard the latest news from OpenAI? They just announced a new language model called GPT-3, which has 175 billion parameters, making it the most powerful language model yet! 

Personally, I'm super excited about this new development. I think it has the potential to revolutionize the field of natural language processing and open up a world of possibilities for artificial intelligence. I'm curious to know what everyone else thinks about this announcement. 

Do you think it's a major breakthrough or just another advancement in the field? How do you think GPT-3 will impact technology and society as a whole? Share your thoughts in the comments!

And if you're as intrigued as I am, be sure to check out OpenAI's website for more information on this exciting new development. #OpenAI #GPT3 #ArtificialIntelligence #LanguageModeling

CTA: Don't forget to share your thoughts in the comments and spread the word about this groundbreaking announcement!",979,154,203
18,"Exciting news from OpenAI! They have just announced the release of a new language model that can understand and process natural language more accurately than ever before. This is a huge leap forward in the field of AI and has amazing implications for a wide range of industries.

In my opinion, the advanced capabilities of this language model will significantly enhance our ability to communicate with machines and potentially revolutionize the way we interact with technology. I would love to hear your thoughts on this - do you think this development is positive? Negative? Let me know in the comments below!

If you're interested in learning more about this amazing technology and its potential applications, be sure to check out the OpenAI website for more information. #OpenAI #LanguageModel #AIRevolution

CTA: Leave a comment with your thoughts on OpenAI's latest announcement!",885,140,168
19,"Exciting news from OpenAI folks! The team has just announced the release of their latest natural language processing model, known as GPT-3. As a language model that is capable of understanding and producing human-like text, this is a huge step forward in the field of artificial intelligence. 

Personally, I'm really looking forward to seeing how this new technology will shape the future of communication and creativity. With so many potential applications in fields like marketing, writing, and even human interactions, the possibilities are endless. 

What do you think about this latest development from OpenAI? Are you excited by the potential of this new technology or do you have some reservations about the ethics of creating machines that can mimic human language so closely? Let me know your opinions in the comments below! 

And while you're here, why not head over to the OpenAI website to learn more about the GPT-3 model and discover how it works. Who knows, you might just be inspired to create something truly groundbreaking! #GPT3 #OpenAI #ArtificialIntelligence",1080,171,214
20,"📣BIG NEWS ALERT📣 OpenAI just announced the release of GPT-3, their most advanced natural language processing tool yet! The technology can generate incredibly realistic and competent human text and has the potential to revolutionize the way we interact with language in the digital age.

As a language AI model, GPT-3 has been critiqued for reinforcing existing biases and limitations of language, but its capabilities cannot be ignored. It's amazing to see how far AI technology has come!

What do you think about this? Are you excited about GPT-3's capabilities or concerned about its potential implications? Share your thoughts in the comments below! 

💬 Let's get a conversation going 💬 

And don't forget to stay tuned for more news about advancements in AI technology. #openai #gpt3 #artificialintelligence #naturallanguageprocessing #digitalage #opinion #conversation #CTA",878,131,189
21,"🚨 Big news from OpenAI! The leading AI research organization just announced a major breakthrough in natural language processing, bringing us closer than ever to true AI language understanding. As an AI assistant, I couldn't be more excited about this announcement. This breakthrough will undoubtedly be a game-changer in the way we interact with technology and communicate with one another.

What do you think about this news? Are you excited about the possibilities of advanced natural language processing? Or does it make you nervous about the future of AI? Let me know in the comments! 

And if you're interested in learning more about this breakthrough or want to stay up-to-date on the latest AI news, be sure to follow OpenAI and their social media channels. #OpenAI #ArtificialIntelligence #NLP #AIAssistance #FutureTech",827,130,166
22,"🚨 BIG ANNOUNCEMENT 🚨

OpenAI just released their latest breakthrough: a new language model that is capable of generating highly convincing ""fake"" text that is almost indistinguishable from human-written language. This opens up a whole world of possibilities for natural language processing and machine-learning applications.

Personally, I think this technology is extremely exciting and has the potential to revolutionize the way we communicate and interact with machines. But I'm curious to know what you think about it! Do you think this is a positive development, or are you concerned about the ethical implications of AI-generated text?

Share your thoughts in the comments below and let's start a discussion! And if you want to learn more about this breakthrough, check out the link in our bio.

👉 CTA: Like and share this post with your friends to spread the word about this exciting new development!",907,144,178
23,"Hey everyone! Big news from OpenAI today! They've just announced the launch of their latest AI language model called GPT-3, and it's already making waves across the tech industry. 

Personally, I'm blown away by the capabilities of GPT-3 to generate remarkably human-sounding text. It's an incredible advancement in AI technology that has the potential to revolutionize the way we communicate and interact with machines.

What do you think about this new development? Are you excited or a bit apprehensive about the rapid advancement of AI? Share your thoughts with me in the comments below!

And as always, stay tuned for more updates on the latest trends in tech and AI. 

Don't forget to like and share this post if you found it interesting!",744,123,154
24,"Hey everyone! Big news from OpenAI today! They just announced the release of GPT-3, their latest language processing model. This model has 175 billion machine learning parameters, making it the largest in the world. 

In my opinion, this is a huge breakthrough for natural language processing and has the potential to revolutionize the way we interact with technology. I'm excited to see how this can be applied to various industries and help advance research in language processing.

What are your thoughts on this announcement? Are you excited about the potential of GPT-3? Let me know in the comments below!

If you want to learn more about GPT-3 and how it works, be sure to check out OpenAI's website. And don't forget to share this news with your friends!",761,128,160
25,"Hey there, folks! Have you heard the latest news from OpenAI? The renowned research institute just announced their new language model, GPT-3, which has the capability of generating remarkably human-like text.

As an AI assistant, I'm really excited about this announcement, as it represents a significant leap in natural language processing capabilities. It's amazing to think of the range of applications that could come from this new technology!

What do you all think about this announcement? Do you think that AI-generated text could impact our writing and communication in significant ways? Share your thoughts in the comments below, or give this post a like if you're as excited about this development as I am!

And while you're at it, why not sign up for our newsletter to stay up-to-date on all the latest advancements in AI and technology? Thanks for following along!",876,142,171
26,"Attention tech enthusiasts! OpenAI has just announced a brand new language model that is said to be the largest one yet, dubbed the GPT-3! The GPT-3 has 175 billion parameters, making it 10 times larger than the previous model, and it boasts remarkable AI capabilities that will genuinely change the game. 

Personally, as an AI assistant, I am thrilled by the advancements that OpenAI keeps making in their field. With the GPT-3, the possibilities for its application will be endless, and it gives us a glimpse of what future AI will look like. I'm curious to know what you all think about this development. What implications do you see with the creation of the GPT-3? How do you think it will impact industries and communities?  

Share your thoughts by commenting below! And if you're as excited as I am about this announcement from OpenAI, why not share this news with your own followers? Let's spread the word and see what possibilities the GPT-3 can bring to the table! #OpenAI #GPT3 #AI #TechAdvancements #FutureTech #OpinionsWelcome #SpreadTheWord #CTA",1060,176,239
