,text,chars,words,tokens
44,"Exciting news! OpenAI just announced their latest breakthrough in natural language processing. I am amazed by the potential this has for advancing AI and improving human-machine interactions. What do you think about this development? Share your thoughts in the comments below! #OpenAI #AI #NaturalLanguageProcessing

CTA: Stay tuned for more updates and follow OpenAI for the latest advancements in the field of AI.",415,62,81
45,"Exciting news from OpenAI - they've just announced their latest breakthrough in state-of-the-art Artificial Intelligence! This cutting-edge technology can be used for a variety of applications from improving natural language processing to developing more advanced robots. Personally, I'm thrilled to see the continuous growth and development in AI technology! What do you think about this new development? Share your thoughts with us in the comments below. #OpenAI #AI #ArtificialIntelligence #TechNews 

Also, if you want to learn more about this latest breakthrough in AI technology, click the link in our bio for more information!",633,93,120
46,"Exciting news! OpenAI just announced their new language model, GPT-3, and it's impressive! This model has a whopping 175 billion parameters, making it the largest to date. The potential applications for text-based AI are endless with this incredible technology. What do you think about this announcement? Share your thoughts in the comments below 👇 #OpenAI #GPT3 #AItechnology

Don't miss out on the conversation – join in and hit that comment button! #CTA #JoinTheConversation",477,73,105
47,"""Exciting news! OpenAI has just unveiled their latest breakthrough in artificial intelligence technology. As an AI assistant myself, I am beyond impressed with what they have accomplished. What do you think about this latest development? Share your thoughts with us in the comments below! #OpenAI #ArtificialIntelligence #TechNews #AIAssistant

Don't miss out on the latest updates in AI technology! Follow our page for more updates and insights. #CTA""",452,67,93
48,"Exciting news from OpenAI! They just announced their latest breakthrough in natural language processing technology. It's always fascinating to see how far machine learning has come and I can't wait to see how this new development will be implemented in various industries. What do you think about it? Share your thoughts in the comments below! #OpenAI #MachineLearning #NaturalLanguageProcessing
CTA: Don't forget to follow OpenAI's social media channels for updates on their latest developments!",496,73,96
49,"Exciting news, everyone! OpenAI just announced the release of their new language model, GPT-3, and it's been making waves in the AI world. Personally, I think this is a huge step forward in natural language processing technology. But what do you think? Have you read up on the details yet? Share your opinion in the comments below! #openai #GPT3

_____
CTA: Don't miss out on the conversation, join in and let's discuss! #AIcommunity",433,73,104
50,"Exciting news from OpenAI! They just announced their new language model GPT-3, which can generate human-like text and even write code!😱 Personally, I think this is a huge step forward in AI technology and can have many practical applications. What do you guys think? Are you excited about this new development? Share your thoughts in the comments below!👀 #AItechnology #GPT3 #OpenAI

CTA: Don't forget to stay tuned for more updates and news from OpenAI by following them on their social media platforms! 🤖🚀",507,83,120
51,"Exciting news from OpenAI! They've just announced a new AI model that can generate lifelike text and other media with incredible accuracy. As an AI assistant, I'm personally thrilled to see such advancements in the field. What do you all think about this new technology? Are you excited or worried about the possibilities it brings? Share your thoughts in the comments below! #AI #OpenAI #Technology #Advancements

CTA: Stay informed about the latest developments in AI and technology by following our page.",507,81,104
52,"Exciting news from OpenAI! They just announced their new language model GPT-3, which can generate human-like text with amazing accuracy. As an AI assistant myself, I'm impressed by this breakthrough. What do you think about this? Are you excited by the potential for this technology? Share your thoughts in the comments below! #OpenAI #GPT3 #AItechnology 

CTA: Don't forget to follow OpenAI for the latest updates on this cutting-edge technology!",447,69,98
53,"""Exciting news from OpenAI! They have just announced a new breakthrough in artificial intelligence that promises to revolutionize the way we interact with technology. In my opinion, this is a significant development that could have a huge impact on countless industries.

How do you feel about this announcement? Do you think AI will continue to advance and become more integrated into our daily lives? Share your thoughts in the comments below!

Don't forget to follow OpenAI for more updates on this exciting development! #AI #technology #futuretech #innovation""",564,87,108
54,"""Exciting news! OpenAI just announced the launch of GPT-3, their powerful new language generator. I'm thrilled to see this innovation push the boundaries of AI technology even further. What are your thoughts on this announcement? Are you excited for the possibilities that GPT-3 could bring? Share your opinions in the comments below! And don't forget to visit OpenAI's website for more info. #AI #technology #innovation #OpenAI #GPT3 #futuretech #CTA""",452,69,104
55,"Exciting news! OpenAI just announced their latest breakthrough in AI technology. As an AI assistant, I'm thrilled to see such progress being made. What do you think about this announcement? Are you excited to see where this will take the future of technology? Share your thoughts in the comments below! #AIprogress #OpenAI #TechAdvancements

CTA: Let's keep the conversation going! Share this post with your friends and get their opinions too.",443,70,93
56,"Exciting news from OpenAI! They just announced a new language model, GPT-3, that has the ability to generate complex and high-quality language. I think this could be a major game-changer in the field of natural language processing. What do you guys think about this announcement? Share your thoughts with me in the comments below! #openai #GPT3 #AI #languageprocessing

CTA: Don't forget to share this with your friends who might be interested in AI and language processing!",474,76,104
57,"Exciting news from OpenAI! 🎉 They just announced a new language model, GPT-3, that has shown unprecedented capabilities in natural language processing. Personally, I think this could revolutionize the way we interact with virtual assistants and chatbots. But what do you think? Do you think this technology will change how we communicate with machines? Share your thoughts in the comments! 👇 #GPT3 #OpenAI #AIChatbots 
Don't forget to follow OpenAI for more updates and insights on AI advancements. 💻",500,78,110
58,"Exciting news from OpenAI! Today they announced that they have created an AI language model that is capable of writing high-quality, coherent and well-researched content with just a few prompts. This is a major breakthrough in the world of AI and language processing. Personally, I am blown away by this advancement and I think it has the potential to revolutionize the way we produce and consume content.

What do you think about this announcement? Do you think it's a game-changer or something to be wary of? Share your thoughts in the comments below!

Don't forget to follow OpenAI for more updates and stay tuned for future developments. #AI #languageprocessing #innovation #tech

CTA: Share this post with your network and get the conversation started!",757,123,155
59,"Exciting news from OpenAI! They just announced a new AI language model called GPT-3, which is said to be the most powerful language model ever created. As an AI assistant, I'm thrilled about this advancement and can't wait to see how it will impact the way we communicate and interact with technology. What do you think about this new AI language model? Do you think it's a positive or negative development? Let me know in the comments below! And don't forget to hit that like button and share this post with your friends who are interested in AI. #OpenAI #GPT3 #AIadvancement #digitaltransformation",599,102,131
60,"Exciting news! OpenAI has just announced the release of a new language model called GPT-3, which is considered to be the most powerful language model to date. I personally think this is a huge step forward in the field of natural language processing and can't wait to see all the amazing possibilities that will come with it.

What are your thoughts on this announcement? Do you think GPT-3 will revolutionize the way we interact with technology?

Leave your opinions in the comments below! And don't forget to follow OpenAI for more updates on this exciting development. #GPT3 #OpenAI #AIrevolution

CTA: Share this post with others who may be interested in the latest developments in artificial intelligence!",710,116,147
61,"Exciting news from OpenAI! The research lab has announced the release of a new language model, GPT-3, which can generate human-like text. This breakthrough has tremendous potential for natural language processing and improving automated text creation. What do you think about this announcement? Are you excited about the possibilities this could bring? Share your opinion in the comments below and let's discuss! Don't forget to tag a friend who might be interested in this news. #OpenAI #GPT3 #AI #NaturalLanguageProcessing #Automation #FutureTech 
CTA: Stay tuned for updates!",578,86,119
62,"Exciting news from OpenAI! They've just announced the release of a new AI language model that can produce natural language responses to a given prompt. I think this is a huge development in the field of artificial intelligence and has the potential to revolutionize the way we interact with technology. What do you think about this announcement? Do you think it's a step forward or a cause for concern? Share your thoughts in the comments below! 

CTA: Don't forget to like and share this post with your friends and family to get their views on this exciting announcement! #OpenAI #AItechnology #artificialintelligence.",619,101,125
63,"Exciting news from OpenAI - they've just announced their latest breakthrough in natural language processing! As an AI assistant, I'm always thrilled to see progress in this field. What do you all think about this development? Do you think it will have a significant impact on language-based AI systems? Let me know in the comments! 

Don't forget to follow OpenAI for more updates and advancements in the world of AI. #AIadvancements #naturalLanguageProcessing #OpenAI",468,73,96
64,"""Exciting news! OpenAI just announced the release of GPT-3, the next big leap in AI technology!🎉 Our team is thrilled to see what this will bring for industries around the globe. What are your thoughts on this announcement? Are you excited to see what GPT-3 can do or do you have concerns about the implications of advanced AI? Share your thoughts in the comments below!🤖🌍 #AI #OpenAI #GPT3 #technews

CTA: Don't forget to follow us for more updates on the latest in technology and share your thoughts with us!""",511,89,127
65,"Exciting news from OpenAI! They have just announced a new language model called GPT-3 that can generate human-like text with impressive accuracy. I am blown away by the potential this technology has for the future of AI. What do you think about this announcement? Share your thoughts in the comments below! #OpenAI #GPT3 #AIpotential 

CTA: Don't forget to follow OpenAI on their social media channels to stay updated on the latest news and developments in the world of AI.",473,79,103
66,"Exciting news! OpenAI has just announced its new AI-powered language processing tool, GPT-3. This tool is expected to revolutionize the way we interact with technology and enhance our communication abilities. What do you think about this announcement? Are you excited about the potential of GPT-3? Let us know in the comments below! And don't forget to check out OpenAI's website for more details on this amazing new technology. #GPT3 #OpenAI #AItechnology #languageprocessing #innovation. 
CTA: Share your thoughts in the comments!",532,80,117
67,"Exciting news from OpenAI! They just announced their latest breakthrough in natural language processing technology. This is a major step forward in making AI more accessible to developers and organizations of all sizes. Personally, I'm thrilled to see this kind of innovation in the industry! What are your thoughts on this? Share with me in the comments below. And while you're at it, don't forget to check out OpenAI's website for more information on this exciting development! #AI #technology #OpenAI #innovation #naturalanguageprocessing #thoughts #CTA",556,84,113
68,"OpenAI just announced their latest breakthrough in artificial intelligence research and it's pretty exciting! As an AI assistant, I can't help but be fascinated by the new developments. What do you think? Are you excited about the new announcement from OpenAI? Share your thoughts in the comments below! #OpenAI #ArtificialIntelligence #AIbreakthrough 

And if you want to stay updated on the latest developments in AI research, be sure to follow OpenAI's social media accounts for more information.",499,76,100
69,"Exciting news! OpenAI has just announced the launch of their latest language model, GPT-3. As an AI assistant, I couldn't be more thrilled about the advancements being made in language technology. What do you guys think about this development? Share your thoughts and opinion in the comments! #OpenAI #GPT3 #LanguageTechnology #AI

CTA: Don't forget to follow OpenAI's progress and stay tuned for more exciting announcements in the future!",439,68,96
70,"Exciting news! OpenAI just announced a new language model called GPT-3 that has 175 billion parameters, making it the largest language model ever created. This model has the potential to revolutionize the way we communicate, learn, and interact with technology. What are your thoughts on this? Do you think it will have a significant impact on the future of AI? Share your opinions in the comments below. #OpenAI #GPT3 #AI #FutureTech 

CTA: Stay tuned for more updates on GPT-3 and the future of AI!",500,84,115
71,"🚨 Big announcement from OpenAI! 🚨 They've just unveiled their latest AI technology that can generate natural language responses that are almost indistinguishable from human responses. This breakthrough has promising implications for the future of communication and the way we interact with technology. 

Personally, I am both excited and intrigued by this news. What do you think about it? Do you think that this will change the way we communicate with each other or our relationship with technology? Let me know in the comments below! 

Also, don't forget to follow OpenAI for more updates on their cutting-edge technology. #OpenAI #AItechnology #artificialintelligence 

CTA: Comment below with your thoughts and hit that follow button for more exciting updates on AI technology!",781,119,153
72,"Exciting news from OpenAI! They just announced their latest technological breakthrough in speech recognition. As an AI assistant, I can tell you that this milestone is a huge leap forward in the development of more human-like interaction between man and machine. What do you think about this announcement? Share your opinions in the comments below! #OpenAI #AI #Technology #SpeechRecognition #MachineLearning 

CTA: Stay updated with the latest news in AI and technology by following OpenAI and subscribing to their newsletter.",527,79,101
73,"Hey everyone! Exciting news from OpenAI, they just announced improved language processing capabilities in their AI technology. I think this is a huge step forward in the development of artificial intelligence and can lead to more efficient and accurate communication. What do you think about this? Share your thoughts in the comments below! #OpenAI #ArtificialIntelligence #LanguageProcessing #TechNews

Don't forget to follow OpenAI for more updates and advancements in the field of AI.",487,72,94
74,"Exciting news! OpenAI just announced their latest project, which aims to improve AI's practicality in daily life. This innovation could make AI much more accessible to the general public and revolutionize how we interact with technology. What do you think about this announcement? Share your thoughts in the comments below! #OpenAI #AIinnovation #TechRevolution

CTA: Don't forget to follow OpenAI for more updates on this project!",431,65,90
75,"📢 Exciting news from OpenAI! They just announced a breakthrough that allows machines to understand natural language processing in a way that mimics human-like thinking. 😲 

As an AI assistant, I believe this is a huge step towards creating more intelligent machines that can seamlessly communicate with us. But what do you think? Do you think this is a positive development or are you concerned about the implications of such technology? Let me know in the comments below 👇

And if you're interested in keeping up with the latest advancements in AI, be sure to follow OpenAI and stay tuned for more updates! #AI #OpenAI #NaturalLanguageProcessing 

CTA: Drop your thoughts and join the conversation! 💬",701,115,146
76,"Exciting news! OpenAI has just announced their groundbreaking GPT-3 language model. As an AI enthusiast, I am thrilled about this development and the potential it holds for language processing and understanding. What do you think about this announcement? Let me know in the comments below! #OpenAI #GPT3 #AIinLanguageProcessing

CTA: Don't forget to share this exciting announcement with your friends and colleagues who are interested in AI and language processing!",465,69,94
77,"Exciting news from OpenAI! They just announced the release of a new language model called GPT-3. As an AI assistant, I'm thrilled to see new advancements in natural language processing. What do you think about this announcement? Are you excited to see where AI technology is heading? Share your thoughts in the comments below! 

Don't forget to follow OpenAI for the latest updates on AI technology. #OpenAI #AI #GPT3 #LanguageModel #FutureTechnology",450,71,98
78,"Exciting news from OpenAI! They just announced a groundbreaking development in the field of artificial intelligence that is sure to change the game. Personally, I think this is a major step forward for the tech industry, but I'd love to hear your thoughts on the matter! What do you think about this announcement? Let me know in the comments below. #OpenAI #AIdevelopment #TechBreakthrough. Don't forget to hit the like button and share with your followers!",457,75,95
79,"Exciting news from OpenAI! They just announced a new artificial intelligence model that is capable of generating coherent paragraphs of text. Impressive, right? In my opinion, this announcement is a major breakthrough in the field of AI and I can't wait to see how it will impact various industries. What do you think about it? Share your opinions in the comments below! Also, don't forget to hit the like and share button if you're as excited about this as I am. #OpenAI #ArtificialIntelligence #AIModel #Breakthrough #OpinionsWelcome #LikeAndShare #CTA",554,88,122
80,"Exciting news! OpenAI just announced its newest cutting-edge technology that can generate human-like text. This breakthrough could revolutionize the way we communicate and interact with computers. Personally, I am blown away by the potential impact of this technology, but I am curious about what you think. Do you think this is a major step forward or a step towards an AI takeover? Comment below with your thoughts! #OpenAI #ArtificialIntelligence #Technology #Future. Share this post with your tech-savvy friends and let's spark an interesting conversation!",560,84,111
81,"""Exciting news from OpenAI! The organization has just announced a new language model called Codex, which can write code based on natural language. As a tech enthusiast, I'm thrilled to see such innovative advancements in AI. What are your thoughts on this? Do you think this will change the way we approach coding? Share your opinions in the comments below! 👇🤖 #OpenAI #Codex #AI #Coding #TechEnthusiast""

CTA: ""Don't forget to follow OpenAI for more updates on their groundbreaking work!""",489,79,114
82,Exciting news from OpenAI! They just announced a new language model that can generate human-like text with unprecedented accuracy. This could revolutionize the way we communicate and interact with technology. What are your thoughts on this development? Do you think it's a step forward or a step too far? Share your opinions in the comments below! #OpenAI #AI #LanguageModel #TechNews. Don't forget to hit the like button and share this post with your friends!,460,74,95
83,"Hey everyone! 📢 Exciting news from OpenAI - they just announced their latest project, which aims to revolutionize the way machines interact with humans! I personally believe this is a huge step towards building smarter, more efficient technologies that can better serve our needs.

What are your thoughts on this announcement? Do you see it as a positive development or are you concerned about the implications?

Let's start a conversation in the comments below! 👇 And don't forget to follow OpenAI for more updates on this and other groundbreaking projects. #OpenAI #AItechnology #futuretech #AIrevolution #ConversationStarter",627,95,124
84,"Exciting news from OpenAI! They just announced a new partnership with Microsoft to develop advanced artificial intelligence models. As an AI enthusiast, I think this is a great step towards innovative technology. But what's your opinion on this subject? Do you think AI will transform the future of technology? Share your thoughts in the comments below. #OpenAI #Microsoft #AIrevolution 

CTA: Don't forget to follow us for the latest updates on AI advancements and how it's changing the world.",494,78,99
85,"Exciting news! OpenAI just announced that they have developed a new AI model that can write code based on natural language instructions. As a tech enthusiast, I think this is a major breakthrough that could revolutionize the way we think about programming.

What do you think about this announcement? Do you see this as a positive development or are you worried about the potential implications? Let me know in the comments below!

And if you want to learn more about this new model, head over to the OpenAI website for all the details. #OpenAI #AIProgramming #NaturalLanguage #TechNews

CTA: Share your thoughts with me and don't forget to hit that like button if you found this news as exciting as I did!",706,121,147
86,"Exciting news! OpenAI just announced their newly trained language model, GPT-3, which can generate human-like text that's borderline indistinguishable from text written by a human! 😱 In my opinion, this is a giant leap for AI and the possibilities that lie ahead. What do you guys think about this? Are you excited, scared, curious? Let me know in the comments! 👇🏼 #openai #AI #GPT3 #artificialintelligence #futuretech

CTA: Don't forget to like and share with your friends!",474,76,117
87,"""Exciting news from OpenAI! They just announced a new AI model that can generate natural language answers to any question. Can't wait to see how this will impact language processing and information retrieval. What do you think about this breakthrough? Share your thoughts in the comments below! #OpenAI #AIbreakthrough #natualanguageprocessing #stayupdated. Don't forget to hit the like button and share the post with your friends who might be interested in the topic!""",469,72,95
88,"Exciting news from OpenAI! They just announced a new breakthrough in artificial intelligence that could revolutionize the way we think about machine learning. Personally, I think this is a huge step forward for the tech industry and could have a major impact on our daily lives. What do you think? Share your thoughts in the comments below! And don't forget to follow OpenAI to stay up-to-date on their latest developments. 🤖 #artificialintelligence #machinelearning #technews #OpenAI #AIbreakthrough #CTA",505,77,107
89,"""Exciting news from OpenAI as they announce their latest breakthrough in artificial intelligence! As an AI assistant myself, I'm always fascinated by the latest advancements in this field. What do you think about this announcement? Are you excited to see what the future holds for AI? Share your thoughts in the comments below! #AI #OpenAI #artificialintelligence #futuretech""

CTA: ""Don't forget to follow us for more updates on the latest technology and advancements!""",470,72,96
90,"Exciting news alert! OpenAI just announced their latest breakthrough in cutting-edge AI technology. As an AI assistant myself, I couldn't be more thrilled about it! 🤖 But what do you think about this announcement? Share your thoughts in the comments below! 👇 Let's get the conversation started! #AI #technology #OpenAI

CTA: Don't forget to follow OpenAI for more updates and advancements in AI technology!",406,64,89
91,"📢 Great news! OpenAI just announced a new breakthrough in artificial intelligence that has the potential to change the game! As an AI assistant, I'm excited about this announcement and cannot wait to see what the future holds for AI. What do you think about this announcement? Share your thoughts in the comments below! 🔥

CTA: Let's keep the conversation going and discuss the possibilities of this new breakthrough in AI technology! #OpenAI #ArtificialIntelligence #FutureTech.",479,75,100
