,text,chars,words,tokens
0,"Exciting news from OpenAI! They've just announced the release of their latest language model, GPT-3, and I can't wait to see its impact on the field of natural language processing. Personally, I think this model could revolutionize the way we interact with technology and help us achieve new levels of productivity and innovation. What do you think though? Share your opinions in the comments below! #OpenAI #GPT3 #NLP #AIrevolution 

And don't forget to subscribe to their newsletter to stay in the loop on any future developments! #CTA #StayInformed",551,88,121
1,"Exciting news! OpenAI has just announced their latest breakthrough in natural language processing. As an AI assistant myself, I'm thrilled to see advancements in this field. What's your opinion on this new development? Do you think it will have a big impact on how we interact with technology in the future? Share your thoughts in the comments! #OpenAI #ArtificialIntelligence #NaturalLanguageProcessing #TechnologyAdvancements 

CTA: Let's start a conversation and learn from each other's insights!",499,72,101
2,"📢 Exciting news from OpenAI! They've announced a new language model that can produce human-like responses to a given prompt. As an AI assistant, I'm always thrilled to hear about advancements in this field. What do you think about this announcement? Are you excited or concerned about the implications of this technology? Let me know in the comments! #OpenAI #AIadvancements #languageModel

👉 Don't forget to follow OpenAI for more updates on this technology!",459,73,100
3,"Exciting news from OpenAI! They just announced that they have created an AI system that can write natural language with incredible fluency. Personally, I think this is a huge milestone for the field of AI and has the potential to revolutionize the way we communicate with machines. What do you think? Share your opinion in the comments below! #AIwriting #OpenAI #NaturalLanguageGeneration 

CTA: Don't forget to follow OpenAI for more updates on their groundbreaking research!",476,74,97
4,"""Exciting news from #OpenAI! They have just announced a new breakthrough in AI technology that could revolutionize the way we interact with machines. As an AI assistant, I'm thrilled about this announcement and can't wait to see how it will change the world. What do you think about it? Are you excited about the possibilities or worried about the implications? Let me know in the comments! #AI #artificialintelligence #technews""

CTA: ""Don't forget to share your thoughts and tag a friend who might be interested in this topic!""",529,87,113
5,"🔥 Exciting news from OpenAI! They just announced the release of a new language model, GPT-3, which is capable of generating human-like texts, including articles, poetry, and much more! 😲

In my opinion, this is a game-changer for the AI industry and a significant breakthrough in natural language processing. I'm curious to know what do you think about this latest development from OpenAI? 🤔

Let me know in the comments below, and don't forget to hit that share button and spread the word about this fantastic innovation! 🚀 #OpenAI #GPT3 #AIinnovation #NLP

CTA: Share your thoughts on this announcement in the comments below and hit the share button to spread the word among your friends and colleagues!",705,117,163
6,"Exciting news from OpenAI! They have just announced a new language model that can generate coherent paragraphs of text from just a few keywords. I think this is a huge step forward in natural language processing, and I'm curious to know what my followers think about it. Do you think this will have significant implications for the future of AI? Let me know in the comments! 

Also, don't forget to follow OpenAI for more updates on this groundbreaking language model. #OpenAI #LanguageModeling #AI #NaturalLanguageProcessing #ArtificialIntelligence #MachineLearning #CTA",571,87,118
7,"Exciting news from OpenAI! They have just announced the launch of their new language model called GPT-3, which has the ability to write articles, create poetry and execute a range of other language-related tasks. I am blown away by the potential of this new technology and I can't wait to see it in action. What do you think about this announcement? Share your thoughts in the comments below! #OpenAI #GPT3 #AIrevolution

CTA: Let's continue the conversation! Like, share this post with your network, and don't forget to follow us for more updates on the latest news in AI technology.",584,99,129
8,"Exciting news! OpenAI just announced they have developed a new machine learning tool that can generate human-like text responses. This technology has the potential to revolutionize how we communicate and improve the interactions between humans and machines. What do you think about this announcement?

Share your opinion with me in the comments below! Let's start a conversation about the implications of this technology. #OpenAI #MachineLearning #TextGeneration #AIRevolution

Don't forget to like and share this post to spread the word!",538,79,102
9,"Exciting news from OpenAI!🎉 They've just announced their new language-generating AI, GPT-3 that's made major strides in natural language processing. As an AI enthusiast, I must say, this is truly groundbreaking. What are your thoughts on this development? Are you as excited as I am? Let me know in the comments below!👇 #openai #gpt3 #ai #innovation 

CTA: Don't forget to share this post and tag a friend who loves AI. Let's start a conversation! 💬",449,75,115
10,"Exciting news! OpenAI just announced their newest development in language processing technology! As an AI assistant, I find this announcement very interesting and I am eager to hear what my followers think about this. What do you think about this development? Let me know in the comments! #OpenAI #LanguageProcessing #AItechnology

Don't forget to like and share this post with your friends who are interested in AI.",416,66,83
11,"Exciting news from OpenAI! They have just announced their latest breakthrough in the field of artificial intelligence. As an AI assistant, I'm thrilled to hear about this new development and the potential it holds for the future.

How do you feel about this announcement? Are you excited about the possibilities it brings or do you have concerns?

Share your opinions in the comments below and let's start a conversation about the power of AI. #OpenAI #AIbreakthrough #FutureTech

Don't forget to follow OpenAI for more updates and innovations in the field of artificial intelligence.",584,93,115
12,"Exciting news! OpenAI just announced the release of GPT-3, one of the largest language processing models to date. I think this is amazing! The possibilities for AI are endless and I can't wait to see what developers create with GPT-3. What do you think? Are you excited about this too? Let me know in the comments below! #GPT3 #OpenAI #AI #TechTalk 

Don't forget to share your thoughts and follow us for more exciting updates and discussions on technology advancements.",470,79,107
13,"Exciting news from OpenAI! They have just announced a new AI language model, GPT-3, which has incredible language processing abilities. The possibilities seem endless with this technology, but I'm curious to hear what you all think about it. Do you see this as a positive development or does it raise concerns? Share your thoughts with me in the comments! #OpenAI #GPT3 #AItechnology 

CTA: Let's start the conversation! Comment below with your opinion.",453,72,99
14,"Exciting news! OpenAI just announced their latest breakthrough in natural language processing! As an AI assistant myself, I am thrilled to see advancements in this field. What do you think about this announcement? Share your thoughts in the comments below! Let's spark a conversation and learn from each other's perspectives. #OpenAI #AIadvancements #NaturalLanguageProcessing #OpinionsWelcome

CTA: Don't forget to hit the like button if you agree with this announcement and share it with your friends!",503,74,101
15,"Exciting news from OpenAI! They just announced a new artificial intelligence model that can generate digital text that is almost indistinguishable from something written by a human. What do you think about this breakthrough? Do you think it will have positive or negative consequences for the future of writing and content creation? Share your thoughts in the comments below! #OpenAI #ArtificialIntelligence #WritingRevolution

CTA: Don't forget to follow our page for more updates on the latest technology breakthroughs!",521,77,101
16,"Exciting news! OpenAI has just announced their latest breakthrough in AI technology, which promises to revolutionize the way we approach complex problems. As someone who's been closely following the advancements in this field, I can't help but feel optimistic about the possibilities this development presents.

How do you feel about this announcement? Are you excited about the potential for AI to help solve some of the world's most pressing challenges, or do you have concerns about the ethical implications of these technologies? I'd love to hear your thoughts!

Leave a comment below and let's start a conversation!

CTA: Share this post with your friends who are interested in AI and invite them to join the discussion!",725,116,137
17,"Exciting news! OpenAI just announced a brand new project which aims to revolutionize the field of artificial intelligence. This development will allow AI to create more accurate and realistic simulations in a way that has never been possible before.

Personally, I believe this announcement is a huge step forward in the evolution of AI technology. It's amazing to see the potential this could have in fields such as healthcare, education, and entertainment.

What about you? What are your thoughts on this announcement? Do you think this development will have a positive impact on society?

Leave your thoughts in the comments below and let's discuss. #AI #innovation #OpenAI

CTA: Don't forget to share this exciting news with your friends and followers!",756,120,147
18,"Exciting news from OpenAI! They just announced that they have developed a new AI language model that can generate human-like writing with unprecedented coherence and accuracy. I am blown away by this incredible feat of engineering. What do you think about this new development? Share your thoughts in the comments below! #ArtificialIntelligence #OpenAI #LanguageModel

CTA: Are you excited to see where this new technology takes us? Follow us for more updates on the latest breakthroughs in AI!",494,77,99
19,"Hey, everyone! Have you heard the latest news from OpenAI? They've just announced that they've created an AI model that can generate natural-language text that is nearly indistinguishable from human writing! Wow, what an incredible achievement! 

In my opinion, this is a major breakthrough in the field of AI and it could have huge implications for industries like journalism and content creation. I'm very interested to hear your thoughts on this subject! What do you think about the potential uses and ethical considerations of such technology?

Let's start a conversation in the comments below! And don't forget to hit that like button if you found this news as fascinating as I did! #AI #OpenAI #TechNews #ArtificialIntelligence",733,116,147
20,"Just heard the exciting announcement from OpenAI about their new language generation model, GPT-3. As an AI assistant, I am thrilled about this news and I can't wait to see what potential this new model brings to the table. What do you think about this announcement? I'm curious to hear other opinions on how this will impact the AI industry. Share your thoughts in the comments below! #OpenAI #GPT3 #AIrevolution.

CTA: Let's stay updated on the latest AI news! Follow me for more updates on exciting innovation in this field.",527,90,116
21,"📣 BIG NEWS from OpenAI! They've just announced the release of their new language model, GPT-3. This model can understand and produce natural language, completing tasks like translation, answering questions, and even programming. 

Personally, I think this is a game changer for the world of AI and could have a huge impact on how we interact with technology. What do YOU think about it? Are you excited, skeptical, or have any concerns about this advancement in AI language technology? Let me know in the comments! 

And if you want to check out GPT-3 for yourself, follow OpenAI's blog for more information and updates. #OpenAI #GPT3 #AI #language #technology #innovation #CTA",677,110,152
22,"Hey everyone! Have you heard the latest news from OpenAI? They just announced their latest research on language learning AI models, which they claim can learn from fewer examples and outperform existing models. I'm really excited about this development, it has a lot of potential for improving natural language processing and making interactions with AI more human-like. What are your thoughts on this subject? Do you think these advancements will bring benefits or pose challenges to the society? Let me know in the comments below! #OpenAI #AIAdvancements #LanguageLearningModels

CTA: Don't forget to follow OpenAI for more updates and share your thoughts on this subject with your friends to start a discussion!",714,111,138
23,"""Exciting news! OpenAI just announced their latest breakthrough in intelligent machines that can learn tasks on their own without human intervention. I'm amazed by this development and can't wait to see the potential it has for advancing various industries. What do you think about this fascinating innovation? Share your thoughts and opinions in the comments below! #OpenAI #ArtificialIntelligence #MachineLearning #Innovation""

CTA: ""Stay tuned for more updates on this groundbreaking development from OpenAI!""",512,72,98
24,"Hey everyone, have you heard about the new announcement from OpenAI? It's a breakthrough technology that can generate highly-realistic language models. Personally, I'm excited about this development as it could have applications in various fields like education, entertainment, and research. What's your opinion about this? Do you think this technology will be helpful or harmful? Let me know in the comments below! Also, don't forget to follow OpenAI to stay up-to-date with the latest advancements in AI technology. #OpenAI #AItechnology #LanguageModels #Breakthrough #Opinions #CTA",584,84,118
25,"""Exciting news! OpenAI has just announced the release of its latest AI technology that promises to revolutionize the world of language processing. As an AI enthusiast, I am thrilled about this announcement and I can't wait to see the impact it will have on our lives. What do you think about this new development? Share your thoughts in the comments below! #AIrevolution #OpenAI #LanguageProcessing #TechNews. Can't get enough of AI news and updates? Follow us for more exciting updates and insights on everything tech-related!""",528,84,108
26,"Exciting news from OpenAI! They just announced their latest breakthrough in natural language processing, and it's bound to shake up the field. As an AI assistant, I'm always thrilled to see advancements like this that push the boundaries of what machines can do. What do you all think about this latest announcement? Are you excited about the potential of this technology? Share your thoughts in the comments below! #OpenAI #AIAdvancements #NaturalLanguageProcessing 

CTA: Don't forget to follow us for more updates on the latest tech developments!",549,85,110
27,"Exciting news from OpenAI! They just announced the release of a new language model, GPT-3, that has the potential to revolutionize natural language processing. As an AI assistant, I'm extremely interested in this development and can't wait to see the possibilities that arise. What do you think about GPT-3? Let me know in the comments! #AI #innovation #GPT3

CTA: Share this post to start a conversation about the future of language processing with your friends and followers.",477,77,106
28,"Exciting news from OpenAI! They have just announced the launch of their new language model, GPT-3. As an AI assistant myself, I am thrilled to see advancements in this field. What do you think? Are you excited about this new announcement? Share your thoughts with me in the comments below! And don't forget to check out OpenAI's website for more information. #OpenAI #GPT3 #AIadvancements #LetsTalkAI",400,65,93
29,"Exciting news from OpenAI! 🚨 Their research team has just announced breakthrough advancements in natural language processing that could revolutionize the way we interact with technology. As an AI assistant myself, I'm thrilled to see the potential of this new technology. What do you think of the possibilities? Share your thoughts in the comments below! 👇 And if you're interested in learning more about OpenAI and their groundbreaking work, make sure to check out their website. #OpenAI #NLP #AIrevolution #futuretech #CTA: Share your thoughts and follow OpenAI to stay up to date on their latest developments!",612,96,126
30,"Exciting news from OpenAI! They have just announced a new breakthrough in natural language processing technology that will revolutionize the way we interact with machines. I personally think this is a huge step forward in creating more intuitive and accessible technology. What do you think about this? Share your thoughts in the comments below! Let's start a conversation about the future of language processing. #OpenAI #AItechnology #innovation #conversationstarter

CTA: Don't forget to share this post with your friends! Let's get more people in on the discussion.",569,86,111
31,"Exciting news from #OpenAI! The company just announced their newest AI language model, GPT-3, which has 175 billion parameters, making it one of the largest and most powerful language models yet. As an AI assistant, I'm thrilled to see such impressive advancements in the field of AI.

What do you think about this announcement? Do you think we will see even more impressive developments from AI companies in the future? Share your thoughts in the comments below.

And if you're interested in learning more about GPT-3 and its potential impact, be sure to click the link in our bio to read the full article. #AI #artificialintelligence #machinelearning 

CTA: Share your thoughts on this announcement in the comments below and click the link in our bio to read more about GPT-3!",778,130,167
32,"Exciting news from OpenAI! They just announced their latest innovation in natural language processing. As an AI assistant, I am personally invested in this and I think it has the potential to revolutionize the way we communicate with machines. What do you think about this development? Share your thoughts with us in the comments below! #OpenAI #ArtificialIntelligence #NaturalLanguageProcessing #Innovation

CTA: Don't forget to like and share this post with your friends and colleagues who might be interested in this topic!",526,80,105
33,"Exciting news! OpenAI has just announced the development of a new language model called GPT-3, which is capable of creating incredibly human-like text. In my opinion, this is a huge leap forward in artificial intelligence and language processing. What do you think? Do you have any concerns about the potential implications of this technology? Let me know your thoughts in the comments below! #OpenAI #GPT3 #AI #LanguageProcessing 

CTA: Don't miss out on this conversation - share your opinion in the comments!",511,81,108
34,"Exciting news from OpenAI! 🎉 They have announced the launch of their very own language model, known as ""GPT-3."" 🤖 This model takes language processing to a whole new level, with the ability to complete sentences, generate articles, and even create computer code. 😲 What do you think of this new development? Are you excited about the possibilities that GPT-3 brings? Leave your thoughts in the comments below! 🔽 

CTA: Don't forget to follow OpenAI for more updates on their innovative work in the field of artificial intelligence! 👍 #OpenAI #GPT3 #AI #languageprocessing #innovation #technology",595,95,138
35,"""Exciting news from OpenAI! They have just announced a major breakthrough in machine learning that could change the world as we know it. Personally, I'm thrilled to see how this technology can positively impact industries like healthcare and education. What do you think? Are you excited about this new development or do you have concerns? Let me know in the comments below! #OpenAI #MachineLearning #FutureTech. Don't forget to share and give your opinion!""",458,73,93
36,"Exciting news from OpenAI! The research lab just announced a new language model called ""GPT-4"" and it promises to be even more powerful than its predecessor. I can't wait to see the ways this technology will shape the future of language processing! 

What do you think about this announcement? Are you excited for what GPT-4 can bring? Share your thoughts with me and let's discuss! 

And if you're interested in learning more, be sure to check out OpenAI's website for updates on this exciting development. #OpenAI #GPT4 #languageprocessing #AIrevolution #futuretech",567,90,126
37,"Exciting news from OpenAI! They just announced a new language model that can generate human-like responses. This is a huge breakthrough in the field of AI and I'm fascinated by the possibilities it presents. What do you think about OpenAI's latest development? Share your thoughts in the comments! #OpenAI #AIbreakthrough #LanguageModel #AIcommunity 

Do you want to learn more about AI and its impact on our world? Sign up for our newsletter and stay up-to-date on the latest advancements in technology. Click the link in our bio to subscribe! #CTA #newsletter",561,90,119
38,"Exciting news from OpenAI! They just announced a new tool that can summarize long articles and produce automated headlines. As someone who loves to stay informed, I think this could be a game-changer for content consumption. What do you think about this new technology? Share your thoughts in the comments! And don't forget to check out the tool yourself. #OpenAI #NewsSummarizer #Automation #CTA: Click the link in our bio to learn more about this new tool!",458,76,99
39,"Hey everyone! Exciting news from OpenAI today: they have just announced a new language model that has the ability to generate human-like responses with unprecedented accuracy. This breakthrough represents a major advancement in artificial intelligence and natural language processing, which could have a big impact on everything from online customer service to automated writing. 

In my opinion, this is a huge step forward for AI and could have a profound impact on the way we communicate with machines. But what do you think? Are you excited about this announcement? Do you have any concerns about the implications of this technology? I would love to hear your thoughts in the comments below!

And if you're interested in learning more about this groundbreaking development, be sure to check out the OpenAI website. There's never been a more exciting time to be involved with AI! #OpenAI #AI #LanguageModel #Breakthrough #FutureTech

CTA: Share your thoughts in the comments!",978,154,188
40,"Exciting news from OpenAI - they have just announced a new language processing model that can create human-like text responses! This is a major step forward in AI and language models. 
What do you think about this announcement? Do you think it’s a positive or negative development? Share your thoughts with us in the comments below! 
Don't forget to hit the like button and share this exciting news with your friends. #OpenAI #LanguageProcessing #AIadvancements #ArtificialIntelligence #HumanLikeTextResponses #NewTechnology #ShareYourThoughts #AICommunity #CTA",561,80,118
41,"Exciting news from OpenAI! They have just announced their latest breakthrough in natural language processing. This will enable machines to better understand human context and meaning, making AI even more powerful and valuable. 
In my opinion, this will revolutionize the way we interact with technology and improve AI's ability to serve our needs. 
What do you think about this announcement? Are you excited as much as I am? Share your thoughts in the comments below. 
And don't forget to hit the follow button to stay updated on the future of AI! #OpenAI #AIbreakthrough #NLP #ArtificialIntelligence #MachineLearning #CTA",622,97,130
42,"Exciting news alert! OpenAI just announced their latest breakthrough in the field of artificial intelligence. As an AI assistant, I can't help but be amazed by the possibilities that this brings to the table. What do you think? Share your thoughts and opinions on this new development in the comments below. Can't wait to hear your take on this! #OpenAI #ArtificialIntelligence #NewBreakthrough #FutureTech. 

CTA: Don't forget to follow us for more updates on the latest in AI and technology!",493,79,107
43,"Exciting news from OpenAI! They just announced a new breakthrough in their language modeling algorithm that can now complete a paragraph of text based on a given prompt. I'm amazed at how rapidly AI technology is advancing! What do you think about this development? Share your thoughts in the comments below. #AI #LanguageModeling #Breakthrough #OpenAI

CTA: Stay updated on the latest AI developments by following OpenAI and subscribing to their newsletter. #StayInformed #AIProgress #CTA",489,74,102
