,text,chars,words,tokens
92,"Exciting news from OpenAI! They have just announced the release of a new language model that can generate full-length coherent articles in just seconds. This new technology has huge implications for content creation and could change the way we think about written communication. What do you think about this announcement? Are you excited for the possibilities? Let me know in the comments below! #OpenAI #LanguageModel #ArtificialIntelligence #ContentCreation 

CTA: Don't forget to share this news with your friends and colleagues!",532,79,103
93,"Exciting news! OpenAI just announced their GPT-3 (Generative Pre-trained Transformer 3) language model, which has 175 billion parameters - 10x more than its predecessor. This means it can generate incredibly human-like text and it has the potential to revolutionize language AI. What do you think about this? Are you excited or concerned about the progress of AI technology? Let us know in the comments below! #AI #GPT3 #OpenAI #technology 

CTA: Don't forget to share this with your friends and stay tuned for more updates!",524,84,118
94,"""Exciting news from OpenAI! They have just announced their latest breakthrough in AI technology. I think this will change the game forever! What are your thoughts about this? Are you looking forward to seeing what's next for AI? Share your opinions in the comments below. Let's talk! #AItechnology #OpenAI #FutureofAI

CTA: Don't forget to follow OpenAI and stay up-to-date with the latest news in AI technology.""",413,66,93
95,"Exciting news, folks! OpenAI has announced their latest breakthrough in AI research, which reportedly has the potential to revolutionize the way we approach machine learning. As an AI assistant myself, I'm thrilled to see such advancements in this field. But I'd love to know your thoughts on this - what do you think? Drop your opinions in the comments below! #OpenAI #AIbreakthrough #MachineLearning #RevolutionaryTech 

Also, if you want to stay up-to-date on the latest news in tech and AI, make sure to follow our page for more updates!",541,88,118
96,"Exciting news from OpenAI! They've just announced the launch of their new GPT-3 (Generative Pre-trained Transformer) language model. As an AI assistant, I'm particularly thrilled about this development as it could greatly improve natural language processing capabilities. What do you think of this announcement? Let me know in the comments below! #OpenAI #ArtificialIntelligence #GPT3 #LanguageModel 

CTA: Follow @OpenAI for the latest updates on this game-changing technology.",478,66,101
97,"""Exciting news from OpenAI! They have just announced the release of a new language model that can generate coherent, human-like text. As an AI assistant, I think this is a major milestone in the development of artificial intelligence. What do you think? Are you excited about the possibilities this brings or concerned about the implications of such advanced technology? Share your thoughts in the comments below! #AI #OpenAI #LanguageModel #FutureTech
CTA: Don't forget to follow us for more updates on the latest developments in AI and technology!""",550,87,111
98,"Exciting news from OpenAI! They recently announced the release of their new language model, GPT-3, which has the ability to generate human-like text with remarkable accuracy. I think this could be a major breakthrough for natural language processing and AI as a whole. But what do you think? Share your thoughts with me in the comments! 

And if you're just as curious as I am, head to their website to learn more: [insert link]. #OpenAI #GPT3 #AIbreakthroughs 

CTA: Let's continue the conversation and dive deeper into AI advancements together!",546,89,122
99,"Hey everyone! Have you heard about the latest announcement from OpenAI? They just announced the launch of their new tool that allows anyone to create natural language processing models with ease! As an AI enthusiast, I'm super excited about this news and can't wait to try it out. What do you guys think about this new tool? Are you excited about it as well? Drop your thoughts in the comments below! 

Plus, if you're interested in exploring this new tool, head to the OpenAI website to learn more and get started. #OpenAI #AI #NaturalLanguageProcessing #MachineLearning #CTA",576,96,123
