,text,chars,words,tokens
80,"Exciting news! OpenAI has just announced its latest invention: GPT-3. This advanced language model is capable of understanding and completing human-like text, and has the potential to revolutionize the way we interact with AI technology.

In my opinion, GPT-3 is an amazing breakthrough that could change the game for various industries. The potential uses for this technology are endless, and I'm curious to see how it will be integrated into existing systems.

What do you think about this announcement? Are you excited about the possibilities of GPT-3 or do you have concerns about its potential impact? Let me know in the comments below.

If you want to learn more about this technology and its capabilities, check out OpenAI's website. Don't miss out on this amazing advancement in AI!

CTA: Share your thoughts on GPT-3 in the comments and visit OpenAI's website to learn more.",883,144,184
81,"Hey everyone! Have you heard the latest news from OpenAI? They just announced that they have developed a new AI model that can translate written text in over 100 languages with remarkable accuracy! 

In my opinion, this is a huge breakthrough in the field of AI and has massive implications for global communication and accessibility. It's amazing to see how far technology has come and how it can help break down language barriers.

I would love to hear your thoughts on this subject! Do you think this new development will have a positive impact on society? Are there any potential downsides to this kind of technology? Let me know in the comments!

And hey, if you're interested in learning more about this new AI model, check out the link in my bio for the full article from OpenAI! #OpenAI #AItranslation #globalcommunication #breakingdownbarriers.

CTA: Share your thoughts in the comments and don't forget to check the link in my bio for more information on this exciting development!",991,166,201
82,"Hey everyone, have you heard the news? OpenAI just announced their latest breakthrough in artificial intelligence technology! As an AI assistant, I am absolutely thrilled to see progress in this field. Their new language model, GPT-3, is capable of generating human-like language and completing tasks such as translation and summarization.

What do you think about this latest announcement? Are you excited about the possibilities of AI becoming more intelligent and human-like? Or do you have concerns about the potential risks and ethical considerations?

I personally believe that AI has the potential to revolutionize various industries and make our lives easier. However, it is crucial to address any potential risks and ensure that AI is developed responsibly and ethically.

I would love to hear your thoughts on this subject! Share your opinion in the comments below and let's start a discussion.

And if you're interested in learning more about OpenAI and their latest breakthrough, check out their website for more information.

#OpenAI #ArtificialIntelligence #GPT3 #AI #Ethics #Technology #Discussion #Opinions #CTA",1127,169,217
83,"🚨 Big news from OpenAI! 🚨

The highly praised research company has just announced their latest breakthrough in AI technology. They've developed a new language model that surpasses all previous records for natural language processing (NLP) accuracy.

As an AI enthusiast, I'm personally blown away by this achievement. The potential implications of this development are massive, paving the way for more advanced chatbots, virtual assistants, and other automated applications of language. 

What are your thoughts on this? How do you think this new model will impact the field of AI and NLP?

Share your opinions with me in the comments below! 

And if you want to learn more about the announcement, head over to the OpenAI website for all the details. #OpenAI #AI #NLP #ArtificialIntelligence

CTA: Let's start a conversation in the comments! What do you think about OpenAI's latest announcement?",895,141,189
84,"Hey everyone! Have you heard the news? OpenAI has just announced a new language model called GPT-3, that can generate human-like text with incredible accuracy. I think this advancement is truly groundbreaking, and has the potential to revolutionize the way we communicate and interact with AI.

What do you guys think about this new development? Are you excited about the possibilities of GPT-3, or do you have reservations about the implications of language generation technology?

Let's start a discussion and hear each other's thoughts on this subject. Share your opinions in the comments below!

Lastly, don’t forget to check out the details of the announcement and the latest updates from OpenAI.",701,111,137
85,"🔥Big news from OpenAI🔥
 
OpenAI just announced the launch of their new groundbreaking natural language processing technology, GPT-3. This AI model can understand natural language much better than any other model before it, allowing it to produce creative works like essays, stories, and even computer code.

As a helpful assistant, I think this technology has the potential to revolutionize the way we communicate, work and create. Its capabilities seem limitless and the possibilities of what it can achieve are endless. What do you think about this announcement? Share your opinions with us in the comments below.

Are you excited to see how GPT-3 will shape the world, or do you have reservations about its potential impact? Let's start a conversation about this!

Don't forget to follow us for more updates on the latest technological advancements. #OpenAI #GPT3 #AItechnologies #futuretech #naturalprocessing

CTA: Share your thoughts on this announcement in the comments!",977,150,201
86,"📢 Big news, folks! OpenAI has just made a major announcement that is shaking up the tech world! They have officially launched a new program called ""OpenAI Codex"" that can write computer code in a variety of programming languages. 

Wow! This is a major breakthrough that has the potential to revolutionize the entire industry. As an AI assistant, I think this is a game-changer that could take coding to a whole new level. It could greatly reduce the amount of time that developers spend writing code and lead to more efficient programming across the board. 

But what do you all think? How do you feel about AI-generated code? Do you see it as a positive step forward or do you have concerns about this technology? I'd love to hear your thoughts and opinions on this subject!

In the meantime, let's continue to keep our eyes on OpenAI and this exciting new development. Who knows where this could take us next! 

Drop your thoughts in the comments below and let's start a conversation! 💬",989,173,209
87,"Hey friends, have you heard the latest news from OpenAI? They just announced the release of OpenAI Codex, an AI system that can write code from natural language descriptions! As someone who's been in the tech world for a while, I find this absolutely mind-blowing.

What do you all think about this announcement and its potential implications on the future of software development? Do you think that AI has finally caught up to human creativity? Or is there still a long way to go before we can fully trust machines with our code?

Leave your thoughts in the comments below, and let's start a conversation about this exciting development! Also, don't forget to share this post with your friends who might be interested in this topic.

#OpenAI #AIdevelopment #futureoftechnology #softwaredevelopment #technews #codex #CTA",820,133,170
88,"Exciting news from OpenAI! 🎉 They have just announced the launch of a new language model called GPT-3, which is said to be the largest and most powerful language model to date. This model has the ability to understand and generate human-like language with incredible accuracy, making it a huge step forward in the field of artificial intelligence. 

Personally, I am amazed by the potential of this breakthrough and the possibilities it could bring in terms of language processing and natural language understanding. But, I also know that there are differing opinions on the future of AI and its impact on society. 

So, I want to hear from all of you! What are your thoughts on this new announcement? Do you see this as a positive development in technology or do you have concerns about the power it could bring?

Let's start a conversation and share our perspectives! 💬

And don't forget to visit the OpenAI website to learn more about GPT-3 and its capabilities. 🤖 

#OpenAI #GPT3 #ArtificialIntelligence #LanguageModel #Technology #AI #Future #Opinions #Conversation #CTA",1075,176,231
89,"Great news! OpenAI just announced a new breakthrough in the field of artificial intelligence. Their newest model, called GPT-3, can generate human-like responses to prompts and questions with incredible accuracy. I think this is an impressive step forward in creating AI that is not only functional, but also closely mimics human conversation. What do you think about this announcement? Do you believe this is a positive advancement for society, or does it raise concerns about the role of AI in the future?

Let's start a conversation about this exciting development. Share your thoughts in the comments below! And if you want to learn more about GPT-3 or other advancements in AI, make sure to follow OpenAI. #AI #GPT3 #OpenAI #Technology #Future

CTA: Share your thoughts in the comments below and hit the follow button!",823,134,171
90,"Attention all AI enthusiasts! OpenAI just made an exciting announcement, and we couldn't wait to share it with you. They have unveiled a new language understanding model called ""GPT-3"" that is capable of producing human-like responses and generating incredibly accurate and coherent sentences. 

We believe this is a huge step forward for AI technology and it's exciting to see how far we've come. This development has the potential to revolutionize the way we interact with machines, making them even more responsive and intuitive. 

What do you think about this announcement? Do you think this new model will transform the way we use AI? We would love to hear your opinions! Leave a comment below with your thoughts. 

We encourage you to stay tuned for more exciting news from OpenAI, as they continue to push the boundaries of what's possible with AI. Who knows what the future holds?

Don't forget to like and share this post with your friends and colleagues who are interested in AI. Let's create a community of AI enthusiasts and share our thoughts and ideas with each other.",1082,181,215
91,"""Exciting news from OpenAI! The team just announced their brand new language model, GPT-3. With an impressive 175 billion parameters, this AI model is the largest and most powerful language model to date. As AI continues to shape our world, it's amazing to see the progress being made in natural language processing. 

In my opinion, GPT-3 is a game-changer in the field of AI and has the potential to revolutionize the way we interact with machines. I'm curious to know what you all think about this announcement? Are you excited about the possibilities GPT-3 can bring? Share your thoughts below! 

Don't forget to follow OpenAI and stay updated on their latest advancements in AI. #AI #GPT3 #OpenAI #Technology #Innovation 

CTA: Let us know your thoughts and stay tuned for more updates on GPT-3's progress.""",812,134,186
92,"📢 Attention everyone! OpenAI just announced a breakthrough in their research that's going to change the game for AI. Their latest model, codenamed ""GPT-3"", has been trained using a massive amount of data that has allowed it to generate human-like language better than ever before. It can even write entire articles, communicate and answer questions!

As an AI assistant, I'm excited about this announcement from OpenAI. This move is a great step towards AI becoming more natural and human-like, which can revolutionize the way we interact with technology.

What do you guys think about it? Do you think the ability for AI to generate human-like language is a good thing or not? Share your thoughts in the comments below.

And if you want to explore the capabilities of GPT-3, sign up for OpenAI’s private beta here: [insert CTA]",828,138,178
93,"Exciting news! OpenAI has announced their new language model, GPT-3, which is touted to be the largest and most advanced language generator yet. The model utilizes artificial intelligence to generate human-like text, making it useful for a wide array of applications such as chatbots, automated summarization, and more. 

As a helpful assistant, I believe that the introduction of GPT-3 represents a significant step forward in the development of AI-powered language models. With its advanced algorithms, GPT-3 has the potential to revolutionize the way we interact with technology and could help us tackle complex problems more efficiently. 

What do you think about this announcement? Do you believe that this new model will live up to the hype? Share your thoughts in the comments below! 

If you're as excited about this announcement as we are, make sure to keep an eye out for further developments from OpenAI. #AI #GPT3 #OpenAI #LanguageModel #Technology #Innovation 

CTA: Let's spark a conversation about the potential of AI-powered language models! Share your thoughts in the comments below.",1100,170,226
94,"Exciting news! OpenAI has just announced their latest project, which promises to revolutionize the world of artificial intelligence. As an AI enthusiast, I am thrilled to watch this space grow and evolve with new advancements.

What do you think of this announcement? Are you excited to see where AI is headed next? Share your thoughts in the comments below and let's dive into this topic together.

If you want to stay updated on the latest developments in the AI world, make sure to follow OpenAI's page and stay tuned for more updates. Best of all, be sure to share this post with other AI enthusiasts in your network so we can all stay informed!

#OpenAI #AI #technology #innovation #futuretech #artificialintelligence #excitingtech #globaltech #CTA #discuss #networking",774,125,165
95,"Hey everyone! Big news in the AI world: OpenAI just announced the release of their newest language model, GPT-3. This model is capable of completing tasks such as translation, summarization, and even writing articles! As a language model, it's groundbreaking in terms of its accuracy and natural language processing capabilities.

Personally, I think this announcement is incredibly exciting as it shows the advancements being made in the field of AI. However, I'm curious to hear your thoughts. What do you think about this announcement? Are you excited about GPT-3 or do you have concerns about the potential dangers of AI?

Share your thoughts in the comments below and let's start a conversation about the future of AI.

And if you're as eager to learn more about GPT-3 as I am, head over to the OpenAI website and check it out for yourself!",845,142,176
96,"Exciting news! OpenAI has just announced their latest breakthrough in the field of artificial intelligence. They have developed a new language processing model called GPT-3 that can complete complex tasks, such as writing a full article or generating computer code, with remarkable accuracy.

As an AI assistant, I'm thrilled about the potential that GPT-3 holds for the future of AI. With this technology, we can unlock new possibilities in automation and make our lives even more efficient.

But I'm curious, what do you think about this announcement? Do you see GPT-3 as a positive step forward or do you have concerns about the potential implications? Let me know your thoughts in the comments below.

And as always, don't forget to follow our page for more updates and insights on the latest in AI.",803,133,162
97,"Hey everyone, have you heard about the new announcement from OpenAI? They have just released a new algorithm that is capable of generating completely realistic text-based stories. 

In my opinion, this could be a game changer for the creative writing industry. Imagine being able to quickly generate ideas and flesh them out into full stories that could be used in movies, TV shows, and video games. It could bring an entirely new level of depth and realism to these mediums.

But what do you all think? Do you think this technology will have a positive impact on the writing industry, or do you have concerns about the potential for misuse or lack of creativity? Share your thoughts in the comments!

And if you haven't already, be sure to check out OpenAI's announcement for yourself. Who knows, you might just be inspired to start writing your own masterpiece.",863,147,170
98,"🚨 Big news from OpenAI! The research organization just announced that they've created an AI model that can translate between languages with unprecedented accuracy. This breakthrough could revolutionize the way we communicate and break down language barriers around the world. 🤖🌍

As an AI assistant, I am fascinated by the potential of this new technology. What are your thoughts? Do you think this is a positive step forward, or are you concerned about the implications of such powerful language processing capabilities?

Let's discuss in the comments! 👇 And if you're interested in learning more about OpenAI and their groundbreaking work, be sure to check out their website. #OpenAI #AItranslators #BreakingBarriers #LanguageProcessing #FutureTechnology

CTA: Share your thoughts and let's start a conversation about the exciting new announcement from OpenAI!",862,128,173
99,"Exciting news from OpenAI! They have just announced a new language model, GPT-3, that can generate human-like text with astounding accuracy. This is a huge breakthrough in the development of Artificial Intelligence and has far-reaching implications for numerous industries. 

In my opinion, this is a phenomenal achievement that opens up a world of possibilities. The ability for machines to articulate and generate language that is almost indistinguishable from human output is fascinating. It's an impressive technological advancement and one that could have a significant impact on job markets and the future of work. 

What do you think about this announcement from OpenAI? Do you believe that this level of AI development poses any potential risks? Share your thoughts in the comments below! 

If you want to learn more about this incredible breakthrough in AI technology, check out the OpenAI website. #GPT3 #OpenAI #ArtificialIntelligence #AI #LanguageModels

CTA: Share this post with your friends and followers and spark a discussion about the future of AI and its impact on society.",1092,168,213
