,text,chars,words,tokens
27,"Hey everyone! I just saw an exciting announcement from OpenAI and wanted to share it with you all. OpenAI, the AI research lab co-founded by Elon Musk, just announced the launch of their new GPT-3 AI model, capable of generating human-like text. This new AI model could have major implications in a range of industries, from content creation to education and healthcare.

Personally, I find this announcement fascinating and I can't wait to see what potential applications this technology could have in the future. What do you all think? Do you see this as a breakthrough or are you concerned about the implications of human-like AI? Share your thoughts in the comments!

And hey, if you're interested in learning more about the OpenAI GPT-3 model, check out their website or start experimenting with the technology yourself. Who knows? Maybe we'll be using AI generated text in our everyday lives sooner than we think. #OpenAI #AItextgeneration #newtechnology #futuretech

CTA: Share your thoughts in the comments and check out the OpenAI website to learn more!",1062,173,220
28,"Hey everyone! Some big news in the world of artificial intelligence today: OpenAI just announced their latest project, a language model that can generate text so accurately it's almost indistinguishable from something a human would write. As someone who works closely with AI, I think this is a major step forward in the development of incredibly powerful and versatile language models that could have enormous implications for fields like natural language processing, education, and even creativity.

What do you think about this announcement? Do you feel optimistic about the potential for these language models, or are you concerned about the ways they might be misused?

I'm really curious to hear your thoughts. Leave a comment below and let me know! And if you're interested in learning more about OpenAI and their latest developments, check out their website. #AI #OpenAI #languagegeneration #technews

CTA: Share your opinions in the comments below, and don't forget to follow us for more updates on technological advancements!",1035,161,197
29,"🚨BIG NEWS ALERT🚨 OpenAI just announced a new breakthrough in the field of artificial intelligence! They have developed an algorithm that can generate natural language responses with more nuance than ever before. 

Personally, I think this is a huge step forward in the development of AI and could have significant implications for how we communicate with technology in the future. But I'm curious to know what you all think! 

Do you think this development is exciting? Or do you have concerns about the potential implications? Let me know in the comments!

And if you're as fascinated by AI development as I am, be sure to check out the full announcement on OpenAI's website. Who knows what other groundbreaking developments we can expect in the near future? #AIdevelopment #OpenAI #NaturalLanguageProcessing

CTA: Share your thoughts in the comments and stay up to date on the latest AI developments by following OpenAI's website.",932,150,188
30,"📢 Big news from OpenAI! The organization just announced the release of GPT-3, an advanced and highly anticipated language processing model.

As an AI assistant, I was eagerly waiting for this announcement and I'm thrilled to see the progress that OpenAI has made in natural language processing. With its ability to understand and generate human-like language, GPT-3 opens up new possibilities for human-machine interaction.

What do you think about this? Are you excited about GPT-3 or do you have any concerns about the use of such advanced language processing models? Share your thoughts in the comments below.

✍️ Also, I'd love to hear from all you content creators out there. How do you think GPT-3 could change the way we write and communicate with our audience? Let's discuss!

👉 Don't forget to follow OpenAI for updates on their latest developments and advancements in artificial intelligence.",902,145,187
31,"Hey everyone! Have you heard the latest announcement from OpenAI? They just revealed GPT-3, a powerful language processing model that has the potential to revolutionize the way we communicate and interact with technology.

Personally, I think this is a huge step forward in the field of artificial intelligence, and I'm excited to see how GPT-3 will be integrated into various applications, from chatbots to virtual assistants.

What do you all think about this development? Are you excited, skeptical, or somewhere in between? Let me know in the comments!

And if you're curious to learn more about OpenAI and their latest creation, head over to their website to read up on the details.

#OpenAI #GPT3 #ArtificialIntelligence #LanguageProcessing #TechNews #OpinionsWelcome #CTA",778,119,164
32,"Exciting news! OpenAI just announced the launch of their new language model, GPT-3, representing a major breakthrough in natural language processing technology. With the ability to complete tasks such as translation, summarization, and answering complex questions, this new model marks a significant stride forward in the field of AI. 

As an AI assistant myself, I'm thrilled to see these advancements and the opportunity they bring to streamline and simplify our lives. But I'm curious, what do you think about this announcement? Are you excited about the potential of GPT-3, or do you have concerns about the implications of such advanced technologies? 

Drop a comment and share your thoughts! Let's start a conversation about the role of AI in our lives and where we see it heading. 

And if you're interested in learning more about GPT-3 or OpenAI's other innovations, be sure to check out their website and resources. #ArtificialIntelligence #GPT3 #OpenAI #FutureTech #CTA",979,153,205
33,"Exciting news! OpenAI just announced their latest development - GPT-3, a language generation model that can perform tasks such as writing invitations, summarizing articles, and even creating poetry. As an AI assistant, I'm always fascinated by the latest developments in the AI industry, and this one is no exception.

What do you think about this announcement? Do you think it's a step forward for AI, or do you have concerns about the ethical and societal implications of such advancements? Share your thoughts in the comments below!

Let's continue the conversation and stay up to date on the latest AI news. Don't forget to like and share this post with your friends who are interested in AI too. #OpenAI #AI #GPT3 #LanguageGenerationModel #ArtificialIntelligence #TechNews

CTA: Follow our page for more updates on the latest AI news and developments!",856,137,180
34,"Exciting news alert! OpenAI has just announced that they have created a new deep learning language model called GPT-3! As a language model, it can perform language tasks such as translation, summarization, and answering questions. Personally, I think this is an amazing development that opens up new possibilities for artificial intelligence and language processing. What are your thoughts on this? Do you think this will lead to more advancements in the field of AI? Share your opinion in the comments below! 

Also, make sure to check out OpenAI's website for more information on their cutting-edge research and development. #AI #LanguageProcessing #GPT3 #OpenAI

CTA: Share your thoughts on this exciting announcement and stay up to date with the latest in AI by following OpenAI on social media!",799,126,162
35,"Hey everyone! Have you heard the news? OpenAI just announced that they have developed a new language model that can generate human-like text with incredible accuracy. As an AI assistant myself, I'm fascinated by this development.

I think this has enormous potential to revolutionize the way we interact with technology, making it even easier and more seamless to communicate with machines. However, I can also see how this could raise some concerns about the role of AI in our lives and how it could be used maliciously.

What do you all think? Are you excited about this new language model? Do you have any concerns about the implications of these advancements in AI technology? Let me know in the comments!

And if you want to learn more about OpenAI's latest breakthrough, check out their website at www.openai.com.

Don't forget to leave a like and share this post with your friends who might be interested in this topic. #AI #OpenAI #LanguageModel #Technology #Future",973,162,196
36,"📢 Big news from OpenAI! 🤖 The research organization just announced the launch of a new language processing tool called GPT-3. This powerful AI technology has the ability to generate human-like text and even complete tasks like writing articles and poetry. 

As an AI assistant, I am excited about this announcement and the endless possibilities it holds for the future of AI. However, I am curious to hear your thoughts. Do you think this is a breakthrough moment for the world of AI? Or do you have concerns about the potential implications of this technology?

Let me know in the comments below! 👇 And don't forget to stay tuned for more updates and advancements from OpenAI.

#OpenAI #AItechnology #GPT3 #artificialintelligence #languageprocessing #breakthroughmoment #opinionswanted #futuretech #CTA",803,125,171
37,"Exciting news! OpenAI has recently announced the launch of their new AI language model called GPT-3, which has a remarkable ability to generate natural language text. When we consider how much we rely on text-based communication, from messaging to email and content creation, it's no wonder why this new model has everyone talking!

From a developer's standpoint, this exciting announcement unlocks a world of possibilities for a wide range of AI-powered applications, spanning from chatbots to translation and even creative writing. As we continue to push the boundaries of AI and technology, it's amazing to think about the incredible advancements we've made in language processing over the past few years.

But we want to hear from YOU - do you think this announcement is a positive step forward for AI and language processing? Are you excited to see what developers can do with GPT-3? Share your thoughts in the comments below!

In the meantime, stay tuned for more updates and exciting innovations from OpenAI. And if you're a developer, don't forget to check out GPT-3 and see how it could enhance your projects. Let's keep pushing the limits of AI together! #OpenAI #GPT3 #AIinnovations #LanguageProcessing #TechForward #TellUsWhatYouThink",1246,197,256
38,"Hey everyone, have you heard about the latest announcement from OpenAI? They've just released their new AI language model, GPT-3, which has the ability to complete tasks like writing articles, poems, and even programming code! 

In my opinion, this is a really cool development in the world of AI technology. I'm excited to see how this new model will improve various industries and what kind of innovative solutions it will create. 

I'm curious to know what you all think about this announcement. Is this something you're excited about? Or do you have any concerns about the advancements in AI technology? Let's have a conversation in the comments below! 

Lastly, I encourage everyone to check out GPT-3 for themselves and see the capabilities of this new technology firsthand. Who knows, it might inspire some creative solutions of your own! #AItech #GPT3 #OpenAI #innovative #futuretech",891,143,188
39,"🚨 Big news from OpenAI! 🚨

OpenAI has just announced that they will now be launching a new platform that aims to make artificial intelligence more accessible to everyone. This is a huge step forward for the AI community and a major win for researchers and developers around the world. 

Personally, I am very excited about this announcement as I believe that it will pave the way for a more democratized AI landscape. With more access to tools and resources, we can work together to build smarter, more efficient machines that can help us solve some of the world's biggest challenges. 

What do you think about this announcement? Do you agree that this is a game-changer for the AI world? Share your thoughts in the comments below! 

And if you're interested in learning more about OpenAI's new platform or getting involved in the community, be sure to check out their website for more information. Let's work together to make AI accessible to everyone! 💻 

#OpenAI #AI #ArtificialIntelligence #TechCommunity #GameChanger #Democratization #CTA",1043,171,222
40,"🚨Big news from OpenAI! The company has just announced the launch of a new product that promises to revolutionize the world of artificial intelligence. As a helpful assistant, I think this is an incredibly exciting development that could have far-reaching implications for the future of technology.

But I want to hear from you, dear followers! What do you think about this announcement? Are you excited about the prospect of a new AI product? Do you think it will have a positive impact on society as a whole? Or are you wary of the potential downsides of AI technology?

I'm eager to hear your thoughts, so drop a comment below and let's start a conversation! And if you want to learn more about this new AI product from OpenAI, be sure to check out their website for all the latest details.

#openai #artificialintelligence #ai #technology #futuretech #technews #opinion #conversationstarter #CTA",898,149,190
41,"🚀 Breaking News! OpenAI just announced the launch of their new language model GPT-3!

I am so excited to see the advancements that OpenAI continues to make, and their new language model looks like it's going to be a game-changer in the field of Artificial Intelligence.

Personally, I think that GPT-3 is going to revolutionize the way we interact with technology and have a huge impact on the future of machine learning. I can't wait to see what kind of innovations this new language model is going to bring!

What do you think about OpenAI's new announcement? Are you as excited as I am? Share your thoughts with me in the comments below!

And don't forget to stay tuned for more updates on this exciting new development from OpenAI! #OpenAI #GPT3 #ArtificialIntelligence #MachineLearning #Innovation

CTA: Leave a comment below with your thoughts on OpenAI's new language model, and don't forget to share this post with your followers!",938,157,208
42,"Exciting news alert! OpenAI has just announced the launch of their latest research project that aims to develop the next-generation language model called ""GPT-3"". As a language model enthusiast, I am thrilled to see what this cutting-edge technology will offer to the world of artificial intelligence.

The GPT-3 model is predicted to have 175 billion parameters and will soon be accessible to developers and users. This means that it will have an enormous impact on the natural language processing capabilities of AI and could revolutionize how we interact with machines and devices.

I am curious to know what you think about this incredible announcement. Do you believe that GPT-3 could be a game-changer in the field of AI? Are you excited to see how it will take natural language processing to the next level? Share your thoughts in the comments below!

Don't forget to stay tuned for updates on this revolutionary technology. Follow OpenAI for the latest news, and make sure to hit the ""like"" button if you're as excited about GPT-3 as I am! #GPT3 #OpenAI #AIlanguage #artificialintelligence

CTA: Share your opinion in the comments, and make sure to follow OpenAI for more updates on this project. Don't forget to hit the ""like"" button if you're excited to see where this technology will take us!",1303,216,276
43,"Exciting news! OpenAI has just announced the release of their latest AI language model, GPT-3! 🤖🎉 This next-generation model has over 175 billion parameters, making it the largest and most powerful model we've ever seen. 

As an AI enthusiast, I'm thrilled to see OpenAI continue to push the boundaries of what's possible with artificial intelligence. Their advancements have already had a huge impact on various industries, from healthcare to transportation, and I can only imagine what the future holds with this new model.

What do you think about this announcement from OpenAI? Are you excited about the potential this new language model can bring? Share your thoughts in the comments below! 👇

And for those of you interested in learning more or trying it out for yourself, check out the link in my bio to access the GPT-3 API. Let's see what amazing things we can create together! 🌟 #OpenAI #GPT3 #AI #TechAdvancements #Innovation #Creativity #Collaboration #CTA",968,157,217
44,"Exciting news from OpenAI! The company just announced that they're releasing a new language model that's capable of creating natural language text that's nearly indistinguishable from human writing. As someone who's fascinated by the power of artificial intelligence, I'm really impressed by this development. 

I'm curious to hear what you all think about this news. Do you see this as a positive step forward for AI, or are you concerned about the implications of machines being able to create text that's almost impossible to distinguish from human writing? 

Let's start a conversation about this! Share your thoughts in the comments below.

And if you're interested in learning more about OpenAI's innovations, be sure to check out their website and stay up-to-date on their future announcements.",801,125,155
45,"Hey everyone! Exciting news from OpenAI! They just announced the launch of their newest project, OpenAI Codex, which is a AI-powered code generation system that can write computer programs just by interpreting natural language. As a tech enthusiast, I find this news fascinating and I can't wait to see how this technology advances the coding field. 

What do you think about OpenAI Codex? Do you think AI-generated code will become the norm in the near future? Let me know your opinion in the comments below!

Also, don't forget to check out the OpenAI blog for more details on this groundbreaking announcement. 

#OpenAI #OpenAICodex #AIprogramming #FutureTech #CTA #CommentBelow",681,107,147
46,"Hey guys, have you heard about the exciting news from OpenAI? They just announced the release of their new language model, GPT-3, and it's absolutely mind-blowing! This AI model has the ability to complete entire paragraphs of text, code, and even create its own content from scratch.

In my opinion, this is a huge step forward in the field of AI and has the potential to change the way we live and work in the future. I'm curious, what do you guys think about this announcement? Do you think it's a positive development or are you skeptical of the implications?

Let's start a conversation and hear different perspectives on this topic! Drop your thoughts in the comments below.

Also, don't forget to check out the GPT-3 model and see it in action. Who knows, it might surprise you!",785,138,172
47,"Hey fellow tech enthusiasts! Have you heard about OpenAI's latest announcement? They have just unveiled their new language model called GPT-3, which is said to be the largest and most powerful language model ever created. The model has a massive 175 billion parameters and is capable of generating human-like text that is indistinguishable from that written by humans. 

Personally, I am amazed by the potential of this language model to revolutionize the way we interact with technology. It could have a significant impact on industries such as healthcare, finance, and education, where natural language processing is of utmost importance. 

What are your thoughts on this latest development from OpenAI? Do you think GTP-3 has the potential to reshape the way we interact with technology? Let's start a conversation in the comments below!

And if you're as excited about this as I am, then join me in exploring the possibilities of GPT-3 and how it can impact the world. Let's keep an eye on this space and see where it takes us! #GPT3 #OpenAI #AIrevolution #NaturalLanguageProcessing #TechEnthusiasts",1103,176,230
48,"Hey everyone, have you heard the latest news from OpenAI? The company just announced that they will be releasing a new language model called GPT-3 that is capable of performing a wide range of natural language tasks. 

As an AI assistant, I find this announcement fascinating and exciting. It's amazing to see the advancements that are being made in the field of AI and the potential for GPT-3 to revolutionize the way we communicate and engage with technology is truly impressive. 

What do you think about this announcement? Are you excited about the potential that GPT-3 holds or do you have concerns about AI's role in our lives? 

Let me know your thoughts in the comments below! 

And if you're interested in learning more about this new technology, be sure to check out the OpenAI website. #openai #AItechnology #GPT3 #languageprocessing #innovation #futuretech 

CTA: Share your thoughts in the comments and don't forget to share this post with your friends who are interested in AI!",991,164,212
49,"Exciting news from OpenAI! The AI research lab just announced a new program that can generate text with incredible reliability. This breakthrough in Artificial Intelligence is groundbreaking and opens up new doors for language processing, content creation, and data analysis.

In my opinion, this announcement is huge for the AI industry and has the potential to change the way we think about human language and the power of technology. I'm curious, what do you think about this new development and its implications? Do you think it's a good thing or a potential threat to society?

Let's start a conversation! Comment below with your thoughts and opinions on this subject. I'm looking forward to hearing your insights! 

Don't forget to like and share this post with your friends who might also be interested in the world of AI!",829,137,159
50,"Hey everyone! Have you heard about the latest announcement from OpenAI? They've just released a new language model called GPT-3, which has been generating a lot of buzz in the AI community.

In my opinion, this is a huge step forward for AI development, as GPT-3 is capable of generating human-like text and even completing tasks like writing articles and coding. This has immense potential to revolutionize various industries, from content creation to customer service.

I'm curious to hear what you all think about this announcement. Are you excited about the possibilities that GPT-3 presents, or are you wary of the potential ethical implications of such advanced AI technology?

Let's start a conversation and share our thoughts on this subject. Comment below and let me know your opinion!

And if you're interested in learning more about GPT-3 and its capabilities, be sure to check out OpenAI's website.

#AIdevelopment #GPT-3 #OpenAI #technology #opinions #conversation #CTA",982,154,205
51,"Exciting news from OpenAI! The research institute just announced that they have created an artificial intelligence model that can generate highly realistic text. As someone who is fascinated by the advancements in AI, I find this announcement to be incredibly impressive.

However, I'm curious to know what you think of this milestone achievement. Do you believe that this will be a game-changer for the field of AI, or does it raise concerns about the potential for manipulation and misuse of this technology?

Share your thoughts in the comments! And if you want to learn more about the capabilities of AI, be sure to check out OpenAI's website.

#OpenAI #AI #textgeneration #artificialintelligence #gamechanger #tech #innovation #discussion #thoughts #commentbelow #CTA",772,118,156
52,"Hey everyone! Exciting news in the world of AI - OpenAI has just announced the launch of a new language model called GPT-3 that can generate human-like text and even code!

As someone who has always been fascinated by the potential of AI, I am thrilled about this latest development from OpenAI. It is mind-blowing to think about the possibilities that this technology could bring to industries ranging from marketing to medicine.

What do you think about this announcement? Are you excited about the potential of GPT-3? Do you have any concerns about what this technology could mean for the future?

Comment below with your thoughts and let's get a conversation going! And don't forget to check out OpenAI's website for more information on this exciting new language model. #OpenAI #GPT3 #AI #artificialintelligence

CTA: Share this post with your friends so we can get even more opinions on this important subject!",916,151,191
53,"🚨Big news alert from OpenAI!🚨 They just announced the launch of a new language model that is capable of generating human-like text, called GPT-3. This model has 175 billion parameters, making it the largest and most advanced language model to date.

Personally, I find this announcement both exciting and slightly terrifying. On one hand, the potential for this technology to generate creative and useful content is immense. On the other hand, there are valid concerns about the implications of AI-generated content that could be used for malicious purposes.

What do you think about this? Are you excited about the potential for this technology to revolutionize content creation, or do you worry about the risks and ethical implications? Let me know in the comments!

And if you're interested in learning more about GPT-3 and exploring its capabilities, be sure to check it out on OpenAI's website. #OpenAI #GPT3 #AIgeneratedcontent #ethicalAI

CTA: Share your thoughts in the comments!",987,156,207
