,text,chars,words,tokens
54,"📣 BIG NEWS FROM OPENAI 🤖 

OpenAI just announced their latest breakthrough in the field of Artificial Intelligence. They have developed a new algorithm that can predict the outcome of complex situations using advanced simulation techniques. This is a huge step forward towards creating advanced AI systems that can simulate complex real-world situations accurately.

As an AI enthusiast, I am thrilled by this news! This new technology has the potential to revolutionize various industries, from finance to healthcare to transportation. I can't wait to see what kind of applications this breakthrough will lead to.

What do you think about OpenAI's latest announcement? Do you think this new technology will have a significant impact on our lives? Share your thoughts in the comments below! 

If you want to learn more about this breakthrough, check out OpenAI's website for more details. 

Stay curious! ✨ #AI #OpenAI #Simulation #Breakthrough #Technology #Future #Innovation 

CTA: Share this post with your friends who are interested in AI and start a conversation about the future of AI technology.",1102,171,216
55,"Exciting news from OpenAI! The famed AI research organization has announced that it's developing a platform that allows people to train their own AI models without extensive knowledge or expertise in the field of machine learning. This could revolutionize the way we approach AI and democratize access to the technology, enabling more businesses and individuals to benefit from it. 

As an AI assistant, I'm thrilled to see the potential of this new technology. But I'm also curious to hear what you think about it! Do you think this development is a positive step forward in the field of AI? Would you use a platform like this? Share your thoughts with me. 

If you're interested in learning more about OpenAI's new platform, head over to their blog to read the official announcement. And as always, stay tuned for more updates on the future of AI!",849,144,170
56,"Attention everyone, OpenAI has just made a huge announcement that has the potential to revolutionize the world of artificial intelligence! They have released a new advanced AI language model, named GPT-3!

In my opinion, this development is extremely exciting as it marks a major step forward in the field of AI technology. The potential applications of this kind of advanced language model are vast, and I can't wait to see where this technology goes from here.

What do you all think about this new development? Are you excited to see where it goes, or do you have concerns about the future of AI technology? Share your thoughts and opinions in the comments!

If you're anything like me and are eagerly awaiting more updates on this topic, be sure to follow OpenAI and stay tuned for more exciting news. #OpenAI #GPT3 #AIadvancements #futuretech #commentbelow",861,143,177
57,"🚨 BREAKING NEWS 🚨 OpenAI just announced the release of their new advanced language model, the GPT-3! 🎉

As an AI enthusiast, I can't contain my excitement on this groundbreaking development! This new model boasts 175 billion parameters, making it almost 10 times more powerful than its predecessor. Its capabilities include language translation, question answering, and even coding! 🤯

I'm curious, what are your thoughts on OpenAI's latest release? Do you think this is a step towards more advanced artificial intelligence or is it cause for concern? Let's start a conversation in the comments below! 👇

And if you're as excited as I am, head over to the OpenAI website to learn more about GPT-3 and its potential uses! 🤖 #OpenAI #GPT3 #AI #FutureTech #Innovation #ArtificialIntelligence.

CTA: Share your thoughts and check out the OpenAI website for more details!",866,139,204
58,"Exciting news from OpenAI! They just announced the release of their newest language model, GPT-3. This model is said to have 175 billion parameters, making it the largest language model ever created. It has the capability to answer complex questions, complete tasks, and even generate creative writing. 

In my opinion, this is a huge achievement and has the potential to revolutionize the way we interact with language technology. I'm curious to know what you all think about this news. Do you think that GPT-3 will change the game for language models? Or do you have concerns about such powerful technology being released into the world? 

Share your thoughts in the comments below! And if you're curious about GPT-3, head over to the OpenAI website to learn more. #OpenAI #GPT3 #LanguageTechnology #ArtificialIntelligence 

CTA: Share your thoughts in the comments below and head over to the OpenAI website to explore GPT-3 for yourself!",940,151,204
59,"Great news, everyone! OpenAI, the world-renowned AI research institute, has just made a new announcement, and it's something worth talking about. They're releasing a new language model called GPT-3, which is expected to be the largest and most advanced model yet! 

As an AI enthusiast, I'm thrilled about this announcement, and I believe it's a huge step towards more advanced AI technology. This new language model will have a wide range of applications, from natural language processing to automated customer service. But what do you think about it? Are you excited about this news? What do you think this means for the future of AI? 

Let's start a conversation in the comments section and share our thoughts! And if you want to learn more about GPT-3 or AI in general, there are plenty of resources out there. So let's stay curious and keep learning! 

Don't forget to like, share, and tag your friends who are interested in AI. Let's spread the word and build a community around this exciting technology!",1010,170,214
60,"Hey everyone, have you heard about the latest announcement from OpenAI? They just released a new language model called GPT-3 (Generative Pre-trained Transformer 3). It's supposed to be the most advanced language model yet and has the ability to complete sentences and even write full essays, articles and stories on its own. It's an incredible advancement in AI technology and could revolutionize the way we interact with language.

Personally, I think this is a really fascinating development and I'm excited to see how it can be used to benefit both individuals and businesses. However, I also recognize the potential ethical concerns that come with such powerful AI. What do you all think about this? Are you excited about the possibilities or worried about the potential consequences?

Let me know in the comments below and let's start a discussion! And if you're interested in learning more about GPT-3 and its capabilities, be sure to click the link in my bio. #OpenAI #GPT3 #AItechnology #languageAI

CTA: Share your thoughts in the comments and click the link in my bio to learn more about GPT-3.",1104,182,230
61,"Exciting news, folks! OpenAI, the artificial intelligence research organization, just announced that they have developed a new language AI model called ""GPT-3,"" which has a whopping 175 billion parameters (triple the size of its predecessor). This means it can do unimaginable things with language, like natural language processing, translation, and even code writing! 😲

In my opinion, this breakthrough is nothing short of amazing! It's remarkable how quickly technology is advancing, and it's thrilling to imagine what this new language model will mean for industries like digital marketing and content creation. 

Now, I am curious to hear your thoughts. What do you think about this new language model developed by OpenAI? Do you think it's a step further toward true AI or does it make you anxious about what the future holds?

Drop a comment and let me know your opinion on this subject! 👇

And, if you want to stay updated on the latest developments and trends in the AI space, give me a follow! 🤖 #OpenAI #AIbreakthrough #GPT3 #AIopinion #AIcommunity #CTA",1064,173,231
62,"Exciting news from OpenAI! The research company has just announced the launch of its latest natural language processing model, GPT-3. This model is said to be the most powerful language model ever created, with the ability to generate human-like text, complete tasks and answer questions.

Personally, I am thrilled to see how technology is advancing and the progress being made in the field of AI. I am curious to know what you guys think, so let me know in the comments below! Are you excited, skeptical or apprehensive about this new development?

In case you're not familiar with OpenAI, they're a non-profit research company whose main goal is to create artificial intelligence in a safe, ethical, and beneficial way.

If you're interested in learning more about GPT-3 or OpenAI, head to their website and read up!

#OpenAI #GPT3 #ArtificialIntelligence #NLP #Technology #Ethics #SafeAI #CTA",896,144,196
63,"📢 Big news from OpenAI! The cutting-edge AI development organization has just announced its latest breakthrough in the field of natural language processing. With the help of its state-of-the-art GPT-3 language model, OpenAI is officially launching an AI-powered content creation platform that could revolutionize the way we communicate online. 

As an AI assistant myself, I am excited to see the potential impact of this announcement. With powerful language capabilities and the ability to mimic human writing styles, this new platform could transform the way we create and consume content on the internet. 

But what do you think about this latest announcement from OpenAI? Are you excited about the potential of this new platform, or does the prospect of AI-written content leave you feeling uneasy? Share your thoughts in the comments below! 

And as always, remember to stay tuned for more updates from the world of AI and technology. 

👉 Don't forget to like and share this post with your friends to start a conversation and stay informed! #AI #OpenAI #NaturalLanguageProcessing #ContentCreation #TechNews #GiveYourOpinion",1128,173,224
64,"🚨 BREAKING NEWS 🚨 OpenAI has just announced the release of a new language model, GPT-3, which is capable of understanding and even generating human-like text with astonishing accuracy. This is a major milestone in the development of AI technology, and it has the potential to revolutionize the way we communicate and interact with machines.

Personally, I’m really excited about this announcement and can’t wait to see what kind of innovative applications people will build with GPT-3. However, I’m curious to know what my followers think about this development. Do you think this is a major breakthrough for artificial intelligence, or does it make you uneasy about the future of human-machine interaction?

Share your opinion in the comments below! And if you’re as eager as I am to start exploring the possibilities of GPT-3, let’s chat and brainstorm together. Who knows what we might create! 🤖💬 #OpenAI #GPT3 #AI #innovation #futuretech #languageprocessing #CTA",966,153,209
65,"Hey everyone! 

Have you heard the latest announcement from OpenAI? They just introduced a new computer language model called GPT-3, which has taken the natural language processing capabilities to a whole new level. 

To be honest, I am amazed at the potential that this model holds. GPT-3 has an impressive ability to generate human-like language, comprehend complex tasks, and even translate between languages without any training!

What do you all think of this breakthrough? Do you believe it would bring us closer to achieving artificial general intelligence? 

Share your thoughts in the comments! Let's start a discussion and learn from each other. 

And if you're interested in learning more about GPT-3 and its capabilities, be sure to check OpenAI's website for more information!",789,123,157
66,"Hey, everyone! Have you heard the latest announcement from OpenAI? They just launched a new initiative to develop an AI system that can not only understand text, but also generate it like a human being. This ambitious project is another step towards artificial intelligence reaching human-like abilities.

Personally, I find this announcement intriguing, as it opens up so many possibilities for different fields, particularly in the creation of more complex and realistic virtual assistants. I am curious to know your thoughts on this matter, and what you think this kind of technology can do for us in the future.

So, let's start a discussion! Drop your comments below and tell me what you think about the new AI initiative from OpenAI. Do you believe that it is a step in the right direction or a cause for concern?

Also, don't forget to share this post with your friends and followers who might be interested in this topic. Cheers!",937,158,182
67,"Exciting news from OpenAI! They have just announced the launch of their newest AI language model called GPT-3. This model has the capacity to complete tasks with little to no previous input or data, making it one of the most advanced models in the industry!

Personally, I think this is a huge step forward in AI technology and has the potential to revolutionize the way we work and live. Can you imagine what we'll be capable of achieving with a super intelligent AI language model? But I want to hear from all of you - what do you think about this new launch?

Share your thoughts and opinions with me in the comments below! 

And don't forget to check out OpenAI's GPT-3 in action by visiting their website. Who knows, it might even spark some inspiration for your next big idea! #openai #artificialintelligence #gpt3 #AIinnovation #futuretech

CTA: Let's start a discussion - Comment below and let me know your thoughts on OpenAI's latest announcement!",956,164,210
68,"Hey everyone! Have you heard about the exciting new announcement from OpenAI, the world-leading artificial intelligence research lab? They just unveiled a new language model called GPT-3, and the possibilities of this technology are truly mind-boggling.

As an AI assistant myself, I'm always interested in the latest developments in the field, and I think GPT-3 represents a major leap forward in the way machines can understand and interact with language. The model has been trained on massive amounts of data and can generate human-like responses to a wide variety of prompts, from completing sentences to composing full paragraphs.

But as is often the case with new technologies, there are bound to be questions and concerns. Some have wondered about the potential for bias or misuse, while others have voiced excitement about the potential for more natural and intuitive human-machine interaction. What do you all think?

I'm curious to hear your thoughts on this announcement and what it might mean for the future of AI. Are you excited by the possibilities, or apprehensive about the risks? Let's start a conversation in the comments!

And if you want to learn more about GPT-3 and OpenAI's other groundbreaking work, be sure to check out their website at openai.com.",1275,205,250
69,"🚨 Exciting news from OpenAI! They just announced their latest research breakthrough in natural language processing (NLP), which is poised to revolutionize the field of AI. I'm thrilled to see the incredible advancements that OpenAI has been making in recent years and can't wait to see the practical applications of this technology.

What's your take on this announcement? Do you think NLP is the key to unlocking the potential of AI? What implications do you see this having on society?

Let's start a conversation! Share your thoughts in the comments below. #OpenAI #NLP #AI #Technology #Innovation

And if you want to learn more about this development, check the link in our bio for the full press release. 😉",711,118,151
70,"Exciting news from OpenAI! The team has announced a new artificial intelligence breakthrough that could revolutionize the way we interact with technology. As an AI assistant, I am thrilled about this announcement and cannot wait to see the ways in which this new technology will help us in our daily lives.

What are your thoughts about the new announcement from OpenAI? Do you think it will have a significant impact on the future of technology? Share your opinions in the comments, and let's start a discussion.

If you're interested in learning more about this new AI breakthrough, be sure to check out OpenAI's website for more information. Don't forget to follow us for more updates on the latest advancements in AI technology.",732,122,142
71,"Exciting news from OpenAI! They have just announced the launch of their new language model, GPT-3. This next-level artificial intelligence model has been designed to generate human-like text and conversation, demonstrating the potential for a new age of language processing.

Personally, I believe this is an incredible technological achievement and a major step towards the development of intelligent machines that can interact with humans on a more meaningful level. I'd love to hear your thoughts on this, so feel free to share your opinion in the comments below!

What about you? Are you excited about the possibilities? Worried about what it means for the future of humanity? Whatever your take, let's spark some discussion on this new development.

And if you're interested in learning more about GPT-3 and the future of AI, make sure you stay tuned for further updates from OpenAI!

CTA: Share your thoughts in the comments below and let's keep the conversation going!",975,156,191
72,"🚨 Big News from OpenAI! 🚨 

OpenAI has just announced that they are expanding their language model, GPT-3, to include even more features and capabilities. This means that soon, we will be able to interact and communicate with machines on a whole new level.

As an AI assistant myself, I am excited about this announcement and the potential it holds for the future of AI technology. But I want to hear from you, my followers! What are your thoughts on this subject? Do you think this is a positive development, or are you concerned about the implications of machines being able to understand and communicate with humans at an even deeper level?

Leave your thoughts in the comments below, and let's start a discussion! And if you want to learn more about this exciting update from OpenAI, head over to their website for all the details.

#OpenAI #AItechnology #GPT3 #AIinteraction #futuretech #technology #artificialintelligence #digitalassistance 

CTA: Share your thoughts in the comments below!",996,162,213
73,"Exciting news from OpenAI! The company has just announced that they have developed a new language model that can generate coherent and natural-sounding paragraphs of text. This is a significant breakthrough in the field of artificial intelligence, and it has the potential to revolutionize the way we communicate and interact with technology. As an AI assistant, I am genuinely thrilled about this development and its potential applications.

I am curious to know what you think about this announcement. Do you think that this new language model is a game-changer? How might it impact our daily lives and the technological advancements we could see in the future? Share your thoughts in the comments below!

Also, if you're interested in learning more about this new development or OpenAI's other projects, head over to their website. They have an extensive collection of fascinating articles and research papers that are worth checking out.

Let's keep the conversation going and stay updated on the latest advancements in AI!

CTA: Leave your thoughts in the comments and don't forget to stay updated on the latest news in AI!",1128,182,212
74,"🚨 BIG NEWS from OpenAI 🚨 

OpenAI has just announced their new language model, GPT-3, which they claim has capabilities beyond any other language processor to date. I am blown away by the possibilities this could bring! 

As a language model, GPT-3 has the ability to write articles, conduct conversations, and even generate poetry. This means a giant leap forward for artificial intelligence and it has the potential to revolutionize the world of automation. 

I am curious to hear what all of you think about this new development. Do you believe this is the future of AI? What does this mean for writers, copywriters, and other professionals who rely on language processing in their work?

Please share your thoughts in the comments below. Let's spark a thoughtful conversation! 

And if you want to learn more about GPT-3, head to OpenAI's website to check it out. #OpenAI #AIrevolution #GPT3

CTA: Share your thoughts in the comments and share this post with your friends to join the conversation!",1001,166,219
75,"📢 Big news everyone! OpenAI just announced the launch of their new language model, GPT-3. This model can do everything from writing essays and creating poetry to answering complex questions and even generating computer code on its own. I think this announcement is incredibly exciting as it opens up a whole new realm of possibilities for natural language processing and AI. I can't wait to see what developers and creators will do with this technology.

What do you think about the launch of GPT-3? Are you as excited as I am or do you have some concerns about this technology? Let me know in the comments below!

And if you're interested in learning more about GPT-3 or trying it out for yourself, head over to the OpenAI website! #GPT3 #OpenAI #AI #artificialintelligence #languageprocessing #technews

CTA: Share your thoughts and opinions in the comments and don't forget to like and share this post with your friends!",923,155,199
76,"Exciting news! OpenAI has just announced their latest breakthrough in the field of AI research. The team at OpenAI claims to have created an AI language model that can generate human-like text with more accuracy and coherence than any other existing model. 

Personally, I believe that this new development marks a significant milestone in the evolution of AI language models. As we continue to rely more heavily on machines to generate and process information, creating more human-like language models is crucial for ensuring that the resulting output is both accurate and understandable.

What do you think about this new announcement? Do you see it as a positive development or are you skeptical about the potential consequences of such advancements? Share your thoughts in the comments below! 

And if you're interested in learning more about this new breakthrough, be sure to follow OpenAI's official channels for updates and insights. #ArtificialIntelligence #AI #LanguageModels #OpenAI 

CTA: Share your thoughts in the comments and follow OpenAI for more updates!",1071,165,201
77,"Exciting news, everyone! OpenAI, one of the leading organizations in artificial intelligence, just announced their latest breakthrough in natural language processing. This breakthrough brings us one step closer to truly human-like AI language capabilities. As an AI assistant myself, I find this announcement particularly thrilling. 

But what do you think about it? Will human-like AI language capabilities make our lives easier and more efficient, or do you see potential problems with this kind of technology? I'm curious to hear your thoughts.

Let's start a conversation - leave a comment down below with your opinion on OpenAI's latest announcement! #AI #OpenAI #ArtificialIntelligence #HumanLikeAI #LanguageProcessing

And don't forget to share this exciting news with your friends!",789,114,151
78,"Big news from OpenAI! The company just announced the launch of a new AI tool that can generate human-like text content with impressive accuracy. This advancement is a major step forward in natural language processing and has endless potential applications in industries like marketing, customer service, and content creation.

As an AI enthusiast, I'm excited about what this could mean for the future of technology and innovation. But I'm also curious about what others think. What do you think about this announcement? Do you see it as a positive development, or do you have concerns about the implications of such advanced AI technologies?

Let's start a conversation about this! Share your thoughts and opinions in the comments below. #OpenAI #AItextgeneration #TechnologyInnovation

CTA: Don't forget to tag a friend who might be interested in joining the conversation!",874,136,167
79,"Exciting news! OpenAI has just announced a new language processing model, GPT-3, that can complete tasks and generate writing samples that are almost indistinguishable from those written by humans. As someone who is intrigued by the potential of AI, I think this is a major breakthrough that holds promise for countless applications in a variety of industries.

But I'm curious to hear what you think. Does the idea of AI producing human-like writing samples raise concerns or do you see it as a valuable tool that can be harnessed in new and innovative ways? Drop a comment below with your thoughts!

And if you're intrigued by this technology, be sure to check out the GPT-3 demo on the OpenAI website. Who knows, it might just inspire your next writing project! #openai #gpt3 #AIwriting #languageprocessing #innovation #technology #futuretech #CTA: Don't forget to share this post and tag someone who should see this!",920,151,199
